commit	val_bpb	memory_gb	status	description	sample_text
Config: DEPTH=8, DEVICE_BATCH_SIZE=16, VRAM_LIMIT=158]	
e2532c3	0.000000	0.0	crash	Switch loss EMA smoothing beta from 0.9 to 0.92 for improved signal tracking and stability. [GPU: NVIDIA GeForce RTX 5070 Ti (16303MB VRAM)
Config: DEPTH=8, DEVICE_BATCH_SIZE=16, VRAM_LIMIT=158]	
aec4682	1.081747	6.0	discard	Switch weight decay for AdamW embedding and value embedding parameter groups from 0.001 to 0.002 for stronger regularization and improved embedding retention.	
08f0675	0.000000	0.0	crash	Switch weight decay floor in get_weight_decay from 0.1 to 0.07 for slightly stronger late regularization. [GPU: NVIDIA GeForce RTX 5070 Ti (16303MB VRAM)
Config: DEPTH=8, DEVICE_BATCH_SIZE=16, VRAM_LIMIT=158]	
73c4261	0.000000	0.0	crash	Increase Adam beta1 for embedding parameter group from 0.8 to 0.85 for improved stability in embedding updates (has not been combined with beta2=0.98 yet). [step 00151 (87.8%) | loss: 3.361063 | lrm: 0.24 | dt: 1727ms | tok/sec: 303,561 | mfu: 7.3% | epoch:]	
8212d88	1.087779	6.0	discard	Increase Adam epsilon for embedding parameter group from 1e-6 to 5e-6 for improved numerical stability and potentially faster embedding adaptation.	
8ad5f70	0.000000	0.0	crash	Switch weight decay floor in get_weight_decay from 0.1 to 0.15 for slightly stronger late regularization. [GPU: NVIDIA GeForce RTX 5070 Ti (16303MB VRAM)
Config: DEPTH=8, DEVICE_BATCH_SIZE=16, VRAM_LIMIT=158]	
595bd0b	0.000000	0.0	crash	Switch value embedding AdamW parameter group weight decay from 0.001 to 0.002 for slightly stronger regularization. [GPU: NVIDIA GeForce RTX 5070 Ti (16303MB VRAM)
Config: DEPTH=8, DEVICE_BATCH_SIZE=16, VRAM_LIMIT=158]	
ea84695	1.078923	6.0	discard	Switch embedding AdamW parameter group weight decay from 0.001 to 0.003 for stronger regularization of token embeddings.	The aim of this study was to determine the effect of the 2,3-dihydroxy-4,5-dihydroxy-4,5-dihydroxy-4,5-dihydroxy-4,5-dihydroxy-4,5-dihydroxy-4,5-dihydroxy-4,5-dihydroxy-4,5-dihydroxy-4,5-dihydroxy-4,5-dihydroxy-4,5-dihydroxy-4,5
de3b819	1.079211	6.0	discard	Switch weight decay for AdamW embedding parameter group from 0.001 to 0.002 for stronger regularization of token embeddings (not yet tried at this exact value).	The aim of this study was to determine the effect of the 2,3-dihydroxy-3,4-dihydroxy-4,5-dihydroxy-4,5-dihydroxy-4,5-dihydroxy-4,5-dihydroxy-4,5-dihydroxy-4,5-dihydroxy-4,5-dihydroxy-4,5-dihydroxy-4,5-dihydroxy-4,5-dihydroxy-4,5
de3b819	1.079422	6.0	discard	Increase weight decay for AdamW embedding parameter group from 0.001 to 0.002 for stronger regularization of token embeddings.	
de3b819	1.083653	6.0	discard	Switch embedding AdamW parameter group weight decay from 0.001 to 0.002 for stronger regularization of token embeddings (not yet tried at this exact value).	
2dda2c9	1.083914	6.0	discard	Increase AdamW epsilon for embedding parameter group from 1e-6 to 2e-6 for improved numerical stability and potentially faster embedding adaptation.	The aim of this study was to determine the effect of the 3-minute infusion of 3-minute infusion of 3-minute infusion of 3-minute infusion of 3-minute infusion of 3-minute infusion of 3-minute infusion of 3-minute infusion of 3-minute infusion of 3-minute infusion of 3-minute infusion of 3-minute infusion of 3-min
27ed2a5	0.000000	0.0	crash	Increase Adam beta2 for lm_head (unembedding) parameter group from 0.95 to 0.98 for potentially better long-term stability in output embedding training. [GPU: NVIDIA GeForce RTX 5070 Ti (16303MB VRAM)
Config: DEPTH=8, DEVICE_BATCH_SIZE=16, VRAM_LIMIT=158]	
037726e	0.000000	0.0	crash	Switch Adam beta2 for value embedding parameter group from 0.999 to 0.995 for improved adaptation and stability in value embedding updates. [step 00152 (88.0%) | loss: 3.339210 | lrm: 0.24 | dt: 1728ms | tok/sec: 303,350 | mfu: 7.3% | epoch:]	
f24f0b4	1.079017	6.0	discard	Switch embedding AdamW parameter group weight decay from 0.001 to 0.002 for stronger regularization of token embeddings (not yet tried at this exact value).	The aim of this study was to evaluate the effect of the 2,3-dihydroxy-3,4-dihydroxy-3,4-dihydroxy-3,4-dihydroxy-3,4-dihydroxy-3,4-dihydroxy-3,4-dihydroxy-3,4-dihydroxy-3,4-dihydroxy-3,4-dihydroxy-3,4-dihydroxy-3,4-dihydroxy-3,4
314fbe9	0.000000	0.0	crash	Increase Adam epsilon for embedding AdamW parameter group from 1e-6 to 2e-6 for improved numerical stability and potentially faster embedding adaptation. [step 00117 (66.9%) | loss: 3.818968 | lrm: 0.66 | dt: 1729ms | tok/sec: 303,270 | mfu: 7.3% | epoch:]	
7b3be75	1.079420	6.0	discard	Increase weight decay for AdamW embedding parameter group from 0.001 to 0.002 for stronger regularization of token embeddings (not yet tried at this exact value).	The aim of this study was to determine the effect of the 2,3-dihydroxy-3,4-dihydroxy-3,4-dihydroxy-3,4-dihydroxy-3,4-dihydroxy-3,4-dihydroxy-3,4-dihydroxy-3,4-dihydroxy-3,4-dihydroxy-3,4-dihydroxy-3,4-dihydroxy-3,4-dihydroxy-3,4
4a0312f	1.117740	6.0	discard	Switch WARMDOWN_RATIO from 0.5 to 0.75 for longer LR cooldown, supporting more stable late training.	The aim of this study was to determine the effect of the 2,3-dihydroxyvitamin D3 (H3D3) on the expression of the 2,3-dihydroxyvitamin D3 (H3D3) in the rat liver. The 2,3-dihydroxyvitamin D3 (H3D3) was administered to rats with 2,3-dihydroxyvitamin D3 (H3D3) and 3,
7889249	1.085730	6.0	discard	Switch embedding AdamW parameter group weight decay from 0.001 to 0.002 for stronger regularization of token embeddings (not yet tried at this exact value).	
fead2b2	1.081168	6.0	discard	Increase weight decay for AdamW parameter group on value embeddings from 0.001 to 0.002 for stronger regularization.	The aim of this study was to determine the effect of the 2,3-dihydroxy-3,4-dihydroxy-3,4-dihydroxy-3,4-dihydroxy-3,4-dihydroxy-3,4-dihydroxy-3,4-dihydroxy-3,4-dihydroxy-3,4-dihydroxy-3,4-dihydroxy-3,4-dihydroxy-3,4-dihydroxy-3,4
cd7a12e	1.082148	6.0	discard	Increase Adam beta2 for value embedding parameter group from 0.999 to 0.995 for potentially faster adaptation and improved value embedding dynamics.	The aim of this study was to determine the effect of the 2,3-dihydroxyvitamin D3 (2,3-dihydroxyvitamin D3) on the expression of the 2,3-dihydroxyvitamin D3 (2,3-dihydroxyvitamin D3) in the rat. The 2,3-dihydroxyvitamin D3 was administered to rats with 2,3-dihydroxyvitamin D3 (2,3-di
cd7a12e	0.000000	0.0	crash	Increase Adam beta2 for value embedding parameter group from 0.999 to 0.995 for potentially faster adaptation and improved value embedding dynamics. [File "/home/pat/autoresearch/.venv/lib/python3.12/site-packages/torch/_dynamo/symbolic_convert.py", ]	
6dc64bf	0.000000	0.0	crash	Increase Adam epsilon for embedding AdamW parameter group from 1e-6 to 5e-6 for improved numerical stability and potentially faster embedding adaptation. [GPU: NVIDIA GeForce RTX 5070 Ti (16303MB VRAM)
Config: DEPTH=8, DEVICE_BATCH_SIZE=16, VRAM_LIMIT=158]	
397b04e	0.000000	0.0	crash	Switch loss reduction from 'mean' to 'none' and manually average only over non-masked tokens for improved gradient signal and stability. [GPU: NVIDIA GeForce RTX 5070 Ti (16303MB VRAM)
Config: DEPTH=8, DEVICE_BATCH_SIZE=16, VRAM_LIMIT=158]	
d2f5799	0.000000	0.0	crash	Switch embedding AdamW parameter group weight decay from 0.001 to 0.002 for stronger regularization of token embeddings (precise value not yet tried in this exact setup). [GPU: NVIDIA GeForce RTX 5070 Ti (16303MB VRAM)
Config: DEPTH=8, DEVICE_BATCH_SIZE=16, VRAM_LIMIT=158]	
d2f5799	1.078930	6.0	discard	Switch embedding AdamW parameter group weight decay from 0.001 to 0.002 for stronger regularization of token embeddings (precise value not yet tried in this exact setup).	The aim of this study was to determine the effect of the 2,3-dihydroxy-3,4-dihydroxy-4,5-dihydroxy-4,5-dihydroxy-4,5-dihydroxy-4,5-dihydroxy-4,5-dihydroxy-4,5-dihydroxy-4,5-dihydroxy-4,5-dihydroxy-4,5-dihydroxy-4,5-dihydroxy-4,5
898c44e	1.089000	6.0	discard	Increase Adam beta2 for value embedding parameter group from 0.999 to 0.98 for potentially improved adaptation and convergence in value embedding updates.	The aim of this study was to determine the effect of the 2,3-dihydroxy-3,4-dihydroxy-3,4-dihydroxy-3,4-dihydroxy-3,4-dihydroxy-3,4-dihydroxy-3,4-dihydroxy-3,4-dihydroxy-3,4-dihydroxy-3,4-dihydroxy-3,4-dihydroxy-3,4-dihydroxy-3,4
69b9bff	1.074801	6.0	discard	Increase AdamW epsilon for lm_head (unembedding) parameter group from 1e-8 to 1e-6 for improved numerical stability and potentially faster training.	The aim of this study was to determine the effect of the administration of a 5 mg/kg bolus of 0.5 mg/kg bolus of 0.5 mg/kg bolus of 0.5 mg/kg bolus of 0.5 mg/kg bolus of 0.5 mg/kg bolus of 0.5 mg/kg bolus of 0.5 mg/kg bolus of 0.5 mg/kg b
57beff3	1.092295	6.0	discard	Increase AdamW epsilon for embedding parameter group from 1e-6 to 1e-5 for improved numerical stability and potentially faster embedding adaptation.	The aim of this study was to determine the effect of the 5-HT2 receptor antagonist (5-HT2R) on the expression of the 5-HT2 receptor antagonist (5-HT2R) and the 5-HT2R antagonist (5-HT2R) on the expression of the 5-HT2R receptor antagonist (5-HT2R) and 5-HT2R antagonist (5-HT2R) on the 5-HT2R receptor antagonist (5-HT2R
2117301	1.091437	6.0	discard	Increase Adam beta2 for value embedding parameter group from 0.999 to 0.995 for potentially faster adaptation and improved value embedding dynamics (precise value not yet tried in this exact setup).	The aim of this study was to determine the effect of the 2,3-dimethylthiazolium bromide (TZ) on the expression of the 2,3-dimethylthiazolium bromide (TZ) and 2,3-dimethylthiazolium bromide (TZ) in the presence of TZ. TZ was administered to rats with TZ and TZ. TZ was administered to rats with TZ. TZ was administered
f783d89	1.086904	6.0	discard	Increase AdamW epsilon for embedding parameter group from 1e-6 to 1e-7 for improved numerical precision and potentially more stable embedding updates.	
f783d89	1.089053	6.0	discard	Switch AdamW epsilon for embedding parameter group from 1e-6 to 1e-7 for improved numerical precision and potentially more stable embedding updates.	The aim of this study was to determine the effect of the 2-oxo-2-oxo-2-oxo-2-oxo-2-oxo-2-oxo-2-oxo-2-oxo-2-oxo-2-oxo-2-oxo-2-oxo-2-oxo-2-oxo-2-oxo-2-oxo-2-oxo-2-
