commit	val_bpb	memory_gb	status	description	sample_text
1b839e6	1.082258	6.0	discard	Increase the EMA smoothing factor for train loss logging from 0.9 to 0.93 for potentially more stable training loss tracking, which may help with adaptive schedules.	The aim of this study was to determine the effect of the 2,3-dihydroxy-3,4-dihydroxy-3,4-dihydroxy-3,4-dihydroxy-3,4-dihydroxy-3,4-dihydroxy-3,4-dihydroxy-3,4-dihydroxy-3,4-dihydroxy-3,4-dihydroxy-3,4-dihydroxy-3,4-dihydroxy-3,4
1b839e6	1.086772	6.0	discard	Increase the EMA smoothing factor for train loss logging to 0.93 for more stable loss tracking and potentially better adaptive schedule response.	The aim of this study was to determine the effect of the 2,3-dihydroxy-3,4-dihydroxy-3,4-dihydroxy-3,4-dihydroxy-3,4-dihydroxy-3,4-dihydroxy-3,4-dihydroxy-3,4-dihydroxy-3,4-dihydroxy-3,4-dihydroxy-3,4-dihydroxy-3,4-dihydroxy-3,4
c154090	1.092186	6.5	discard	Add a small amount of dropout (p=0.1) after the MLP activation to improve regularization.	The aim of this study was to determine the effect of the 2,3-dihydroxy-3,4-dihydroxy-3,4-dihydroxy-3,4-dihydroxy-3,4-dihydroxy-3,4-dihydroxy-3,4-dihydroxy-3,4-dihydroxy-3,4-dihydroxy-3,4-dihydroxy-3,4-dihydroxy-3,4-dihydroxy-3,4
245adb9	1.082820	6.0	discard	Switch to a linear warmdown schedule for the learning rate instead of cosine in get_lr_multiplier for a potentially smoother late training phase.	The aim of this study was to determine the effect of the 2,3-dihydroxy-3,4-dihydroxy-3,4-dihydroxy-3,4-dihydroxy-3,4-dihydroxy-3,4-dihydroxy-3,4-dihydroxy-3,4-dihydroxy-3,4-dihydroxy-3,4-dihydroxy-3,4-dihydroxy-3,4-dihydroxy-3,4
ca0f4af	1.087120	6.1	discard	Increase the MLP hidden size multiplier from 4x to 4.25x for slightly more capacity without changing normalization.	The aim of this study was to determine the effect of the anti-inflammatory drug (AN) on the expression of the anti-inflammatory drug (AN) in the rat liver. AN was administered to rats with AN and AN, and AN, and AN, respectively. AN was administered to rats with AN and AN, AN, AN, AN, AN, AN, AN, AN, AN, AN, A
23adeac	1.079513	6.0	discard	Increase the initial value of x0_lambdas from 0.1 to 0.15 to encourage slightly more direct input residual mixing at each layer.	The aim of this study was to determine the effect of the administration of a 2.5 mg/kg bolus of 2.5 mg/kg bolus of 2.5 mg/kg bolus of 2.5 mg/kg bolus of 2.5 mg/kg bolus of 2.5 mg/kg bolus of 2.5 mg/kg bolus of 2.5 mg/kg bolus of 2.5 mg
52a644c	1.410003	6.0	discard	Add gradient accumulation step skipping: if loss does not decrease compared to previous step, skip optimizer step to avoid updating on bad/noisy gradients.	The aim of this study was to investigate the effects of the effects of the on the effects of the on the effects of the on the effects of the on the effects of the on the effects of on the effects of on the effects of on the effects of on the effects of on the effects of on the effects of on the effects of on the effects of on the on the effects of on the on the effects of on the on the effects of on the effects of on the effects of on the on
57a0d80	1.080696	6.0	discard	Increase the initial value of resid_lambdas from 1.0 to 1.1 to encourage slightly stronger residual mixing at each layer.	The purpose of this study was to determine the effect of the administration of a 3-week treatment with 3-week treatment of 3-week treatment with 3-week treatment with 3-week treatment with 3-week treatment with 3-week treatment with 3-week treatment with 3-week treatment with 3-week treatment with 3-week treatment with 3-week treatment with 3-week treatment with 3-week treatment with 3-week treatment with 3-week treatment with 3-week treatment with
009bb02	1.082455	6.0	discard	Increase the softcap in output logits tanh from 12 to 18 to allow higher logit magnitude, potentially improving expressivity and gradient flow.	The aim of this study was to determine the effect of the 5-HT1A receptor antagonist on the expression of the 5-HT1A receptor in the rat brain. The 5-HT1A receptor antagonist, 5-HT1A receptor antagonist, and 5-HT1A receptor antagonist, was administered to rats. The 5-HT1A receptor antagonist, 5-HT1A receptor antagonist, 5-HT1A receptor antagonist, 5-HT1A receptor antagonist,
54831f0	1.067623	6.0	discard	Add a small constant (0.01) to all MLP c_fc weights after uniform initialization in init_weights to promote early gradient flow and neuron activation.	The aim of this study was to determine the effect of the administration of a 5 mg/kg bolus of a 5 mg/kg bolus of a 5 mg/kg bolus of a 5 mg/kg bolus of a 5 mg/kg bolus of a 5 mg/kg bolus of a 5 mg/kg bolus of a 5 mg/kg bolus of a 5 mg/kg bolus of a 5 mg/kg
2d69539	1.091456	6.0	discard	Add small normal noise (std=0.01) to all MLP c_fc weights after uniform init to encourage better gradient flow and neuron activation.	The aim of this study was to determine the effect of the use of the combination of the combination of the combination of the combination of the combination of the combination of the combination of the combination of the combination of the combination of the combination of the combination of the combination of the combination of the combination of the combination of the combination of the combination of the combination of the combination of the combination of the combination of the combination of the combination of the combination of the combination of the combination of the combination of the combination
88ef58a	1.082255	6.0	discard	Increase the initial value of x0_lambdas from 0.1 to 0.25 to further encourage direct input residual mixing at each layer.	The aim of this study was to determine the effect of the administration of a single dose of 0.5 mg/kg of 0.5 mg/kg of 0.5 mg/kg of 0.5 mg/kg of 0.5 mg/kg of 0.5 mg/kg of 0.5 mg/kg of 0.5 mg/kg of 0.5 mg/kg of 0.5 mg/kg of 0.5 mg/kg of 0.5 mg
b64aaec	1.125445	6.0	discard	Add small normal noise (std=0.01) to all MLP c_proj weights after zero initialization in init_weights to encourage better gradient flow.	The aim of this study was to determine the effect of the administration of a 2 mg/kg of the 2 mg/kg of the 2 mg/kg of the 2 mg/kg of the 2 mg/kg of the 2 mg/kg of the 2 mg/kg of the 2 mg/kg of the 2 mg/kg of the 2 mg/kg of the 2 mg/kg of the 2 mg/kg of the 2 mg/kg of the 2 mg/kg of the
9cd3941	1.091513	6.0	discard	Add a small normal noise (std=0.01) to all MLP c_fc weights after uniform init in init_weights to encourage better gradient flow and neuron activation.	The aim of this study was to determine the effect of the 2-mercaptopril (2-mercaptopril) on the growth of the rat brain. The 2-mercaptopril (2-mercaptopril) was administered to rats 2-mercaptopril (2-mercaptopril) for 2-mercaptopril (2-mercaptopr
8e3cd18	1.084559	6.0	discard	Switch MLP activation from relu^2 to leaky_relu^2 for improved gradient flow and to reduce dead neurons.	The aim of this study was to determine the effect of the use of a new method of the treatment of the disease. The treatment of the disease was followed by a 3-year follow-up of 12 months. The treatment was followed by a 3-year follow-up of 12 months. The treatment was followed by a 3-year follow-up of 12 months. The treatment was followed by a 3-year follow-up of 12 months. The treatment was followed by a 3-year
afb6ff5	1.081425	6.0	discard	Add small weight decay (0.001) to the Muon optimizer parameter groups for additional regularization.	The aim of this study was to determine the effect of the 2,3-dihydroxy-3,4-dihydroxy-4,5-dihydroxy-4,5-dihydroxy-4,5-dihydroxy-4,5-dihydroxy-4,5-dihydroxy-4,5-dihydroxy-4,5-dihydroxy-4,5-dihydroxy-4,5-dihydroxy-4,5-dihydroxy-4,5
5817c4c	1.080777	6.0	discard	Add small normal noise (std=0.01) to all MLP c_fc biases after zero initialization in init_weights to encourage better early neuron activation and gradient flow.	The aim of this study was to determine the effect of the 2,3-dihydroxy-3,4-dihydroxy-4,5-dihydroxy-4,5-dihydroxy-4,5-dihydroxy-4,5-dihydroxy-4,5-dihydroxy-4,5-dihydroxy-4,5-dihydroxy-4,5-dihydroxy-4,5-dihydroxy-4,5-dihydroxy-4,5
2d508eb	1.089928	6.1	discard	Increase the MLP hidden size multiplier from 4x to 4.25x for more capacity without changing normalization.	The aim of this study was to determine the effect of the 2,3-dihydroxy-3-phosphorthylidene (2,3-dihydroxy-3-phosphorthylidene) on the expression of the 2,3-dihydroxy-3-phosphorthylidene (2,3-dihydroxy-3-phosphorthylidene) and 2,3-dihydroxy-3-phosphorthylidene
66c642e	1.065999	6.0	discard	Increase the initial value of x0_lambdas from 0.1 to 0.18 for stronger input residual mixing per layer.	The aim of this study was to determine the effect of the 5-HT2A receptor antagonist, 5-HT2A receptor antagonist, on the receptor antagonist, 5-HT2A receptor antagonist, on the receptor antagonist, 5-HT2A receptor antagonist, 5-HT2A receptor antagonist, 5-HT2A receptor antagonist, 5-HT2A receptor antagonist, 5-HT2A receptor antagonist, 5-HT2A receptor antagonist, 5-HT2A receptor
f6fd616	1.086959	6.0	discard	Increase EMA smoothing factor for train loss logging from 0.9 to 0.92 for more stable loss tracking, which may help adaptive schedules.	The aim of this study was to determine the effect of the 2,3-dihydroxy-3,4-dihydroxy-4,5-dihydroxy-4,5-dihydroxy-4,5-dihydroxy-4,5-dihydroxy-4,5-dihydroxy-4,5-dihydroxy-4,5-dihydroxy-4,5-dihydroxy-4,5-dihydroxy-4,5-dihydroxy-4,5
d0764fd	1.091767	6.0	discard	Increase the initial value of x0_lambdas to 0.12 for slightly more direct input residual mixing at each layer.	The aim of this study was to determine the effect of the 2,3-dihydroxy-2,3-dihydroxy-2,3-dihydroxy-2,3-dihydroxy-2,3-dihydroxy-2,3-dihydroxy-2,3-dihydroxy-2,3-dihydroxy-2,3-dihydroxy-2,3-dihydroxy-2,3-dihydroxy-2,3-dihydroxy-2,3
4093b55	1.119664	6.0	discard	Add small normal noise (std=0.01) to all MLP c_proj weights after zero initialization in init_weights to encourage better gradient flow.	The aim of this study was to determine the effect of the 5'-deoxy-2'-deoxy-2'-deoxy-2'-deoxy-2'-deoxy-2'-deoxy-2'-deoxy-2'-deoxy-2'-deoxy-2'-deoxy-2'-deoxy-2'-deoxy-2'-deoxy-2'-deoxy-2'-deoxy-2'-deoxy-2'-deoxy-2'-
a0f6d72	0.000000	0.0	crash	Add small normal noise (std=0.01) to all MLP c_fc biases after zero initialization in init_weights to encourage better early neuron activation and gradient flow. [Traceback (most recent call last):
File "/home/pat/autoresearch/train.py", line 605, in <module>
mod]	
79d5bde	1.080401	6.0	discard	Add small weight decay (0.001) to the x0_lambdas parameter group for additional regularization.	The aim of this study was to determine the effect of the use of a combination of a combination of a combination of a combination of a combination of a combination of a combination of a combination of a combination of a combination of a combination of a combination of a combination of a combination of a combination of a combination of a combination of a combination of a combination of a combination of a combination of a combination of a combination of a combination of a combination of a combination of a combination of a combination of a combination
fa2c9d4	1.101731	6.0	discard	Increase the MLP residual connection scaling factor from 1.2 (previous best) to 1.25 for potentially even stronger MLP updates.	The aim of this study was to determine the effect of the treatment of the 2-methoxy-2-methoxy-2-methoxy-2-methoxy-2-methoxy-2-methoxy-2-methoxy-2-methoxy-2-methoxy-2-methoxy-2-methoxy-2-methoxy-2-methoxy-2-methoxy-2-methoxy-2-methoxy-2-methoxy
370ba63	1.081793	6.0	discard	Increase the EMA smoothing factor for train loss logging to 0.96 for more stable loss tracking and potentially better adaptive schedule response.	The aim of this study was to determine the effect of the 2,3-dihydroxy-3,4-dihydroxy-4,5-dihydroxy-4,5-dihydroxy-4,5-dihydroxy-4,5-dihydroxy-4,5-dihydroxy-4,5-dihydroxy-4,5-dihydroxy-4,5-dihydroxy-4,5-dihydroxy-4,5-dihydroxy-4,5
d5a2f4f	1.098787	6.4	discard	Increase MLP hidden size multiplier from 4x to 4.75x for more capacity without changing normalization.	The aim of this study was to determine the effect of the 2nd and 3nd and 3nd and 3nd and 3nd and 3nd and 3nd and 3nd and 3nd and 3nd and 3nd and 3nd and 3nd and 3nd and 3nd and 3nd and 3nd and 3nd and 3nd and 3nd and 3nd and 3nd and
49f9395	1.096848	6.0	discard	Add small normal noise (std=0.01) to all MLP c_fc weights after uniform init in init_weights to encourage better gradient flow and neuron activation.	
6a9c62b	1.081165	6.0	discard	Increase the EMA smoothing factor for train loss logging to 0.94 for more stable loss tracking, which may help schedule adaptation.	The aim of this study was to determine the effect of the 2,3-dihydroxy-3,4-dihydroxy-3,4-dihydroxy-3,4-dihydroxy-3,4-dihydroxy-3,4-dihydroxy-3,4-dihydroxy-3,4-dihydroxy-3,4-dihydroxy-3,4-dihydroxy-3,4-dihydroxy-3,4-dihydroxy-3,4
9659ff9	1.079794	6.0	discard	Increase the initial value of x0_lambdas from 0.1 to 0.2 for stronger input residual mixing at each layer.	The aim of this study was to determine the effect of the administration of a 3-week oral dose of 3 mg/kg of 3 mg/kg of 3 mg/kg of 3 mg/kg of 3 mg/kg of 3 mg/kg of 3 mg/kg of 3 mg/kg of 3 mg/kg of 3 mg/kg of 3 mg/kg of 3 mg/kg of 3 mg/kg of 3 mg/kg of 3 mg/kg of 3 mg/kg
5b70180	1.081883	6.0	discard	Increase the proportion of long attention layers by changing the window pattern from SSSL to SSL.	The aim of this study was to determine the effect of the 2,3-dihydroxy-3,4-dihydroxy-4,5-dihydroxy-4,5-dihydroxy-4,5-dihydroxy-4,5-dihydroxy-4,5-dihydroxy-4,5-dihydroxy-4,5-dihydroxy-4,5-dihydroxy-4,5-dihydroxy-4,5-dihydroxy-4,5
8a8bbf0	1.100828	6.0	discard	Increase the MLP residual connection scaling factor from 1.2 (previous best) to 1.25 for even stronger MLP updates.	The aim of this study was to determine the effect of the combination of the two different methods of the treatment of the 2 groups of patients with chronic hepatitis C virus (HCV) infection. The study was performed on 10 patients with HCV infection. The patients were treated with the 2 groups of patients with HCV infection. The patients were treated with the 2 groups of patients with HCV infection. The patients were treated with the 2 groups of patients with HCV infection. The patients were treated
cccc263	1.088525	6.1	discard	Increase the MLP hidden size multiplier from 4x to 4.25x for increased capacity without changing normalization or causing recompilation.	The aim of this study was to determine the effect of the antidepressant drug on the activity of the antidepressant drug, the antidepressant drug, and the antidepressant drug, on the activity of the antidepressant drug, and the antidepressant drug, in the treatment of chronic pain. The antidepressant drug, antidepressant drug, and antidepressant drug, was evaluated in 10 patients with chronic pain pain and
468835f	1.081889	6.0	discard	Switch the MLP activation from relu^2 to squared leaky_relu (with negative_slope=0.01) for improved gradient flow and reduced dead neurons.	The aim of this study was to determine the effect of the use of a combination of a combination of a combination of a combination of a combination of a combination of a combination of a combination of a combination of a combination of a combination of a combination of a combination of a combination of a combination of a combination of a combination of a combination of a combination of a combination of a combination of a combination of a combination of a combination of a combination of a combination of a combination of a combination of a combination
