commit	val_bpb	memory_gb	status	description	sample_text
a122c35	1.079296	6.0	keep	baseline	
0c83fdf	0.000000	0.0	crash	Switch learning rate schedule to cosine decay instead of linear warmdown. []	
fe444fa	1.140782	6.0	discard	Increase WARMDOWN_RATIO to 0.75 for a longer LR cooldown, improving late training.	The aim of this study was to determine the effect of the 2nd 2nd 2nd 2nd 2nd 2nd 2nd 2nd 2nd 2nd 2nd 2nd 2nd 2nd 2nd 2nd 2nd 2 3 4 4 4 4 4 4 4 4 4 4 4 4 4 4 4 4
9a09fa3	1.088068	6.0	discard	Apply weight decay to value embedding parameters in optimizer setup (increase from 0.0 to 0.001)	The aim of this study was to determine the effect of the 2,3-dimethylthiazolium bromide (TZD) on the growth of the human breast cancer cell line (HCC) cell line. The study was performed on the expression of the 2,3-dimethylthiazolium bromide (TZD) and the 2,3-dimethylthiazolium bromide (TZD) in HCC cell lines. The expression of
506b0ab	0.000000	0.0	crash	Reduce MATRIX_LR from 0.04 to 0.02 to improve training stability and generalization. [^^^^^^^^^^^^^^^^^^^^^^^^^^^^^^^^^^^^^^^^^^^
File "/home/pat/autoresearch/.venv/lib/python3.12/site-p]	
b4bc9f9	0.000000	0.0	crash	Add dropout after embedding and in MLP for better regularization. [File "/home/pat/autoresearch/.venv/lib/python3.12/site-packages/torch/_dynamo/variables/builtin.py",]	
4b3f4cd	0.000000	0.0	crash	Increase weight decay for value embedding parameters from 0.002 to 0.003 for stronger regularization. [step 00141 (87.0%) | loss: 3.511429 | lrm: 0.26 | dt: 1973ms | tok/sec: 265,764 | mfu: 6.4% | epoch:]	
d4f4f33	1.088307	6.0	discard	Switch to cosine learning rate schedule for smoother decay during warmdown.	The aim of this study was to determine the effect of the 2,3-dimethylthiazolium bromide (TZA) on the growth of the human colon cancer cell line MCF-7 cells. The results showed that the 2,3-dimethylthiazolium bromide (TZA) was the most potent inhibitor of the growth of MCF-7 cells. The 2,3-dimethylthiazolium bromide (TZA)
7ceb7c0	1.082775	6.0	discard	Increase EMA beta for smooth_train_loss from 0.9 to 0.95 for more stable loss tracking and potentially improved training dynamics.	The aim of this study was to determine the effect of the 2,3-dihydroxy-3,4-dihydroxy-3,4-dihydroxy-3,4-dihydroxy-3,4-dihydroxy-3,4-dihydroxy-3,4-dihydroxy-3,4-dihydroxy-3,4-dihydroxy-3,4-dihydroxy-3,4-dihydroxy-3,4-dihydroxy-3,4
2fcbf55	1.200512	6.0	discard	Increase SCALAR_LR from 0.5 to 1.0 to encourage faster adaptation of per-layer scaling parameters.	The aim of this study was to determine the effect of the administration of a 1.5 mg/kg body weight of 1.5 mg/kg body weight (FB) and 1.5 mg/kg body weight (FB) on the basis of the 1.5 mg/kg body weight (FB) and 1.5 mg/kg body weight (FB) and 1.5 mg/kg body weight (FB) were administered 1.5 mg/kg
96b8ebe	0.000000	0.0	crash	Increase adaptive gradient clipping minimum from 0.3 to 0.5 for stronger protection against exploding gradients, potentially improving stability and throughput. [GPU: NVIDIA GeForce RTX 5070 Ti (16303MB VRAM)
Config: DEPTH=8, DEVICE_BATCH_SIZE=16, VRAM_LIMIT=158]	
2632cde	0.000000	0.0	crash	Increase Adam epsilon for embedding and value embedding parameter groups from 1e-6 to 1e-5 to improve numerical stability and potentially enhance training throughput. [GPU: NVIDIA GeForce RTX 5070 Ti (16303MB VRAM)
Config: DEPTH=8, DEVICE_BATCH_SIZE=16, VRAM_LIMIT=158]	
df9d33f	1.121868	6.0	discard	Increase WARMDOWN_RATIO from 0.5 to 0.75 to lengthen LR cooldown and encourage more stable late training.	The aim of this study was to determine the effect of the 2,3,4,5,5,5,5,5,5,5,5,5,5,5,5,5,5,5,5,5,5,5,5,5,5,5,5,5,5,5,5,5,5,5,5,5,5,5,5,5,5,5,5,5
b3fdb52	1.064306	6.0	keep	Increase Adam epsilon for lm_head (unembedding) parameter group from 1e-8 to 1e-6 for improved numerical stability and potentially faster training.	
eaf4a26	1.068646	6.0	discard	Increase Adam beta2 for embedding parameter group from 0.95 to 0.98 for potentially better long-term stability in embedding training.	The aim of this study was to determine the effect of the administration of a 5 mg/kg bolus of 5 mg/kg bolus of 5 mg/kg bolus of 5 mg/kg bolus of 5 mg/kg bolus of 5 mg/kg bolus of 5 mg/kg bolus of 5 mg/kg bolus of 5 mg/kg bolus of 5 mg/kg bolus of 5 mg/kg b
-------	0.000000	0.0	crash	FAILED TO APPLY: Reduce Muon optimizer variance reduction beta2 from 0.95 to 0.92 for potentially faster adaptation and improved training dynamics.	
c301ac5	0.000000	0.0	crash	Increase Adam beta1 for embedding parameter group from 0.8 to 0.9 for improved stability in embedding updates. [GPU: NVIDIA GeForce RTX 5070 Ti (16303MB VRAM)
Config: DEPTH=8, DEVICE_BATCH_SIZE=16, VRAM_LIMIT=158]	
fb36276	1.084021	6.0	discard	Slightly lower the weight decay floor in get_weight_decay from 0.1 to 0.07, allowing a bit more regularization late in training.	
66c2c3d	0.000000	0.0	crash	Increase unembedding (lm_head) Adam beta2 from 0.95 to 0.98 for potentially better long-term stability in the output embedding. [GPU: NVIDIA GeForce RTX 5070 Ti (16303MB VRAM)
Config: DEPTH=8, DEVICE_BATCH_SIZE=16, VRAM_LIMIT=158]	
80eb161	1.080841	6.0	discard	Increase Adam beta1 for value embedding parameter group from 0.8 to 0.9 for improved stability in value embedding updates.	The aim of this study was to evaluate the effect of the 2- and 3-position of the 2-position of the 2-position of the 2-position of the 2-position of the 2-position of the 2-position of the 2-position of the 2-position of the 2-position of the 2-position of the 2-position of the 2-position of the 2-position of the
161c2c4	1.095703	6.0	discard	Increase Adam beta1 for lm_head (unembedding) parameter group from 0.8 to 0.9 for potentially improved stability in output embedding updates.	The purpose of this study was to determine the effect of the 2,3-dihydroxy-3,4-dihydroxy-3,4-dihydroxy-3,4-dihydroxy-3,4-dihydroxy-3,4-dihydroxy-3,4-dihydroxy-3,4-dihydroxy-3,4-dihydroxy-3,4-dihydroxy-3,4-dihydroxy-3,4-dihydroxy-3,4
234df89	1.080354	6.0	discard	Increase Adam beta2 for value embedding parameter group from 0.999 to 0.995 for potentially faster adaptation and improved value embedding dynamics.	The aim of this study was to determine the effect of the 2,3-dihydroxy-3,4-dihydroxy-3,4-dihydroxy-3,4-dihydroxy-3,4-dihydroxy-3,4-dihydroxy-3,4-dihydroxy-3,4-dihydroxy-3,4-dihydroxy-3,4-dihydroxy-3,4-dihydroxy-3,4-dihydroxy-3,4
d32cf39	0.000000	0.0	crash	Switch to exponential moving average (EMA) weights for evaluation to stabilize and improve final val_bpb. []	
995dbd9	1.085844	6.0	discard	Increase Adam beta1 for embedding parameter group from 0.8 to 0.85 for improved stability in embedding updates.	
02cfe12	0.000000	0.0	crash	Switch loss reduction from 'mean' to 'sum' for better gradient signal per batch, potentially improving convergence. [GPU: NVIDIA GeForce RTX 5070 Ti (16303MB VRAM)
Config: DEPTH=8, DEVICE_BATCH_SIZE=16, VRAM_LIMIT=158]	
36b19cc	0.000000	0.0	crash	Switch loss reduction from 'mean' to 'batchmean' for improved per-batch gradient signal without crashing flash-attn3. [return fn()
^^^^
File "/home/pat/autoresearch/.venv/lib/python3.12/site-packages/torch/_dynamo/utils]	
12bcb82	0.000000	0.0	crash	Increase weight decay for embedding parameter group from 0.001 to 0.002 for stronger regularization of token embeddings. [GPU: NVIDIA GeForce RTX 5070 Ti (16303MB VRAM)
Config: DEPTH=8, DEVICE_BATCH_SIZE=16, VRAM_LIMIT=158]	
76f3599	0.000000	0.0	crash	Switch embedding optimizer from AdamW to Muon for potentially better conditioning and throughput. [GPU: NVIDIA GeForce RTX 5070 Ti (16303MB VRAM)
Config: DEPTH=8, DEVICE_BATCH_SIZE=16, VRAM_LIMIT=158]	
d5a3bc1	1.085549	6.0	discard	Increase Adam beta1 for embedding parameter group from 0.8 to 0.85 for improved stability in embedding updates (has not been combined with beta2=0.98 yet).	
7830afb	1.090791	6.0	discard	Increase Adam beta1 for lm_head (unembedding) parameter group from 0.8 to 0.85 for potentially improved stability in output embedding updates.	
3000fa0	1.082787	6.0	discard	Switch Adam beta1 for embedding parameter group from 0.8 to 0.85 AND beta2 from 0.95 to 0.98 for improved embedding stability (combine two near-misses)	The aim of this study was to determine the effect of the use of a combination of a combination of a combination of a combination of a combination of a combination of a combination of a combination of a combination of a combination of a combination of a combination of a combination of a combination of a combination of a combination of a combination of a combination of a combination of a combination of a combination of a combination of a combination of a combination of a combination of a combination of a combination of a combination of a combination
e7d80d9	0.000000	0.0	crash	Reduce softcap in output logits from 12 to 8 for sharper output distribution and potentially improved loss. [GPU: NVIDIA GeForce RTX 5070 Ti (16303MB VRAM)
Config: DEPTH=8, DEVICE_BATCH_SIZE=16, VRAM_LIMIT=158]	
54de081	1.079160	6.0	discard	Switch value embedding Adam beta1 from 0.9 to 0.85 for potentially improved adaptation and stability in value embedding updates.	
cb96ee3	0.000000	0.0	crash	Reduce Muon optimizer ns_steps from 5 to 3 for faster matrix updates and improved throughput. []	
9c5b3e4	0.000000	0.0	crash	Switch value embedding Adam beta2 from 0.999 to 0.98 for potentially improved adaptation and convergence in value embedding updates. [p = _parse_sub(source, state, sub_verbose, nested + 1)
^^^^^^^^^^^^^^^^^^^^^^^^^^^^^^^^^^^^^^^^^^^^^]	
9c5b3e4	0.000000	0.0	crash	Switch value embedding Adam beta2 from 0.999 to 0.98 for potentially improved adaptation and convergence in value embedding updates. [GPU: NVIDIA GeForce RTX 5070 Ti (16303MB VRAM)
Config: DEPTH=8, DEVICE_BATCH_SIZE=16, VRAM_LIMIT=158]	
2815903	1.080447	6.0	discard	Increase weight decay for Muon matrix parameter groups from 0.2 to 0.25 for stronger regularization on transformer matrices.	The aim of this study was to determine the effect of the presence of a 2,3-dihydroxyvitamin D3 (D3D3) on the expression of the 2,3-dihydroxyvitamin D3 (D3D3) in the rat brain. The effect of D3D3 on the expression of the 2,3-dihydroxyvitamin D3 (D3D3) was investigated in the rat brain. The effect of D3
8ac0958	1.085040	6.0	discard	Increase Adam beta1 for value embedding parameter group from 0.9 to 0.92 for potentially improved stability and adaptation in value embedding updates.	The aim of this study was to determine the effect of the 2,3-dihydroxy-3,4-dihydroxy-4,5-dihydroxy-4,5-dihydroxy-4,5-dihydroxy-4,5-dihydroxy-4,5-dihydroxy-4,5-dihydroxy-4,5-dihydroxy-4,5-dihydroxy-4,5-dihydroxy-4,5-dihydroxy-4,5
8ac0958	1.082003	6.0	discard	Increase Adam beta1 for value embedding parameter group from 0.9 to 0.92 for improved stability and adaptation in value embedding updates.	The aim of this study was to determine the effect of the 2,3-dihydroxyvitamin D3 (2,3-dihydroxyvitamin D3) on the growth of the liver and the effects of 2,3-dihydroxyvitamin D3 on the growth of the liver. The study was performed on the growth of the liver and the effects of 2,3-dihydroxyvitamin D3 on the growth of the liver and the growth of the liver
a064217	0.000000	0.0	crash	Reduce weight decay for value embedding AdamW parameter group from 0.001 to 0.0005 for gentler regularization, potentially improving embedding retention and val_bpb. [GPU: NVIDIA GeForce RTX 5070 Ti (16303MB VRAM)
Config: DEPTH=8, DEVICE_BATCH_SIZE=16, VRAM_LIMIT=158]	
9af8cff	0.000000	0.0	crash	Increase EMA beta for smooth_train_loss from 0.9 to 0.95 for more stable loss tracking and potentially improved training dynamics. [step 00150 (87.9%) | loss: 3.528159 | lrm: 0.24 | dt: 1730ms | tok/sec: 303,107 | mfu: 7.3% | epoch:]	
6a9a401	0.000000	0.0	crash	Switch Adam beta1 for value embedding parameter group from 0.9 to 0.85 for potentially improved adaptation and stability in value embedding updates. [from .decomposition import select_decomp_table
File "/home/pat/autoresearch/.venv/lib/python3.12/sit]	
cc0c932	1.080714	6.0	discard	Increase Adam beta1 for embedding parameter group from 0.8 to 0.85 for improved stability in embedding updates (has not been combined with beta2=0.98 yet).	The aim of this study was to evaluate the effect of the 2,3,4,5-trihydroxy-4-yl-5,5,5-trihydroxy-5,5-trihydroxy-5,5-trihydroxy-5,5-trihydroxy-5,5-trihydroxy-5,5-trihydroxy-5,5-trihydroxy-5,5-trihydroxy-5,5-tri
7292e1b	1.084637	6.0	discard	Switch value embedding Adam beta2 from 0.999 to 0.98 for potentially improved adaptation and convergence in value embedding updates (not yet successfully run).	
384826d	1.084172	6.0	discard	Reduce weight decay for AdamW embedding and value embedding parameter groups from 0.001 to 0.0005 for gentler regularization and improved embedding retention.	The aim of this study was to determine the effect of the 2,3-dihydroxy-3,4-dihydroxy-4,5-dihydroxy-4,5-dihydroxy-4,5-dihydroxy-4,5-dihydroxy-4,5-dihydroxy-4,5-dihydroxy-4,5-dihydroxy-4,5-dihydroxy-4,5-dihydroxy-4,5-dihydroxy-4,5
11b57ce	1.083008	6.0	discard	Increase Adam beta1 for value embedding parameter group from 0.9 to 0.92 for improved stability and adaptation in value embedding updates.	The aim of this study was to determine the effect of the use of a combination of a combination of a combination of a combination of a combination of a combination of a combination of a combination of a combination of a combination of a combination of a combination of a combination of a combination of a combination of a combination of a combination of a combination of a combination of a combination of a combination of a combination of a combination of a combination of a combination of a combination of a combination of a combination of a combination
db6f15b	1.083303	6.0	discard	Switch Adam beta2 for value embedding parameter group from 0.999 to 0.98 for potentially improved adaptation and convergence in value embedding updates (not yet successfully run, attempt surgical fix).	The aim of this study was to determine the effect of the 2,3-dihydroxy-3,4-dihydroxy-3,4-dihydroxy-3,4-dihydroxy-3,4-dihydroxy-3,4-dihydroxy-3,4-dihydroxy-3,4-dihydroxy-3,4-dihydroxy-3,4-dihydroxy-3,4-dihydroxy-3,4-dihydroxy-3,4
305f915	0.000000	0.0	crash	Switch Adam beta1 for value embedding parameter group from 0.9 to 0.85 AND beta2 from 0.999 to 0.995 for improved adaptation and stability in value embedding updates (combine two near-misses not yet combined). [GPU: NVIDIA GeForce RTX 5070 Ti (16303MB VRAM)
Config: DEPTH=8, DEVICE_BATCH_SIZE=16, VRAM_LIMIT=158]	
508178d	1.080554	6.0	discard	Increase Adam beta1 for value embedding parameter group from 0.9 to 0.92 for improved stability and adaptation in value embedding updates.	The aim of this study was to evaluate the effect of the combination of the combination of the combination of the combination of the combination of the combination of the combination of the combination of the combination of the combination of the combination of the combination of the combination of the combination of the combination of the combination of the combination of the combination of the combination of the combination of the combination of the combination of the combination of the combination of the combination of the combination of the combination of the combination of the combination of the combination
4169152	0.000000	0.0	crash	Increase Adam beta1 for lm_head (unembedding) parameter group from 0.8 to 0.85 for potentially improved stability in output embedding updates. [GPU: NVIDIA GeForce RTX 5070 Ti (16303MB VRAM)
Config: DEPTH=8, DEVICE_BATCH_SIZE=16, VRAM_LIMIT=158]	
48594d3	0.000000	0.0	crash	Switch Adam beta1 for value embedding parameter group from 0.9 to 0.88 for more aggressive adaptation and potentially improved embedding dynamics. [GPU: NVIDIA GeForce RTX 5070 Ti (16303MB VRAM)
Config: DEPTH=8, DEVICE_BATCH_SIZE=16, VRAM_LIMIT=158]	
2a58eed	1.080254	6.0	discard	Increase Adam beta2 for lm_head (unembedding) parameter group from 0.95 to 0.98 for potentially better long-term stability in output embedding training.	The aim of this study was to determine the effect of the use of the antihypertensive drugs on the development of the heart and heart. The study was performed in 19 patients with heart failure (HF) and 19 patients with HF and 19 patients with HF and 19 patients with HF and 19 patients with HF and 19 patients with HF and 19 patients with HF and 19 patients with HF and 19 patients with HF and 19 patients with HF and 19 patients
760b0b4	1.086225	6.0	discard	Switch embedding Adam beta1 from 0.8 to 0.85 for potentially improved stability in embedding updates (has not been combined with beta2=0.98 yet).	
7928204	0.000000	0.0	crash	Reduce WARMDOWN_RATIO from 0.5 to 0.35 for a more aggressive learning rate cooldown, potentially improving late-stage convergence and throughput. [GPU: NVIDIA GeForce RTX 5070 Ti (16303MB VRAM)
Config: DEPTH=8, DEVICE_BATCH_SIZE=16, VRAM_LIMIT=158]	
2889319	1.091090	6.0	discard	Increase Adam beta1 for lm_head (unembedding) parameter group from 0.8 to 0.85 for potentially improved stability in output embedding updates.	The aim of this study was to determine the effect of the administration of the 2,3-dihydroxy-3,4-dihydroxy-3,4-dihydroxy-3,4-dihydroxy-3,4-dihydroxy-3,4-dihydroxy-3,4-dihydroxy-3,4-dihydroxy-3,4-dihydroxy-3,4-dihydroxy-3,4-dihydroxy-3,4-dihydroxy-
f7af03d	0.000000	0.0	crash	Increase Adam beta1 for embedding parameter group from 0.8 to 0.85 for improved stability in embedding updates (not yet combined with beta2=0.98). [GPU: NVIDIA GeForce RTX 5070 Ti (16303MB VRAM)
Config: DEPTH=8, DEVICE_BATCH_SIZE=16, VRAM_LIMIT=158]	
c03f859	1.089633	6.0	discard	Increase Adam beta1 for lm_head (unembedding) parameter group from 0.8 to 0.85 for potentially improved stability in output embedding updates.	The aim of this study was to determine the effect of the 2,3-dihydroxy-3-oxo-4-oxo-1,3-dihydroxy-3-oxo-1,3-dihydroxy-3-oxo-1,3-dihydroxy-3-oxo-1,3-dihydroxy-3-oxo-1,3-dihydroxy-3-oxo-1,3-dihydroxy-3-ox
271f367	1.087195	6.0	discard	Increase Adam beta1 for value embedding parameter group from 0.9 to 0.92 for improved stability and adaptation in value embedding updates.	The aim of this study was to determine the effect of the 2,3-dihydroxy-3,4-dihydroxy-4,5-dihydroxy-4,5-dihydroxy-4,5-dihydroxy-4,5-dihydroxy-4,5-dihydroxy-4,5-dihydroxy-4,5-dihydroxy-4,5-dihydroxy-4,5-dihydroxy-4,5-dihydroxy-4,5
5182ec9	0.000000	0.0	crash	Reduce SCALAR_LR from 0.5 to 0.25 to slow down per-layer scaling parameter updates, potentially improving stability and convergence. [GPU: NVIDIA GeForce RTX 5070 Ti (16303MB VRAM)
Config: DEPTH=8, DEVICE_BATCH_SIZE=16, VRAM_LIMIT=158]	
f12e420	0.000000	0.0	crash	Switch Adam beta2 for value embedding parameter group from 0.999 to 0.98 for potentially improved adaptation and convergence in value embedding updates (not yet successfully run). [GPU: NVIDIA GeForce RTX 5070 Ti (16303MB VRAM)
Config: DEPTH=8, DEVICE_BATCH_SIZE=16, VRAM_LIMIT=158]	
bc0e4e2	0.000000	0.0	crash	Increase Adam beta1 for value embedding parameter group from 0.9 to 0.92 for improved stability and adaptation in value embedding updates. [GPU: NVIDIA GeForce RTX 5070 Ti (16303MB VRAM)
Config: DEPTH=8, DEVICE_BATCH_SIZE=16, VRAM_LIMIT=158]	
fd331b4	1.079633	6.0	discard	Switch to EMA beta=0.95 for smooth_train_loss to improve stability and signal tracking.	
a1a4595	1.084005	6.0	discard	Increase weight decay for AdamW embedding and value embedding parameter groups from 0.001 to 0.002 for stronger regularization and improved embedding retention.	The aim of this study was to determine the effect of the 2,3-dihydroxy-3,4-dihydroxy-3,4-dihydroxy-3,4-dihydroxy-3,4-dihydroxy-3,4-dihydroxy-3,4-dihydroxy-3,4-dihydroxy-3,4-dihydroxy-3,4-dihydroxy-3,4-dihydroxy-3,4-dihydroxy-3,4
2c053b6	1.075704	6.0	discard	Increase weight decay for Muon matrix parameter groups from 0.2 to 0.3 for stronger regularization on transformer matrices.	The aim of this study was to determine the effect of the 2- and 3-position of 2- and 3-position of 2-position of 2-position of 2-position of 2-position of 2-position of 2-position of 2-position of 2-position of 2-position of 2-position of 2-position of 2-position of 2-position of 2-position of
77dc371	1.080944	6.0	discard	Increase Adam beta1 for value embedding parameter group from 0.9 to 0.92 for improved stability and adaptation in value embedding updates (has not been combined with beta2=0.999 yet).	The aim of this study was to determine the effect of the use of a combination of a combination of a combination of a combination of a combination of a combination of a combination of a combination of a combination of a combination of a combination of a combination of a combination of a combination of a combination of a combination of a combination of a combination of a combination of a combination of a combination of a combination of a combination of a combination of a combination of a combination of a combination of a combination of a combination
6a08b9f	0.000000	0.0	crash	Switch value embedding Adam beta2 from 0.999 to 0.98 for potentially improved adaptation and convergence in value embedding updates (surgical fix, not yet successfully run). [terminate called after throwing an instance of 'std::runtime_error'
what():  expected eof but found ]	
7521927	1.080282	6.0	discard	Switch loss EMA smoothing beta from 0.9 to 0.92 for improved signal tracking and stability.	The aim of this study was to determine the effect of the 2,3-dihydroxy-3,4-dihydroxy-4,5-dihydroxy-4,5-dihydroxy-4,5-dihydroxy-4,5-dihydroxy-4,5-dihydroxy-4,5-dihydroxy-4,5-dihydroxy-4,5-dihydroxy-4,5-dihydroxy-4,5-dihydroxy-4,5
0f0be8a	0.000000	0.0	crash	Switch value embedding Adam beta2 from 0.999 to 0.98 for potentially improved adaptation and convergence in value embedding updates (surgical fix, not yet successfully run). [GPU: NVIDIA GeForce RTX 5070 Ti (16303MB VRAM)
