commit	val_bpb	memory_gb	status	description	sample_text
3fb6704	1.096577	6.0	keep	baseline	The aim of this study was to determine the effect of the 2,3-dimethylthiopropylthiopropylthiopropylthiopropylthiopropylthiopropylthiopropylthiopropylthiopropylthiopropylthiopropylthiopropylthiopropylthiopropylthiopropylthiopropylthi
e7098f9	0.000000	0.0	crash	Switch LR warmdown to cosine schedule instead of linear for smoother decay. [GPU: NVIDIA GeForce RTX 5070 Ti (16303MB VRAM)
Config: DEPTH=8, DEVICE_BATCH_SIZE=16, VRAM_LIMIT=158]	
55a6ca5	0.000000	0.0	crash	Apply more aggressive warmdown: set WARMDOWN_RATIO=0.75 to spend more of the budget decaying LR. [GPU: NVIDIA GeForce RTX 5070 Ti (16303MB VRAM)
Config: DEPTH=8, DEVICE_BATCH_SIZE=16, VRAM_LIMIT=158]	
42330e2	1.087267	6.0	keep	Add weight decay to value embeddings parameter group, increasing to 0.003 for potentially stronger regularization.	The aim of this study was to determine the effect of the antihypertensive drug therapy on the incidence of acute myocardial infarction (AMI) in patients with acute myocardial infarction (AMI) and to determine the effect of antihypertensive therapy on the incidence of AMI. AMI was 100% (n = 100) in 100% of patients with AMI. AMI was 100% (n = 100) in 100% of
0c7ad79	0.970430	6.0	keep	Halve TOTAL_BATCH_SIZE for ~2x more optimizer steps (more updates in same time, common BPB win).	The aim of this study was to determine the effect of the presence of a single dose of 1.5 mg/kg of the drug on the development of the rat model of the rat model of the rat model of the rat model of the rat model of the rat model of the rat model of the rat model of the rat model of the rat model of the rat model of the rat model of the rat model of the rat model of the rat model of the rat model of the rat model of the
4521529	0.000000	0.0	crash	Switch MLP activation from relu^2 to GELU (more effective, smoother gradients). [GPU: NVIDIA GeForce RTX 5070 Ti (16303MB VRAM)
Config: DEPTH=8, DEVICE_BATCH_SIZE=16, VRAM_LIMIT=158]	
c4c1016	0.000000	0.0	crash	Apply z-loss only during early training (progress < 0.7), to avoid regularization late when overfitting is less likely. [GPU: NVIDIA GeForce RTX 5070 Ti (16303MB VRAM)
Config: DEPTH=8, DEVICE_BATCH_SIZE=16, VRAM_LIMIT=158]	
30778a2	1.085488	6.0	discard	Increase Adam beta2 to 0.98 for more stable long-term parameter updates.	
3a28193	1.096290	6.0	discard	Reduce weight decay for Muon optimizer to 0.05 to allow parameters to learn more freely	The aim of this study was to determine the effect of the 2- and 3- and 3- and 3- and 3- and 3- and 3- and 3- and 3- and 3- and 3- and 3- and 3- and 3- and 3- and 3- and 3- and 3- and 3- and 3- and 3- and 3- and
cabb7ad	1.081364	6.0	discard	Increase adaptive gradient clipping strength: lower max_norm to range [0.2, 1.0] (was [0.3, 1.0])	
49d9c18	0.000000	0.0	crash	Increase softcap from 12 to 16 in output logits tanh to allow higher logit magnitude, potentially improving expressivity. []	
5fb4f4f	1.085288	6.0	discard	Increase EMA smoothing of train loss for more stable logging and potentially more consistent schedule adaptation.	The aim of this study was to determine the effect of the 2- and 3-position of the 2-position of the 2-position of the 2-position of the 2-position of the 2-position of the 2-position of the 2-position of the 2-position of the 2-position of the 2-position of the 2-position of the 2-position of the 2-position of the
53832b7	0.000000	0.0	crash	Increase the MLP hidden size multiplier from 4x to 6x to boost model capacity without changing depth or batch size. [GPU: NVIDIA GeForce RTX 5070 Ti (16303MB VRAM)
Config: DEPTH=8, DEVICE_BATCH_SIZE=16, VRAM_LIMIT=158]	
0eb4695	0.000000	0.0	crash	Increase EMA smoothing for train loss logging to 0.98 for more stable loss tracking, which may help with schedule adaptation. []	
4568343	1.085119	6.0	discard	Increase the value embedding parameter group weight decay to 0.003 for stronger regularization.	
86529f8	0.000000	0.0	crash	Increase HEAD_DIM from 128 to 160 to allow more attention heads (potentially improving model expressivity and throughput). []	
9fa69ba	0.000000	0.0	crash	Increase the MLP hidden size multiplier from 4x to 5x for more capacity without changing normalization. [GPU: NVIDIA GeForce RTX 5070 Ti (16303MB VRAM)
Config: DEPTH=8, DEVICE_BATCH_SIZE=16, VRAM_LIMIT=158]	
32b72b6	0.000000	0.0	crash	Increase softcap in output logits tanh from 12 to 14 to allow higher logit magnitude and potentially improve expressivity. [GPU: NVIDIA GeForce RTX 5070 Ti (16303MB VRAM)
Config: DEPTH=8, DEVICE_BATCH_SIZE=16, VRAM_LIMIT=158]	
c75fce9	1.085177	6.0	discard	Increase the short attention window size from half to three-quarters of the context for more context per layer.	
c75fce9	0.000000	0.0	crash	Increase the short attention window size from half to three-quarters of the context for more context per layer. [^^^^^^^^^^^^^^^^^^^^^^^^^^^^^^^^
File "/home/pat/autoresearch/.venv/lib/python3.12/site-packages/sym]	
a4eec15	1.081008	6.0	discard	Switch to using torch.inference_mode instead of torch.no_grad during final eval for potentially faster and more memory-efficient validation.	
06c3e87	1.081184	6.0	discard	Increase the short attention window size from half to seven-eighths of the context for more context per layer.	The aim of this study was to determine the effect of the 2,3-dihydroxyvitamin D3 (2,3-dihydroxyvitamin D3) on the growth of the human liver. The study was performed on the effects of 2,3-dihydroxyvitamin D3 on the growth of the liver. The results showed that 2,3-dihydroxyvitamin D3 (2,3-dihydroxyvitamin D3) increased the growth of
3e20185	1.092802	6.3	discard	Increase MLP hidden size multiplier from 4x to 4.5x for more capacity without changing normalization.	
915ba17	1.081997	6.0	discard	Increase weight decay on value embedding parameter group to 0.002 for slightly stronger regularization.	
2efe91f	1.086910	6.0	discard	Switch to torch.inference_mode (instead of torch.no_grad) during final eval for potentially faster and more memory-efficient validation.	The aim of this study was to determine the effect of the 2,3-dihydroxy-3,4-dihydroxy-3,4-dihydroxy-3,4-dihydroxy-3,4-dihydroxy-3,4-dihydroxy-3,4-dihydroxy-3,4-dihydroxy-3,4-dihydroxy-3,4-dihydroxy-3,4-dihydroxy-3,4-dihydroxy-3,4
2e6582d	0.929527	5.9	keep	Increase the short attention window size from half to five-eighths of the context for more context per layer.	The aim of this study was to evaluate the effect of the use of a new method of the use of the Congress Reference Test (CRT) on the performance of the Congress Reference Test (CRT) in a group of 100 healthy volunteers. The study was conducted in 200 volunteers. The CRT was administered in a 2.5% form. The CRT was administered in a 2.5% form. The
09a9504	0.921393	5.9	keep	Add small weight decay (0.001) to the value embedding parameter group for stronger regularization.	The aim of this study was to investigate the effect of the combination of the two different methods of the treatment of patients with chronic kidney disease (CKD) on the renal function and renal function.The aim of this study was to evaluate the effect of the combination of the two methods of the treatment of patients with chronic kidney disease (CKD) on the renal function and renal function.The aim of this study was to evaluate the effect of the combination of the two methods of the treatment of
2ccc270	0.921902	5.9	discard	Initialize all MLP c_proj weights with small normal noise instead of zeros for better gradient flow.	The aim of this study was to evaluate the effect of a single dose of 1, 2, 3, 4, 5, 6, 7, 8, 9, 10, 12, 14, 16, 18, 24, 48, 72, 96, 96, 96, 96, 96, 96, 96, 96, 96, 96, 96,
f5fd202	0.916588	5.9	keep	Increase the MLP residual connection scaling factor from 1.0 to 1.2 to encourage stronger MLP updates.	The aim of this study was to investigate the effect of the addition of a 10% (w/w) 0.5% (w/w) 0.5% (w/w) 0.5% (w/w) 0.5% (w/w) 0.5% (w/w) 0.5% (w/w) 0.5% (w/w) 0.5% (w
6da4ecf	0.000000	0.0	crash	Apply z-loss only in early training (progress < 0.7), to avoid over-regularization late. [_recursive_post_grad_passes(gm, is_inference=is_inference)
File "/home/pat/autoresearch/.venv/lib/py]	
-------	0.000000	0.0	crash	SYNTAX: Introduce a small constant bias (0.01) to MLP c_fc weights for all layers during initialization to promote more active neuron outputs early in training, possibly improving early convergence. [SyntaxError: unexpected indent (<unknown>, line 186)]	
a2b2bfa	0.923710	9.9	discard	Add small weight decay (0.001) to Muon optimizer parameter groups for additional regularization.	The aim of this study was to investigate the effect of the use of a combination of the two drugs on the expression of the genes involved in the regulation of the expression of the genes involved in the regulation of the expression of the genes involved in the regulation of the expression of the genes involved in the regulation of the expression of the genes involved in the regulation of the expression of the genes involved in the regulation of the expression of the genes involved in the regulation of the expression of the genes involved in the regulation
16abfef	0.916729	5.9	discard	Set a small positive bias (0.01) for all MLP c_fc layers in init_weights, encouraging early neuron activation.	The aim of this study was to investigate the effect of the combination of the combination of the combination of the combination of the combination of the combination of the combination of the combination of the combination of the combination of the combination of the combination of the combination of the combination of the combination of the combination of the combination of the combination of the combination of the combination of the combination of the combination of the combination of the combination of the combination of the combination of the combination of the combination of the combination of the combination
9cdcfa2	0.917131	5.9	discard	Increase the number of optimizer steps by reducing the VRAM safety margin in GPU auto-detection, allowing more tokens to fit per batch if VRAM allows.	The aim of this study was to investigate the effect of the combination of the two drugs on the expression of the pro-inflammatory cytokines interleukin-1β (IL-1β) and tumor necrosis factor-α (TNF-α) in the liver of rats with chronic liver disease (CLD). The results showed that the combination of the two drugs significantly inhibited the expression of IL-1β and TNF-α in the liver of rats with CLD. The combination of the two drugs significantly inhibited the expression of
d3bd433	1.110494	5.5	discard	Switch MLP activation from relu^2 to relu for potentially better gradient flow and less dead neurons.	The purpose of this study was to determine the effect of the 2nd 2nd 3nd 3nd 3nd 3nd 3nd 3nd 3nd 3nd 3nd 3nd 3nd 3nd 3nd 3nd 3nd 3nd 3nd 3nd 3nd 3nd 3nd 3nd 3nd 3nd 3nd 3nd 3nd
ed019d6	1.085506	6.0	discard	Increase the softcap in output logits tanh from 12 to 13 to allow slightly higher logit magnitude, potentially improving expressivity.	
8428611	0.000000	0.0	crash	Switch MLP activation from relu^2 to squared GELU for smoother gradients and potentially better learning dynamics. [GPU: NVIDIA GeForce RTX 5070 Ti (16303MB VRAM)
Config: DEPTH=8, DEVICE_BATCH_SIZE=16, VRAM_LIMIT=158]	
9362ade	1.087548	6.0	discard	Increase the EMA smoothing factor for train loss logging to 0.95 for more stable loss tracking, which may help with schedule adaptation.	The aim of this study was to determine the effect of the 2,3-dihydroxy-3,4-dihydroxy-3,4-dihydroxy-3,4-dihydroxy-3,4-dihydroxy-3,4-dihydroxy-3,4-dihydroxy-3,4-dihydroxy-3,4-dihydroxy-3,4-dihydroxy-3,4-dihydroxy-3,4-dihydroxy-3,4
d56a2e7	1.088111	6.0	discard	Increase the tanh softcap in output logits from 12 to 15 to allow higher logit magnitude, potentially improving expressivity.	
dc38b62	1.086319	6.0	discard	Increase the number of gradient accumulation steps by halving DEVICE_BATCH_SIZE, enabling more updates per optimizer step (if VRAM allows).	The aim of this study was to determine the effect of the 2,3-dihydroxy-3,4-dihydroxy-4,5-dihydroxy-4,5-dihydroxy-4,5-dihydroxy-4,5-dihydroxy-4,5-dihydroxy-4,5-dihydroxy-4,5-dihydroxy-4,5-dihydroxy-4,5-dihydroxy-4,5-dihydroxy-4,5
61747cc	0.000000	0.0	crash	Increase the initial value of x0_lambdas from 0.1 to 0.2 to encourage more residual mixing from the input embedding at each layer. [^^^^^^^^^^^^^^^^^^^^^^^^^^^^^^^^^^^^^^^^^^^^^^^^
File "/home/pat/autoresearch/.venv/lib/python3.12/s]	
-------	0.000000	0.0	crash	FAILED TO APPLY: Increase the MLP residual connection scaling factor from 1.2 (previous best) to 1.3 for even stronger MLP updates.	
4bce15d	0.000000	0.0	crash	Switch MLP activation from relu^2 to swish (x * sigmoid(x)) for smoother gradients and potentially better learning dynamics. [^^^^^^^^^^^^^^^^^^^^^^^^^^^^^^^^^^^^^^^^^^^^^^^^^^^^^^^
File "/home/pat/autoresearch/.venv/lib/pytho]	
59bde35	0.000000	0.0	crash	Add small amount of label smoothing (0.05) to the cross-entropy loss for improved generalization. [GPU: NVIDIA GeForce RTX 5070 Ti (16303MB VRAM)
Config: DEPTH=8, DEVICE_BATCH_SIZE=16, VRAM_LIMIT=158]	
462eba7	0.000000	0.0	crash	Switch MLP hidden size multiplier from 4x to 3.5x for faster MLP throughput (potentially more training steps in same time budget). [GPU: NVIDIA GeForce RTX 5070 Ti (16303MB VRAM)
Config: DEPTH=8, DEVICE_BATCH_SIZE=16, VRAM_LIMIT=158]	
8d42f51	2.534675	6.0	discard	Add gradient noise during training to encourage exploration and potentially improve generalization.	is of the of the of the of the of the of the of the and the of the of the of the and the of the of the of the of the of the and. The. The............., and  of the of the of the of the of the of the of the of the of the of the of the of the of the of the of the of
023463e	0.000000	0.0	crash	Add gradient accumulation step skipping: if loss does not decrease compared to previous step, skip optimizer step to avoid updating on bad/noisy gradients. [GPU: NVIDIA GeForce RTX 5070 Ti (16303MB VRAM)
Config: DEPTH=8, DEVICE_BATCH_SIZE=16, VRAM_LIMIT=158]	
1ce2258	0.000000	0.0	crash	Increase the tanh softcap in output logits from 12 to 16 to allow higher logit magnitude, potentially improving expressivity. [GPU: NVIDIA GeForce RTX 5070 Ti (16303MB VRAM)
Config: DEPTH=8, DEVICE_BATCH_SIZE=16, VRAM_LIMIT=158]	
f7d2127	1.163766	6.0	discard	Add a small constant (0.01) to the MLP c_proj weights after zero initialization in init_weights for improved MLP gradient flow.	The aim of this study was to determine the effect of the administration of a 100 mg/kg boronide (1 mg/kg boronide) on the incidence of acute myocardial infarction (AMI) in patients with AMI.The aim of this study was to determine the effect of a 100 mg/kg boronide (1 mg/kg boronide) on the incidence of acute myocardial infarction (AMI) in patients with AMI.The
a5a2ca2	1.076990	6.0	discard	Slightly increase the initial value of x0_lambdas from 0.1 to 0.15 to encourage more input residual mixing per layer.	The aim of this study was to determine the effect of the administration of a 2.5 mg/kg b.w. on the effects of the 2.5 mg/kg b.w. on the effects of the 2.5 mg/kg b.w. on the effects of the 2.5 mg/kg b.w. on the effects of the 2.5 mg/kg b.w. on the effects of the 2.5 mg/kg b.w.
33a0cc5	0.000000	0.0	crash	Increase the EMA smoothing factor for train loss logging to 0.95 for potentially more stable loss tracking and improved schedule adaptation. [step 00149 (87.6%) | loss: 3.538820 | lrm: 0.25 | dt: 1710ms | tok/sec: 306,685 | mfu: 7.4% | epoch:]	
0105296	1.087138	6.0	discard	Increase the short attention window size from half to three-fifths of the context for more context per layer.	The aim of this study was to determine the effect of the 2,3-dimethylthiazolium bromide (TZD) on the growth of the human colon cancer cell line MCF-7 cells. The effect of TZD on the growth of MCF-7 cells was investigated by using the 2,3-dimethylthiazolium bromide (TZD) and the 2,3-dimethylthiazolium bromide (TZD
72c9654	1.410022	6.0	discard	Add gradient accumulation step skipping: if loss increases compared to previous step, skip optimizer step to avoid updating on noisy gradients.	The aim of this study was to investigate the effects of the 2-2-2-2-2-2-2-2-2-2-2-2-2-2-2-2-2-2-2-2-2-2-2-2-2-2-2-2-2-2-2-2-2-2-2-2-2-2-2-2-2-2-2-2
8924480	1.082678	6.0	discard	Increase the EMA smoothing for train loss logging to 0.95 for more stable loss tracking and potentially better schedule adaptation.	The aim of this study was to determine the effect of the 2,3-dihydroxy-3,4-dihydroxy-3,4-dihydroxy-3,4-dihydroxy-3,4-dihydroxy-3,4-dihydroxy-3,4-dihydroxy-3,4-dihydroxy-3,4-dihydroxy-3,4-dihydroxy-3,4-dihydroxy-3,4-dihydroxy-3,4
4463b58	1.161553	6.0	discard	Add a small positive bias (0.01) to all MLP c_proj weights after zero initialization in init_weights to encourage better MLP gradient flow.	The effects of the 3'UTR of the 3'UTR of the 3'UTR of the 3'UTR'UTR'UTR'UTR'UTR'UTR'UTR'UTR'UTR'UTR'UTR'UTR'UTR'UTR'UTR'UTR'UTR'UTR'UTR'UTR'UTR'UTR'UTR'UTR'
f5aa025	1.414291	6.0	discard	Add gradient accumulation step skipping if loss increases compared to previous step to avoid updating on noisy gradients.	The aim of this study was to investigate the effects of the effects of the on the effects of the on the effects of the on the effects of the on the effects of the on the effects of on the effects of on the effects of on the effects of on the effects of on the effects of on the effects of on the effects of on the effects of on the effects of on the effects of on the on the effects of on the effects of on the effects of on the effects of on the effects
f42e184	1.090968	6.1	discard	Increase the MLP hidden size multiplier from 4x to 4.25x for a small capacity boost without changing normalization or causing recompilation.	The aim of this study was to determine the effect of the 2,3-dihydroxy-3,4-dihydroxy-4,5-dihydroxy-4,5-dihydroxy-4,5-dihydroxy-4,5-dihydroxy-4,5-dihydroxy-4,5-dihydroxy-4,5-dihydroxy-4,5-dihydroxy-4,5-dihydroxy-4,5-dihydroxy-4,5
8f3b79f	1.089762	6.0	discard	Increase the residual connection scaling factor for the attention block from 1.0 to 1.2 to encourage stronger attention updates (mirroring the best MLP residual scaling win).	The aim of this study was to determine the effect of the 2-oxo-3-oxo-3-oxo-3-oxo-3-oxo-3-oxo-3-oxo-3-oxo-3-oxo-3-oxo-3-oxo-3-oxo-3-oxo-3-oxo-3-oxo-3-oxo-3-oxo-3-
85b25b4	1.082465	6.0	discard	Increase the floor in the Muon weight decay cosine schedule from 0.1 to 0.2, so weight decay remains higher throughout training for stronger regularization.	The aim of this study was to determine the effect of the 2,3-dihydroxy-3,4-dihydroxy-3,4-dihydroxy-3,4-dihydroxy-3,4-dihydroxy-3,4-dihydroxy-3,4-dihydroxy-3,4-dihydroxy-3,4-dihydroxy-3,4-dihydroxy-3,4-dihydroxy-3,4-dihydroxy-3,4
f651308	1.092098	6.0	discard	Add small normal noise (std=0.01) to all MLP c_fc weights after uniform init to encourage better gradient flow and neuron activation.	The aim of this study was to determine the effect of the 2-methoxy-3,4,5,5,5,5,5,5,5,5,5,5,5,5,5,5,5,5,5,5,5,5,5,5,5,5,5,5,5,5,5,5,5,5,5,5,5,5,5,5,5,
7d596d9	1.085049	6.0	discard	Increase the number of Nesterov steps in Muon optimizer from 5 to 7 for potentially better orthogonalization and optimization.	The aim of this study was to determine the effect of the 2,3-dihydroxy-3,4-dihydroxy-3,4-dihydroxy-3,4-dihydroxy-3,4-dihydroxy-3,4-dihydroxy-3,4-dihydroxy-3,4-dihydroxy-3,4-dihydroxy-3,4-dihydroxy-3,4-dihydroxy-3,4-dihydroxy-3,4
b3b1769	1.088258	6.0	discard	Increase the initial value of x0_lambdas from 0.1 to 0.12 for slightly more input residual mixing per layer.	The aim of this study was to determine the effect of the 2,3-dihydroxy-2,3-dihydroxy-2,3-dihydroxy-2,3-dihydroxy-2,3-dihydroxy-2,3-dihydroxy-2,3-dihydroxy-2,3-dihydroxy-2,3-dihydroxy-2,3-dihydroxy-2,3-dihydroxy-2,3-dihydroxy-2,3
1bd8c40	0.000000	0.0	crash	Increase the tanh softcap in output logits from 12 to 13.5 for slightly higher logit magnitude, potentially improving expressivity. [GPU: NVIDIA GeForce RTX 5070 Ti (16303MB VRAM)
Config: DEPTH=8, DEVICE_BATCH_SIZE=16, VRAM_LIMIT=158]	
12f1592	1.082905	6.0	discard	Increase the EMA smoothing factor for train loss logging to 0.98 for even more stable loss tracking, which may help with schedule adaptation.	The aim of this study was to determine the effect of the 2,3-dihydroxy-3,4-dihydroxy-4,5-dihydroxy-4,5-dihydroxy-4,5-dihydroxy-4,5-dihydroxy-4,5-dihydroxy-4,5-dihydroxy-4,5-dihydroxy-4,5-dihydroxy-4,5-dihydroxy-4,5-dihydroxy-4,5
96ce22b	1.074916	6.0	discard	Increase the initial value of x0_lambdas from 0.1 to 0.2 to encourage more direct input residual mixing at each layer.	The aim of this study was to determine the effect of the administration of a 3,4-dinitrophenyl (DNP) and a 3,4-dinitrophenyl (DNP) on the effects of the DNP on the effects of the DNP on the effects of the DNP on the effects of the DNP on the effects of the DNP on the effects of the DNP on the effects of the DNP on the effects of the DNP on
a800159	1.079686	6.0	discard	Increase the variance of the token embedding initialization (std=1.2 instead of 1.0) to encourage more diverse initial representations.	The aim of this study was to determine the effect of the 5'-deoxyuridine (5'-deoxyuridine) on the effect of the 5'-deoxyuridine (5'-deoxyuridine (5'-deoxyuridine) on the effect of the 5'-deoxyuridine (5'-deoxyuridine (5'-deoxyuridine) on the effect of 5'-deoxyuridine (5'-deoxyuridine (
