commit	val_bpb	memory_gb	status	description	sample_text
7ad22e5	1.124477	6.0	keep	baseline	The aim of this study was to evaluate the effect of a 2-year-old male with a history of a history of a history of a history of a history of a history of a history of a history of a history of a history of a history of a history of a history of a history of a history of a history of a history of a history of a history of a history of a history of a history of a history of a history of a history of a history of a history of a
7c25fc7	1.244893	6.0	discard	Increase WARMDOWN_RATIO to 0.75 for more aggressive LR cooldown	The aim of this study was to evaluate the effect of a 3-year-old man with a 3-year-old man with a history of a 3-year-old man with a history of a history of a history of a history of a history of a history of a history of a history of a history of a history of a history of a history of a history of a history of a history of a history of a history of a history of a history of a history of a history of a history
6f59acd	0.000000	0.0	crash	Change linear LR warmdown to cosine annealing schedule [step 00068 (49.6%) | loss: 4.798691 | lrm: 1.00 | dt: 2365ms | tok/sec: 221,696 | mfu: 5.4% | epoch:]	
442a384	1.124458	6.0	keep	Increase weight decay on embeddings/value embeddings/unembedding from 0.001 to 0.002 (within proven 0.001-0.003 range)	The aim of this study was to investigate the effect of a 2-year-old male with a history of a 2-year-old male with a history of a history of a history of a history of a history of a history of a history of a history of a history of a history of a history of a history of a history of a history of a history of a history of a history of a history of a history of a history of a history of a history of a history of a history of
d0121d3	1.094881	6.0	keep	Increase logit softcap from 12 to 50 to allow sharper predictions	The aim of this study was to determine the effect of a single dose of 1,250 mg of 1,250 mg of 1,250 mg of 1,250 mg of 1,250 mg of 1,250 mg of 1,250 mg of 1,250 mg of 1,250 mg of 1,250 mg of 1,250 mg of 1,250 mg of
946704a	1.084946	6.0	keep	Remove z-loss regularization to allow sharper predictions after softcap increase	The aim of this study was to determine the effect of the 5'-triphosphate (5'-triphosphate) on the expression of the 5'-triphosphate (5'-triphosphate) and the 5'-triphosphate (5'-triphosphate) in the presence of the 5'-triphosphate (5'-triphosphate) and 5'-triphosphate (5'-triphosphate (5'-triphosphate) in the presence of
f977508	1.356417	7.0	discard	Add label smoothing with 0.1 to cross entropy loss to improve generalization	The aim of this study was to determine the effect of the combination of the combination of the combination of the combination of the combination of the combination of the combination of the combination of the combination of the combination of the combination of the combination of the combination of the combination of the combination of the combination of the combination of the combination of the combination of the combination of the combination of the combination of the combination of the combination of the combination of the combination of the combination of the combination of the combination of the combination
b47ae32	1.090980	5.8	discard	Tie value embeddings across all layers (shared parameters) to reduce capacity and improve generalization	The aim of this study was to determine the effect of the combination of the combination of the combination of the combination of the combination of the combination of the combination of the combination of the combination of the combination of the combination of the combination of the combination of the combination of the combination of the combination of the combination of the combination of the combination of the combination of the combination of the combination of the combination of the combination of the combination of the combination of the combination of the combination of the combination of the combination
885aeb1	1.095314	6.0	discard	Use full attention in all layers by setting WINDOW_PATTERN to L, removing sliding window constraints to improve long-range dependency learning	The aim of this study was to determine the effect of the different concentrations of the different concentrations of the different concentrations of the different concentrations of the different concentrations of the different concentrations of the different concentrations of the different concentrations of the different concentrations of the different concentrations of the different concentrations of the different concentrations of the different concentrations of the different concentrations of the different concentrations of the different concentrations of the different concentrations of the different concentrations of the different concentrations of the different concentrations of the different concentrations of the different concentrations of the
8a3a304	1.100428	6.0	discard	Reduce Muon weight decay from 0.2 to 0.1 for less aggressive regularization on matrix parameters	The aim of this study was to determine the effect of the use of a combination of a combination of a combination of a combination of a combination of a combination of a combination of a combination of a combination of a combination of a combination of a combination of a combination of a combination of a combination of a combination of a combination of a combination of a combination of a combination of a combination of a combination of a combination of a combination of a combination of a combination of a combination of a combination of a combination
5384562	1.091948	6.0	discard	Effectively remove logit softcap by setting to large value (10000) to allow unconstrained sharp predictions	The aim of this study was to determine the effect of the 2,2,3,5,5-trisphosphate (2,3,5-trisphosphate) on the expression of the 2,3,5-trisphosphate (2,3,5-trisphosphate) and the 2,3,5-trisphosphate (2,3,5-trisphosphate) in the presence of 2,3,5-trisphosphate (2,3,5-tr
bc49461	1.144986	6.0	discard	Change RoPE base from 50000 to 10000 for better positional encoding at sequence length 2048	The aim of this study was to evaluate the effect of a 3-week-old male with a 3-week-old male with a 3-week-old male with a 3-week-old male with a 3-week-old female with a 3-week history of a 3-week-old male with a 3-week history of a 3-week-old male with a 3-week history of a 3-week-old male with a 3-week history of a 3-week-old male with a
e7092ba	1.194813	6.0	discard	Remove adaptive gradient clipping to allow unconstrained gradient updates and slightly improve training throughput	The aim of this study was to investigate the effect of a 2-year-old male patient with a history of a history of a history of a history of a history of a history of a history of a history of a history of a history of a history of a history of a history of a history of a history of a history of a history of a history of a history of a history of a history of a history of a history of a history of a history of a history of a history of
bc3ba87	1.120073	6.0	discard	Change window pattern to SSSS for higher throughput (more short-window layers), allowing more training steps in the 5-minute budget	The aim of this study was to evaluate the effect of a 2- to 3-year-old male with a 2-year-old male with a history of a 2-year-old male with a history of a history of a history of a history of a history of a history of a history of a history of a history of a history of a history of a history of a history of a history of a history of a history of a history of a history of a history of a history of a
5b277bd	1.105985	6.0	discard	Enable cudnn.benchmark for improved training throughput (more steps in 5 min)	The aim of this study was to determine the effect of the 2,3,4,5,5,5,5,5,5,5,5,5,5,5,5,5,5,5,5,5,5,5,5,5,5,5,5,5,5,5,5,5,5,5,5,5,5,5,5,5,5,5,5,5
b9c0808	1.089486	6.0	discard	Delay LR warmdown to last 25% of training (WARMDOWN_RATIO=0.25) for longer high-LR training	The aim of this study was to evaluate the effect of the combination of the combination of the combination of the combination of the combination of the combination of the combination of the combination of the combination of the combination of the combination of the combination of the combination of the combination of the combination of the combination of the combination of the combination of the combination of the combination of the combination of the combination of the combination of the combination of the combination of the combination of the combination of the combination of the combination of the combination
-------	0.000000	0.0	crash	FAILED TO APPLY: Add 0.1 dropout to MLP and Attention blocks for regularization	
02e4c5d	1.137269	6.0	discard	Relax adaptive gradient clipping floor from 0.3 to 0.5 to allow larger gradient updates at end of training	The aim of this study was to evaluate the effect of a 1,2-dihydroxyvitamin D3 (D3D3) on the growth and growth of human breast cancer cells. The study was conducted to investigate the effect of 1,2-dihydroxyvitamin D3 on the growth and growth of breast cancer cells. The results showed that 1,2-dihydroxyvitamin D3D3 was significantly higher in breast cancer cells than in the control group.
46f5c68	1.130011	6.0	discard	Combine delayed LR warmdown (WARMDOWN_RATIO=0.25) with increased logit softcap (50) and disabled z-loss for sharper predictions and longer high-LR training	The aim of this study was to evaluate the effect of the combination of the combination of the combination of the combination of the combination of the combination of the combination of the combination of the combination of the combination of the combination of the combination of the combination of the combination of the combination of the combination of the combination of the combination of the combination of the combination of the combination of the combination of the combination of the combination of the combination of the combination of the combination of the combination of the combination of the combination
a48c6cc	1.290826	6.0	discard	Add 10% linear LR warmup at start of training for more stable early optimization	The aim of this study was to investigate the effect of a new species on the basis of the effect of the species on the species of the species on the species of the species. The species of the species of the species of the species of the species of the species of the species of the species of the species of species. The species of species is the species of species, and species species are species of species species. The species species are species of species species, and species species species species, and
b0adde5	1.222807	6.0	discard	Change MLP activation from ReLU squared to GELU for smoother gradients and better optimization	The aim of this study was to investigate the effect of the 2) and 3,4,4,4,4,4,4,4,4,4,4,4,4,4,4,4,4,4,4,4,4,4,4,4,4,4,4,4,4,4,4,4,4,4,4,4,4,4,4,4,4,4
0594d37	1.196740	6.0	discard	Set final LR fraction to 0.01 to avoid LR dropping to exactly zero at end of training, maintaining small updates for final convergence	The aim of this study was to evaluate the effect of the 3D printing and the effect of the 3D printing on the growth of the 3D 3D 3D 3D 3D 3D 3D 3D 3D 3D 3D 3D 3D 3D 3D 3D 3D 3D 3D 3D 3D 3D
af073d3	1.151381	6.0	discard	Increase embedding learning rate from 0.6 to 0.8 for faster convergence of token embeddings during the short 5-minute training window	The aim of this study was to evaluate the effect of the treatment of the treatment of chronic hepatitis C virus (HCV) and to evaluate the effect of the treatment on the outcome of hepatitis C virus (HCV) and hepatitis C virus (HCV) in patients with hepatitis C virus (HCV) and hepatitis C virus (HCV) hepatitis C virus (HCV) infection.The aim of this study was to evaluate the effect of a single dose of 100 mg/kg
6db3e37	1.114396	6.0	discard	Remove z-loss regularization and delay LR warmdown to last 25% of training for longer high-LR optimization with sharper predictions	The aim of this study was to evaluate the effect of a 3-year-old man with a 3-year-old man with a 3-year history of a 3-year-old man with a 3-year history of a 3-year-old man with a 3-year history of a 3-year history of a 3-year history of a 3-year history of a 3-year history of a 3-year history of a 3-year history of a 3-year history of a
456e863	1.147900	6.0	discard	Increase embedding weight decay from 0.001 to 0.003 for stronger regularization on token embeddings	The aim of this study was to evaluate the effect of a 2-year-old man with a 2-year-old man with a 2-year-old man with a 2-year-old man with a 2-year history of a 2-year-old man with a 2-year history of a 2-year-old man with a 2-year history of a 2-year-old man with a 2-year history of a 2-year-old man with a 2-year history of a 2
b906745	1.149619	6.0	discard	Reduce sliding window size from half to quarter sequence length (//4 instead of //2) for higher throughput in short-window layers, allowing more training steps within the 5-minute budget	The aim of this study was to evaluate the effect of a 3-year-old man with a 3-year-old man with a 3-year-old man with a history of a 3-year-old man with a history of a history of a history of a history of a history of a history of a history of a history of a history of a history of a history of a history of a history of a history of a history of a history of a history of a history of a history of a
49c2cdb	1.124618	6.0	discard	Delay LR warmdown to last 10% of training (WARMDOWN_RATIO=0.1) for extended high-LR optimization	The aim of this study was to evaluate the effect of a 2-minute period on the growth and growth of a 2-minute periodontal disease (FDD) in patients with a 2-minute periodontal disease (FDD) and to compare the effects of a 2-minute periodontal disease (FDD) on the growth and growth and growth of FDD. FDD was a 2-minute period of
532e87d	1.109444	6.0	discard	Increase matrix learning rate from 0.04 to 0.06 for faster convergence of transformer parameters within the 5-minute budget	The aim of this study was to investigate the effect of the 2D printing on the growth of the human breast cancer cell line (HCC) cell line. The cell line was used to study the effect of the 2D printing on the growth of HCC cells. The cell line was used to study the growth of HCC cells. The cell line was used to study the growth and growth of HCC cells. The cell line was used to study the growth and
5a51e32	0.000000	0.0	crash	Tie value embeddings to input token embeddings (wte) instead of separate parameters for better gradient flow and parameter efficiency [Traceback (most recent call last):
4a36652	1.095307	6.0	discard	Add gradient centralization to AdamW parameters (subtract mean gradient across feature dims)	The aim of this study was to determine the effect of the 2- and 3- and 3- and 3- and 3- and 3- and 3- and 3- and 3- and 3- and 3- and 3- and 3- and 3- and 3- and 3- and 3- and 3- and 3- and 3- and 3- and 3- and
76ac180	1.095424	6.0	discard	Initialize value embedding gates to negative values (-3.0) so they start nearly closed (gate≈0.1), allowing the model to gradually learn to use value embeddings rather than starting with full contribution	The aim of this study was to investigate the effect of the 2,4-dimethyl-2,4-dimethyl-2,4-dimethyl-2,4-dimethyl-2,4-dimethyl-2,4-dimethyl-2,4-dimethyl-2,4-dimethyl-2,4-dimethyl-2,4-dimethyl-2,4-dimethyl-2,4-dimethyl-2,4-dimethyl-2,4-dimethyl-2,4
7631496	1.095995	6.0	discard	Lower adaptive gradient clipping floor from 0.3 to 0.2 to allow slightly larger gradient updates at end of training	The aim of this study was to determine the effect of the 2,3-dimethylthiopropylthiopropylthiopropylthiopropylthiopropylthiopropylthiopropylthiopropylthiopropylthiopropylthiopropylthiopropylthiopropylthiopropylthiopropylthiopropylthi
07efd9b	0.000000	0.0	crash	Implement curriculum learning by progressively increasing sequence length from 512 to MAX_SEQ_LEN over training to stabilize early optimization [^^^^^^^^^^^^^^^^^^^^^^^^^^^^^^^^^^^^^^^^^^^^^^
e4463e5	1.095870	6.0	discard	Delay adaptive gradient clipping decay to second half of training (maintain max clipping for first 50% of training, then cosine decay to 0.3)	The aim of this study was to determine the effect of the 2,3-dimethylthiopropylthiopropylthiopropylthiopropylthiopropylthiopropylthiopropylthiopropylthiopropylthiopropylthiopropylthiopropylthiopropylthiopropylthiopropylthiopropylthi
22d2d7f	1.097398	6.0	discard	Initialize value embeddings to zeros instead of uniform, allowing the model to gradually learn value residual contributions from scratch rather than starting with random projections	The aim of this study was to determine the effect of the presence of a 2,3-dimethylammonium chloride (DC) on the expression of the human epidermal growth factor receptor (EGFR) and the expression of EGFR in human breast cancer cells. The EGFR was detected in 100% of the cells, and the expression of EGFR was detected in 100% of cells. EGFR was detected in 100% of cells, and EGFR
9652b76	1.091390	7.5	discard	Add Gaussian noise (std=0.1) to logits during training for regularization	The aim of this study was to determine the effect of the use of a combination of a combination of a combination of a combination of a combination of a combination of a combination of a combination of a combination of a combination of a combination of a combination of a combination of a combination of a combination of a combination of a combination of a combination of a combination of a combination of a combination of a combination of a combination of a combination of a combination of a combination of a combination of a combination of a combination
931149e	1.047155	5.5	keep	Reduce MLP expansion ratio from 4x to 3x to decrease FLOPs and allow more training steps within the 5-minute budget	The aim of this study was to investigate the effects of the use of the combination of the combination of the combination of the combination of the combination of the combination of the combination of the combination of the combination of the combination of the combination of the combination of the combination of the combination of the combination of the combination of the combination of the combination of the combination of the combination of the combination of the combination of the combination of the combination of the combination of the combination of the combination of the combination of the combination
6606600	1.002179	4.2	keep	Reduce ASPECT_RATIO from 64 to 48 to decrease model width from 768 to 640 dims, reducing FLOPs per step by ~30% to allow significantly more training steps within the 5-minute budget	The effect of the 5-HT1A receptor antagonist, 5-HT1A, on the release of the 5-HT1A receptor in the rat was studied. The effect of 5-HT1A on the release of the 5-HT1A receptor was studied. The effect of 5-HT1A on the release of the 5-HT1A receptor was studied. The effect of 5-HT1A on the release of the 5-HT1A receptor was studied
b1e4c7b	0.967300	2.9	keep	Further reduce ASPECT_RATIO from 48 to 32 to decrease model width from 640 to 384 dims, reducing FLOPs per step by ~42% to allow significantly more training steps within the 5-minute budget	The aim of this study was to evaluate the effect of the presence of a single dose of 1.5 mg/kg of body weight on the development of the development of the development of the development of the development of the development of the development of the development of the development of the development of the development of the development of the development of the development of the development of the development of the development of the development of the development of the development of the development of the development of the development of the development of
a2dec57	1.006807	1.7	discard	Reduce ASPECT_RATIO from 32 to 16 to further decrease model width from 384 to 256 dims, allowing significantly more training steps within the 5-minute budget	The aim of this study was to investigate the effect of the combination of the combination of the combination of the combination of the combination of the combination of the combination of the combination of the combination of the combination of the combination of the combination of the combination of the combination of the combination of the combination of the combination of the combination of the combination of the combination of the combination of the combination of the combination of the combination of the combination of the combination of the combination of the combination of the combination of the combination
d6db17e	1.189740	6.7	discard	Reduce HEAD_DIM from 128 to 96 to increase attention heads from 3 to 4 for better representational capacity without changing model dimension or FLOPs	The aim of this study was to determine the effect of the presence of a single dose of 0.5 mg/kg body weight (BW) on the basis of the results of the study. The study was conducted in 20 patients with chronic obstructive pulmonary disease (COPD) and 10 healthy controls. The study was conducted in 20 patients with COPD and 10 healthy controls. The mean age of the patients was 0.5 years. The mean age of the patients
-------	0.000000	0.0	crash	FAILED TO APPLY: Use grouped-query attention (GQA) by halving n_kv_head to reduce KV cache computation and memory, allowing more training steps within the time budget while maintaining model expressiveness through multi-query attention (MQA) when heads=3 becomes 1	
