commit	val_bpb	memory_gb	status	description	sample_text
0063442	1.152597	6.0	keep	baseline	The aim of this study was to evaluate the effect of the use of a combination of a combination of a combination of a combination of a combination of a combination of a combination of a combination of a combination of a combination of a combination of a combination of a combination of a combination of a combination of a combination of a combination of a combination of a combination of a combination of a combination of a combination of a combination of a combination of a combination of a combination of a combination of a combination of a combination
da5b2b7	1.198987	6.0	discard	Increase WARMDOWN_RATIO from 0.5 to 0.75 for more aggressive LR cooldown over 75% of training time instead of 50%, allowing more steps at lower learning rates near convergence	The aim of this study was to evaluate the effect of a single dose of 1 mg/kg of 1 mg/kg of 1 mg/kg of 1 mg/kg of 1 mg/kg of 1 mg/kg of 1 mg/kg of 1 mg/kg of 1 mg/kg of 1 mg/kg of 1 mg/kg of 1 mg/kg of 1 mg/kg of 1 mg/kg of 1 mg/kg of 1 mg/kg. The dose of 1
2bd43b5	1.088085	6.0	keep	Increase weight decay on embedding layers (wte, lm_head, value_embeds) from 0.001 to 0.003	The aim of this study was to determine the effect of the 2,3-dihydroxy-4-oxo-4-oxo-4-oxo-4-oxo-4-oxo-4-oxo-4-oxo-4-oxo-4-oxo-4-oxo-4-oxo-4-oxo-4-oxo-4-oxo-4-oxo-4-oxo-
b37e7c1	1.092454	6.0	discard	Replace linear LR warmdown with cosine annealing for smoother learning rate decay	The aim of this study was to determine the effect of the combination of the combination of the combination of the combination of the combination of the combination of the combination of the combination of the combination of the combination of the combination of the combination of the combination of the combination of the combination of the combination of the combination of the combination of the combination of the combination of the combination of the combination of the combination of the combination of the combination of the combination of the combination of the combination of the combination of the combination
6dc7f84	1.361798	7.0	discard	Add label smoothing (0.1) to cross-entropy loss to improve generalization and reduce model overconfidence	The aim of this study was to determine the effect of a single dose of 100 mg of 100 mg of 100 mg of 100 mg of 100 mg of 100 mg of 100 mg of 100 mg of 100 mg of 100 mg of 100 mg of 100 mg of 100 mg of 100 mg of 100 mg of 100 mg of 100 mg of
f9978df	1.089656	6.3	discard	Add 0.1 dropout to residual connections in transformer blocks to reduce overfitting	The aim of this study was to determine the effect of the combination of the combination of the combination of the combination of the combination of the combination of the combination of the combination of the combination of the combination of the combination of the combination of the combination of the combination of the combination of the combination of the combination of the combination of the combination of the combination of the combination of the combination of the combination of the combination of the combination of the combination of the combination of the combination of the combination of the combination
13f79f4	1.097502	6.0	discard	Increase z-loss coefficient from 1e-4 to 1e-3 for stronger logit regularization	The aim of this study was to determine the effect of the 5-fluorouracil (5-FU) on the expression of the 5-fluorouracil (5-FU) in the rat liver. The 5-FU was injected with 5-FU (5-FU) or 5-FU (5-FU) in the rat liver. The 5-FU was injected with 5-FU (5-FU) or 5-FU
b524e8b	1.134669	6.0	discard	Add 5% linear LR warmup at the start of training to stabilize early optimization	The aim of this study was to determine the effect of the 2-oxo-3-oxo-3-oxo-3-oxo-3-oxo-3-oxo-3-oxo-3-oxo-3-oxo-3-oxo-3-oxo-3-oxo-3-oxo-3-oxo-3-oxo-3-oxo-3-oxo-3-
8b493de	1.152644	6.0	discard	Reduce logits softcap from 12 to 8 for stronger regularization	The aim of this study was to investigate the effect of a 3-year-old man with a 3-year-old man with a history of a history of a history of a history of a history of a history of a history of a history of a history of a history of a history of a history of a history of a history of a history of a history of a history of a history of a history of a history of a history of a history of a history of a history of a history of
d171e9e	1.128078	6.0	discard	Add 0.1 dropout to token embeddings (wte) to reduce overfitting	The aim of this study was to investigate the effect of a new method of the method of the method of the method of the method of the method of the method of the method of the method of the method of the method of the method of the method of the method of the method of the method of the method of the method of the method of the method of the method of the method of the method of the method of method of the method of method of the method of method of method of method of
db58fd8	1.147484	6.0	discard	Change RoPE base frequency from 50000 to 10000 for improved long-range dependency modeling	The aim of this study was to evaluate the effect of a new method for the treatment of chronic hepatitis C virus (HCV) infection in patients with chronic hepatitis C virus (HCV) and hepatitis C virus (HCV) infection.The aim of this study was to evaluate the effect of a single dose of 100 mg of 100 mg/kg of 100 mg/kg of 100 mg/kg of 100 mg/kg of 100 mg/kg of
50e989e	1.118429	6.5	discard	Add stochastic depth (layer dropout) with 10% drop probability to transformer blocks for regularization	The aim of this study was to investigate the effect of a combination of a combination of a combination of a combination of a combination of a combination of a combination of a combination of a combination of a combination of a combination of a combination of a combination of a combination of a combination of a combination of a combination of a combination of a combination of a combination of a combination of a combination of a combination of a combination of a combination of a combination of a combination of a combination of a combination of a combination
2bd6ffa	1.089653	6.0	discard	Increase weight decay on embedding layers (wte, lm_head, value_embeds) from 0.001 to 0.005 for stronger regularization	The aim of this study was to determine the effect of the 2,3-diphenyl-2,3,4-diphenyl-2,3,4-diphenyl-2,3,4-diphenyl-2,3,4-diphenyl-2,3,4-diphenyl-2,3,4-diphenyl-2,3,4-diphenyl-2,3,4-diphenyl-2,3,4-diphenyl
bf6af6e	1.108049	6.0	discard	Change MLP activation from ReLU^2 to GELU for smoother gradients and better optimization	The aim of this study was to determine the effect of the treatment of the 5-minute dose of 5-minute dose of 5-minute dose of 5-minute dose of 5-minute dose of 5-minute dose of 5-minute dose of 5-minute dose of 5-minute dose of 5-minute dose of 5-minute dose of 5-minute dose of
0d312c0	1.089291	6.0	discard	Change attention window pattern from SSSL to SSSS to use shorter windows in all layers except last, increasing training throughput for more steps in the fixed time budget	The aim of this study was to determine the effect of the 2,3-dihydroxy-3,4-dihydroxy-3,4-dihydroxy-3,4-dihydroxy-3,4-dihydroxy-3,4-dihydroxy-3,4-dihydroxy-3,4-dihydroxy-3,4-dihydroxy-3,4-dihydroxy-3,4-dihydroxy-3,4-dihydroxy-3,4
4ea37db	1.081410	6.0	keep	Initialize x0_lambdas to 0.2 instead of 0.1 for stronger deep residual skip connections from input	The aim of this study was to determine the effect of the administration of a 3,4-dinitrophenyl (DDD) on the expression of the growth factor receptor (TGFR) in the rat brain. The effect of the DDD on the expression of the growth factor receptor (TGFR) in the rat brain was examined. The results showed that the DDDDDDDDDDDDDDDDDDDDD
4b8ebf5	1.072322	6.0	keep	Initialize resid_lambdas to 0.9 instead of 1.0 to reduce main residual path weight and complement strong x0 skip connections	The aim of this study was to investigate the effect of the combination of the combination of the combination of the combination of the combination of the combination of the combination of the combination of the combination of the combination of the combination of the combination of the combination of the combination of the combination of the combination of the combination of the combination of the combination of the combination of the combination of the combination of the combination of the combination of the combination of the combination of the combination of the combination of the combination of the combination
6e6b42e	1.101651	6.0	discard	Increase logits softcap from 12 to 20 to allow higher logit magnitudes before tanh saturation	The aim of this study was to investigate the effect of a combination of a combination of a combination of a combination of a combination of a combination of a combination of a combination of a combination of a combination of a combination of a combination of a combination of a combination of a combination of a combination of a combination of a combination of a combination of a combination of a combination of a combination of a combination of a combination of a combination of a combination of a combination of a combination of a combination of a combination
acc9c83	1.115209	5.8	discard	Share value embeddings across all layers instead of separate per-layer embeddings	The aim of this study was to evaluate the effect of a single dose of a single dose of 0.1 mg/kg of a dose of 0.1 mg/kg of a dose of 0.1 mg/kg of a dose of 0.1 mg/kg of 0.1 mg/kg of 0.1 mg/kg of 0.1 mg/kg of 0.1 mg/kg of 0.1 mg/kg of 0.1 mg/kg of 0
7502b95	1.117768	6.0	discard	Align value embeddings Adam betas with regular embeddings (0.8, 0.95) instead of (0.9, 0.999) for potentially faster adaptation of value residual connections	The aim of this study was to investigate the effect of a single-crystal X-ray diffraction (XRD) on the growth of a single-crystal XRD (XRD) and a single-crystal XRD (XRD) on the growth of a single-crystal XRD. The XRD was used to determine the growth of a single-crystal XRD (XRD) and a single-crystal XRD (X
19fd387	1.084327	6.0	discard	Initialize resid_lambdas to 0.9 and x0_lambdas to 0.2 to combine deep residual skip connections with reduced main path weight	The aim of this study was to investigate the effect of the anti-inflammatory effect of the anti-inflammatory effect of the anti-inflammatory effect of the anti-inflammatory effect of the anti-inflammatory effect of the anti-inflammatory effect of the anti-inflammatory effect of the anti-inflammatory effect of the anti-inflammatory effect of the anti-inflammatory effect of the anti-inflammatory effect of the anti-inflammatory effect of the anti-inflammatory effect of the anti-inflammatory effect of the anti-inflammatory effect of the anti-inflammatory effect of the anti-inflammatory effect of the anti-inflammatory effect
ac30877	1.064271	6.0	keep	Initialize resid_lambdas to 0.8 for stronger residual path reduction	The aim of this study was to determine the effect of a single dose of 100 mg of 100 mg of 100 mg of 100 mg of 100 mg of 100 mg of 100 mg of 100 mg of 100 mg of 100 mg of 100 mg of 100 mg of 100 mg of 100 mg of 100 mg of 100 mg of 100 mg of
6ffef37	1.073661	6.0	discard	Reduce weight decay from 0.2 to 0.1 for less regularization on matrix parameters (Muon), potentially improving fitting in the limited training time.	The aim of this study was to determine the effect of the 5-HT2 receptor antagonist, 5-HT2A receptor antagonist, on the expression of the 5-HT2 receptor antagonist, 5-HT2A receptor antagonist, and 5-HT2A receptor antagonist, on the expression of the 5-HT2 receptor antagonist, 5-HT2A receptor antagonist, and 5-HT2A receptor antagonist, 5-HT2A receptor antagonist, 5-HT2A receptor antagonist
18d7a3e	0.000000	0.0	crash	Initialize resid_lambdas with linear decay from 1.0 to 0.6 across layers instead of constant 1.0, providing stronger residual paths in early layers and weaker in deeper layers while maintaining mean around 0.8 (the current best constant value) [return compiled_fn(runtime_args)
3126f72	1.085916	6.0	discard	Remove z-loss regularization by zeroing its coefficient to reduce gradient noise and potential interference during the short 5-minute training run	The aim of this study was to determine the effect of the 2,3-dihydroxy-3,4-dihydroxy-3,4-dihydroxy-3,4-dihydroxy-3,4-dihydroxy-3,4-dihydroxy-3,4-dihydroxy-3,4-dihydroxy-3,4-dihydroxy-3,4-dihydroxy-3,4-dihydroxy-3,4-dihydroxy-3,4
50446ff	1.079136	6.0	discard	Initialize resid_lambdas to 0.75 for stronger residual path reduction	The aim of this study was to determine the effect of the administration of a 2,4-dihydroxy-2,4-dihydroxy-2,4-dihydroxy-2,4-dihydroxy-2,4-dihydroxy-2,4-dihydroxy-2,4-dihydroxy-2,4-dihydroxy-2,4-dihydroxy-2,4-dihydroxy-2,4-dihydroxy-2,4-dihydroxy-
23d57ed	1.086862	6.0	discard	Change attention window pattern from SSSL to LLSS to use more long-range attention layers (50% instead of 25%), trading throughput for better long-range dependency modeling capacity	The aim of this study was to determine the effect of the 2,3-dihydroxy-3,4-dihydroxy-4,5-dihydroxy-4,5-dihydroxy-4,5-dihydroxy-4,5-dihydroxy-4,5-dihydroxy-4,5-dihydroxy-4,5-dihydroxy-4,5-dihydroxy-4,5-dihydroxy-4,5-dihydroxy-4,5
3c24f04	1.112826	6.0	discard	Replace MLP activation from ReLU^2 to SiLU (Swish) for improved gradient flow and expressivity	The aim of this study was to determine the effect of a single dose of 100 mg/kg bwwwwwwwwwwwwwwwwwwwwwwwwwwwwwwwwwwwwwwwwwwwwwwwwwwwwwwwwwwwwwwwwwwwwwwwwwwwwwww
67b8a99	1.081730	5.7	discard	Switch from multi-head attention to grouped-query attention (GQA) by reducing n_kv_head from 6 to 2, cutting KV cache memory bandwidth and FLOPs to increase training throughput (more steps in 5 min)	The aim of this study was to evaluate the effects of the 3-hydroxytryptamine (3H) receptor antagonist, 3-hydroxytryptamine (3H) and 3H,3H,3H,3H,3H,3H,3H,3H,3H,3H,3H,3H,3H,3H,3H,3H,3H,3H,3H,3H,3H,
6439e8c	0.000000	0.0	crash	Add bias terms to all linear layers in transformer blocks (attention Q/K/V/proj and MLP fc/proj) to improve optimization capacity [Traceback (most recent call last):
89ece58	1.075239	6.0	discard	Remove internal residual connection in MLP to standardize transformer block structure (avoid double addition of normalized input)	The aim of this study was to determine the effect of the presence of a 3,4-diphenyl-1,4-diphenyl-1,4-diphenyl-1,4-diphenyl-1,4-diphenyl-1,4-diphenyl-1,4-diphenyl-1,4-diphenyl-1,4-diphenyl-1,4-diphenyl-1,4-diphenyl-1,4-diphenyl-
48b4882	1.115110	6.0	discard	Initialize x0_lambdas to 0.0 instead of 0.1 to disable deep residual skip connections initially, forcing the model to learn them from scratch	The aim of this study was to determine the effect of the administration of a 2.5 mg/kg of 2.5 mg/kg of 2.5 mg/kg of 2.5 mg/kg of 2.5 mg/kg of 2.5 mg/kg of 2.5 mg/kg of 2.5 mg/kg of 2.5 mg/kg of 2.5 mg/kg of 2.5 mg/kg of 2.5 mg/kg of
6edd245	1.058563	6.0	keep	Combine best residual config: init resid_lambdas to 0.8 (current best) and x0_lambdas to 0.2 (near-miss) for stronger deep skip connections with reduced main path	The aim of this study was to determine the effect of the combination of the combination of the combination of the combination of the combination of combination of combination of combination of combination of combination of combination of combination of combination of combination of combination of combination of combination of combination of combination of combination of combination of combination of combination of combination of combination of combination of combination of combination of combination of combination of combination of combination of combination of combination of combination of combination of combination of combination of combination of combination of combination of combination of
99d9a1a	1.059841	6.0	discard	Remove weight decay on all embedding parameters (wte, lm_head, value_embeds) to reduce regularization on high-dimensional sparse update parameters, potentially improving convergence in the limited 5-minute training window.	The aim of this study was to determine the effect of the 5-HT2A receptor antagonist, 5-HT2A receptor antagonist, on the effects of 5-HT2A receptor antagonist, 5-HT2A receptor antagonist, on the effects of 5-HT2A receptor antagonist, 5-HT2A receptor antagonist, 5-HT2A receptor antagonist, 5-HT2A receptor antagonist, 5-HT2A receptor antagonist, 5-HT2A receptor antagonist,
03c4275	1.083707	6.0	discard	Use constant gradient clipping at max_norm=1.0 instead of adaptive cosine schedule decaying to 0.3, providing consistent gradient scaling throughout training	The aim of this study was to determine the effect of the 2,3-dihydroxyvitamin D3 (2,3-dihydroxyvitamin D3) on the expression of the 2,3-dihydroxyvitamin D3 (2,3-dihydroxyvitamin D3) in the rat. The 2,3-dihydroxyvitamin D3 was administered to rats with 2,3-dihydroxyvitamin D3 (2,3-di
3e400bb	1.083408	6.0	discard	Reduce z-loss coefficient from 1e-4 to 5e-5 for less aggressive logit regularization	The aim of this study was to determine the effect of the use of a combination of a combination of a combination of a combination of a combination of a combination of a combination of a combination of a combination of a combination of a combination of a combination of a combination of a combination of a combination of a combination of a combination of a combination of a combination of a combination of a combination of a combination of a combination of a combination of a combination of a combination of a combination of a combination of a combination
b33b68f	1.063824	6.0	discard	Combine best residual initialization (resid_lambda=0.8, x0_lambda=0.2) with zero weight decay on all embedding parameters (wte, lm_head, value_embeds) to reduce regularization on high-dimensional sparse updates while maintaining strong deep skip connections	The aim of this study was to determine the effect of the administration of the 5-HT2A receptor antagonist, 5-HT2A receptor antagonist, on the expression of the 5-HT2A receptor in the rat brain. The 5-HT2A receptor antagonist, 5-HT2A receptor antagonist, 5-HT2A receptor antagonist, 5-HT2A receptor antagonist, 5-HT2A receptor antagonist, 5-HT2A receptor antagonist, 5-HT2
4b6bf6d	1.073591	6.0	discard	Set final LR fraction to 0.1 to prevent learning rate from decaying to exactly zero, allowing small adaptive updates until the end of the short training window	The purpose of this study was to evaluate the effect of the use of a combination of a combination of a combination of a combination of a combination of a combination of a combination of a combination of a combination of a combination of a combination of a combination of a combination of a combination of a combination of a combination of a combination of a combination of a combination of a combination of a combination of a combination of a combination of a combination of a combination of a combination of a combination of a combination of a combination
69432b4	1.086240	6.0	discard	Change gradient clipping from adaptive cosine decay (1.0 to 0.3) to linear decay (1.0 to 0.5) for less aggressive clipping at the end of training	The aim of this study was to determine the effect of the 2,3-dihydroxyvitamin D3 (2,3-dihydroxyvitamin D3) on the growth of the human liver. The study was performed on the effects of 2,3-dihydroxyvitamin D3 on the growth of the liver. The results showed that the 2,3-dihydroxyvitamin D3 was significantly reduced in the liver, liver, and liver. The 2
10fdde0	1.075191	6.0	discard	Apply temperature scaling of 0.8 to logits before softcap to sharpen prediction distribution and accelerate convergence in the limited training window	The aim of this study was to determine the effect of the 2,4-dihydroxyvitamin D on the development of the heart and heart. The study was performed on 12 patients with heart failure (HF) and 12 patients with HF. The heart rate was 1.5 +/- 0.1 ml/min/min/min/min/min/min/min/min/min/min/min/min/min/min/min/min/min/min/min/min/min/min/min/min/min/min/min/min/min/min/min/min/min/min
4423b7a	1.075337	6.0	discard	Apply attention temperature scaling by multiplying queries by 1.2 after QK normalization to sharpen attention distribution and accelerate convergence	The aim of this study was to determine the effect of the use of a combination of a combination of a combination of a combination of a combination of a combination of a combination of a combination of a combination of a combination of a combination of a combination of a combination of a combination of a combination of a combination of a combination of a combination of a combination of a combination of a combination of a combination of a combination of a combination of a combination of a combination of a combination of a combination of a combination
0e0d7ec	1.082720	6.0	discard	Initialize value embeddings to zero instead of uniform random to reduce initial noise in the value residual path, allowing the model to gradually learn value embeddings from scratch while starting with standard attention values	The aim of this study was to determine the effect of the presence of a 2,3-dihydroxy-4,5-dihydroxy-4,5-dihydroxy-4,5-dihydroxy-4,5-dihydroxy-4,5-dihydroxy-4,5-dihydroxy-4,5-dihydroxy-4,5-dihydroxy-4,5-dihydroxy-4,5-dihydroxy-4,5-dihydroxy-
