commit	val_bpb	memory_gb	status	description	sample_text
d8e94ba	1.082508	6.0	discard	Set logit softcap to 30 for moderate regularization between baseline (12) and previously tried loose values (50/10000)	The aim of this study was to evaluate the effect of the use of a combination of the combination of the combination of the combination of the combination of the combination of the combination of the combination of the combination of the combination of the combination of the combination of the combination of the combination of the combination of the combination of the combination of the combination of the combination of the combination of the combination of the combination of the combination of the combination of the combination of combination of the combination of combination of the combination of combination
610b383	1.102107	5.8	discard	Remove Value Embeddings (VE) entirely by disabling them in all layers to reduce parameter count (~75M params) and computation, allowing significantly more training steps within the 5-minute budget while maintaining the optimal model width of 384 dims (ASPECT_RATIO=32)	The aim of this study was to determine the effect of the 2,2,2,2,2,2,2,2,2,2,2,2,2,2,2,2,2,2,2,2,2,2,2,2,2,2,2,2,2,2,2,2,2,2,2,2,2,2,2,2,2,2,2,2
e8d5220	1.154321	6.0	discard	Reduce HEAD_DIM from 128 to 64 to increase attention heads from 3 to 6 with ASPECT_RATIO=32 (384 dims), using narrower heads for potentially better representation and memory efficiency	The purpose of this study was to determine the effect of the combination of the combination of the combination of the combination of the combination of the combination of the combination of the combination of the combination of the combination of the combination of the combination of the combination of the combination of the combination of the combination of the combination of the combination of the combination of the combination of the combination of the combination of the combination of the combination of the combination of the combination of the combination of the combination of the combination of the combination
3ab811c	1.086142	6.0	discard	Add Gaussian noise (std=0.02) to input embeddings during training as data augmentation	The aim of this study was to determine the effect of the administration of the 1,2-dihydroxy-2,3-dihydroxy-4,5-dihydroxy-2,3-dihydroxy-4,5-dihydroxy-4,5-dihydroxy-4,5-dihydroxy-4,5-dihydroxy-4,5-dihydroxy-4,5-dihydroxy-4,5-dihydroxy-4,5-dihydroxy-
c242855	0.965294	2.9	keep	Combine optimal ASPECT_RATIO=32 (384 dims) with 3x MLP expansion to maximize training steps while maintaining sufficient model capacity	The aim of this study was to investigate the effect of the presence of a single nucleotide polymorphism (SNP) in the 5'UTR of the 5'UTR of the 5'UTR of the 5'UTR of the 5'UTR of the 5'UTR of the 5'UTR of the 5'UTR of the 5'UTR of the 5'UTR of the 5'UTR of
bf8eda2	0.965193	2.9	keep	Change window pattern to SS to reduce long attention layers from 3 to 1, allowing ~15% more training steps within the 5-minute budget while maintaining minimal global context via the final forced long layer	The aim of this study was to investigate the effect of the combination of the combination of the combination of the combination of the combination of the combination of the combination of the combination of the combination of the combination of the combination of the combination of the combination of the combination of the combination of the combination of the combination of the combination of the combination of the combination of the combination of the combination of the combination of the combination of the combination of the combination of the combination of the combination of the combination of the combination
9c6b3d8	0.970039	2.7	discard	Reduce MLP expansion ratio from 3x to 2x to decrease FLOPs per step by ~33%, allowing significantly more training steps within the 5-minute budget while maintaining the optimal model width of 384 dims (ASPECT_RATIO=32)	The aim of this study was to evaluate the effect of the use of a 2-minute dose of 2-minute dose of 2-minute dose of 2-minute dose of 2-minute dose of 2-minute dose of 2-minute dose of 2-minute dose of 2-minute dose of 2-minute dose of 2-minute dose of 2-minute dose of
a76378b	1.083771	6.0	discard	Increase sliding window size for 'S' layers from half to three-quarters of sequence length (1536 instead of 1024) to capture longer-range dependencies in local attention layers while maintaining throughput advantage over full attention	The aim of this study was to determine the effect of the 2,3-dihydroxy-3,4-dihydroxy-4,5-dihydroxy-4,5-dihydroxy-4,5-dihydroxy-4,5-dihydroxy-4,5-dihydroxy-4,5-dihydroxy-4,5-dihydroxy-4,5-dihydroxy-4,5-dihydroxy-4,5-dihydroxy-4,5
8e128ac	0.967283	2.9	discard	Optimal narrow configuration: ASPECT_RATIO=32 (384 dims, 12 heads) with 3x MLP expansion for 42% FLOPs reduction, combined with full-dimension value embedding gates (use all input channels instead of 32) for better residual routing	The aim of this study was to investigate the effect of the 3rd-3d-3d-3d-3d-3d-3d-3d-3d-3d-3d-3d-3d-3d-3d-3d-3d-3d-3d-3d-3d-3d-3d-3d-3d-3d-3d-3d-3d
5c38969	1.065916	6.0	discard	Remove internal residual connection in MLP to fix double residual and achieve standard Pre-LN architecture	The aim of this study was to determine the effect of the 2,3-dihydroxy-4,5-dihydroxy-4,5-dihydroxy-4,5-dihydroxy-4,5-dihydroxy-4,5-dihydroxy-4,5-dihydroxy-4,5-dihydroxy-4,5-dihydroxy-4,5-dihydroxy-4,5-dihydroxy-4,5-dihydroxy-4,5
9597a98	1.082781	6.0	discard	Use full input dimension for value embedding gates instead of fixed 32 channels to improve residual routing capacity	The aim of this study was to determine the effect of the antihypertensive agent of the antihypertensive agent of the antihypertensive agent of the antihypertensive agent of antihypertensive drugs. The antihypertensive agent of antihypertensive drugs was administered to 1.5 mg/kg of antihypertensive drugs. The antihypertensive agent was administered to 1.5 mg/kg of antihypertensive drugs. The antihypertensive agent was administered to 1.5 mg/kg of
347139f	0.966846	2.9	discard	Switch to optimal narrow configuration: ASPECT_RATIO=32, 3x MLP expansion, and SS window pattern for maximum training throughput	The aim of this study was to investigate the effect of the use of a new, a new, and a new, a new, and a new new, a new, a new, new, a new, new, new, new, new, new, new, new, new, new, new, new, new, new, new, new, new, new, new, new, new, new, new, new, new, new, new, new, new, new
2912dc4	1.089234	6.0	discard	Add 10% dropout to input token embeddings for regularization	The aim of this study was to determine the effect of a new method of measuring the effect of a new method on the effect of a new method of choice on the effect of a new method of choice on the effect of a new method of choice on the effect of a new method of choice on the effect of a new method of choice on the effect of a new method of choice on the effect of a new method of choice on the effect of a new method of choice on the effect of a new
ddc0d21	2.100530	3.0	discard	Adopt optimal narrow configuration (ASPECT_RATIO=32, 3x MLP expansion, SS window pattern) with exponential moving average (EMA) of parameters for improved generalization	The aim of this study was to investigate the effect of the combination of a combination of a combination of a combination of a combination of a combination of a combination of a combination of a combination of a combination of a combination of a combination of a combination of a combination of a combination of a combination of a combination of a combination of a combination of a combination of a combination of a combination of a combination of a combination of a combination of a combination of a combination of a combination of a combination of a combination
fd9e1c3	0.976928	2.9	discard	Switch to narrow configuration with ASPECT_RATIO=32, HEAD_DIM=64 (6 heads), 3x MLP expansion, and SS window pattern for improved throughput and representational capacity	The aim of this study was to investigate the effect of the use of a 1% sucrose solution on the growth of the growth of the human breast cancer cell line. The growth of the breast cancer cell line was evaluated by the growth of the breast cancer cell line, the growth of the breast cancer cell line, and the growth of the breast cancer cell line. The growth of the breast cancer cell line was evaluated by the growth of the breast cancer cell line, the growth of the breast cancer cell
b5c9fc2	0.968728	2.9	discard	Implement optimal narrow configuration (ASPECT_RATIO=32, 3x MLP, SS window) with increased logit softcap of 20 for sharper predictions	The aim of this study was to evaluate the effect of the use of a new antifungal agent, 2-(2,4-diphenyl-1,2,4-triazin-2-yl)phenyl-1,2,4-triazin-2-ylphenyl-1,2,4-triazin-2-ylphenyl-1,2,4-triazin-2-ylphenyl-1,2,4-triaz
de5e4f8	0.000000	0.0	crash	Combine optimal narrow configuration (ASPECT_RATIO=32, 3x MLP expansion, SS window pattern) with full-dimension value embedding gates to maximize training throughput and residual routing capacity [File "/home/pat/autoresearch/.venv/lib/python3.12/site-packages/torch/_prims_common/wrappers.py", li]	
74bd6e1	1.187187	6.7	discard	Reduce HEAD_DIM from 128 to 96 to increase attention heads from 3 to 4 with ASPECT_RATIO=32 (384 dims), improving representational capacity without changing FLOPs or memory	The aim of this study was to determine the effect of the treatment of the disease on the survival of patients with chronic lymphocytic leukemia (LCL) and to determine the effect of treatment on the survival of patients with lymphocytic leukemia (LCL) and to determine the effect of treatment on survival of patients with LCL.The aim of this study was to determine the effect of the treatment of chronic lymphocytic leukemia (CLL) on the survival of patients with lymphocytic leukemia (CLL
3e381d0	0.965003	2.9	keep	Apply optimal narrow configuration (ASPECT_RATIO=32, 3x MLP expansion, SS window) with reduced embedding weight decay of 0.0005 for less aggressive regularization on the narrower model's embeddings	The aim of this study was to evaluate the effect of the use of a new, non-ionic surfactant, surfactant, on the development of the in vitro and in vivo bioavailability of the surfactant, surfactant, surfactant, surfactant, surfactant, surfactant, surfactant, surfactant, surfactant, surfactant, surfactant, surfactant, surfactant, surfactant, surfactant, surfactant, surfactant, surfactant, surfactant, surfactant
c1040be	0.963350	2.9	keep	Remove z-loss regularization to simplify the loss function and potentially allow slightly sharper predictions with the current softcap of 12	The aim of this study was to evaluate the effect of the use of a new anti-oxidant, anti-oxidant, anti-inflammatory, anti-inflammatory, anti-inflammatory, anti-inflammatory, anti-inflammatory, anti-inflammatory, anti-inflammatory, anti-inflammatory, anti-inflammatory, anti-inflammatory, anti-inflammatory, anti-inflammatory, anti-inflammatory, anti-inflammatory, anti-inflammatory, anti-inflammatory, anti-inflammatory, anti-inflammatory, anti-inflammatory, anti-inflammatory, anti-inflammatory, anti-inflammatory, anti-inflammatory, anti-inflammatory, anti-inflammatory
ed8f7b1	0.993433	4.2	discard	Increase HEAD_DIM from 128 to 192 (reducing heads from 3 to 2) for wider attention heads with the narrow 384-dim configuration	The aim of this study was to determine the effect of the 5-HT2 receptor antagonist, 5-HT2A receptor antagonist, on the expression of the 5-HT2 receptor antagonist, 5-HT2A receptor antagonist, and 5-HT2A receptor antagonist, in the rat brain. The 5-HT2A receptor antagonist, 5-HT2A receptor antagonist, was administered to 5-HT2A receptor antagonist, 5-HT2A receptor antagonist, and 5
1226044	0.000000	0.0	crash	Apply optimal narrow configuration (ASPECT_RATIO=32, 3x MLP expansion, SS window pattern) and remove forced full-attention in final layer to increase training steps [File "/home/pat/autoresearch/.venv/lib/python3.12/site-packages/torch/_prims_common/wrappers.py", li]	
ba323b7	1.081982	6.0	discard	Initialize value embedding gates to -0.5 for starting gate values of ~0.76 (instead of 1.0), allowing the model to gradually open value residual connections rather than starting fully open	The aim of this study was to determine the effect of the 2,3-dihydro-2,3-dihydro-2,3-dihydro-2,3-dihydro-2,3-dihydro-2,3-dihydro-2,3-dihydro-2,3-dihydro-2,3-dihydro-2,3-dihydro-2,3-dihydro-2,3-dihydro-2,3-dihydro-2,3-dihydro-2,3
4de915e	0.962258	2.9	keep	Combine optimal narrow configuration (ASPECT_RATIO=32, 3x MLP expansion, SS window) with z-loss removal for maximum training throughput and sharper predictions	The aim of this study was to investigate the effect of the presence of a single dose of 0.1 mg/kg of 0.1 mg/kg of 0.1 mg/kg of 0.1 mg/kg of 0.1 mg/kg of 0.1 mg/kg of 0.1 mg/kg of 0.1 mg/kg of 0.1 mg/kg of 0.1 mg/kg of 0.1 mg/kg of 0.1 mg
cfd079b	0.000000	0.0	crash	Change linear LR warmdown to cosine annealing schedule for smoother learning rate decay at the end of training [step 00222 (50.0%) | loss: 3.242270 | lrm: 1.00 | dt: 679ms | tok/sec: 772,579 | mfu: 5.6% | epoch: ]	
7c79773	0.959492	2.9	keep	Optimal narrow configuration (ASPECT_RATIO=32, 3x MLP expansion, SS window pattern) without z-loss and using 10% final LR fraction to maintain small updates at convergence	The aim of this study was to evaluate the effect of the use of a combination of a combination of a combination of a combination of a combination of a combination of a combination of a combination of a combination of a combination of a combination of a combination of a combination of a combination of a combination of a combination of a combination of a combination of a combination of a combination of a combination of a combination of a combination of a combination of a combination of a combination of a combination of a combination of a combination
e29c321	0.958955	2.9	keep	Align value embeddings AdamW betas with input embeddings using (0.8, 0.95) for faster adaptation of residual connections	The aim of this study was to investigate the effect of the use of a new type of a new type of a new type of a new type of a new type of a new type of a new type of a new type of a new type of a new type of a new type of a new type of a new type of a new type of a new type of a new type of a new type of a new type of a new type of a new type of a new type of a new
06e9c3a	0.957069	2.9	keep	Remove deep residual connection by initializing x0_lambdas to 0.0 instead of 0.1, simplifying to standard Pre-LN residual path	The aim of this study was to evaluate the effect of the use of a single dose of a single dose of a single dose of a single dose of a single dose of a single dose of a single dose of a single dose of a single dose of a single dose of a single dose of a single dose of a single dose of a single dose of a single dose of a single dose of a single dose of a single dose of a single dose of a single dose of a single dose of a single
5fde318	0.961970	2.9	discard	Initialize resid_lambdas to 0.9 instead of 1.0 to reduce initial residual connection strength for potentially better gradient flow in the narrow configuration	The aim of this study was to investigate the effects of the use of a combination of a combination of a combination of a combination of a combination of a combination of a combination of a combination of a combination of a combination of a combination of a combination of a combination of a combination of a combination of a combination of a combination of a combination of a combination of a combination of a combination of a combination of a combination of a combination of a combination of a combination of a combination of a combination of a combination
3a89981	1.089091	6.0	discard	Change linear LR warmdown to cosine annealing schedule for smoother learning rate decay at the end of training	The aim of this study was to determine the effect of the combination of the combination of the combination of the combination of the combination of the combination of the combination of the combination of the combination of the combination of the combination of the combination of the combination of the combination of the combination of the combination of the combination of the combination of the combination of the combination of the combination of the combination of the combination of the combination of the combination of the combination of the combination of the combination of the combination of the combination
5e8143f	1.083520	6.0	discard	Increase value embedding gate channels from 32 to 64 for improved residual routing information flow without the overhead of full-dimension gating	The aim of this study was to determine the effect of the 2,3-dihydroxy-3,4-dihydroxy-4,5-dihydroxy-4,5-dihydroxy-3,4-dihydroxy-4,5-dihydroxy-4,5-dihydroxy-4,5-dihydroxy-4,5-dihydroxy-4,5-dihydroxy-4,5-dihydroxy-4,5-dihydroxy-4,5
8ec168a	1.056204	6.0	discard	Combine residual scaling optimizations: initialize resid_lambdas to 0.9 (weaker residual) and x0_lambdas to 0.0 (remove deep residual) for improved gradient flow	The aim of this study was to determine the effect of the administration of a single dose of 1.5 mg/kg bolus of 1.5 mg/kg bolus on the pharmacokinetics of 1.5 mg/kg bolus and 1.5 mg/kg bolus. The pharmacokinetics of 1.5 mg/kg bolus was determined by the pharmacokinetics of 1.5 mg/kg bolus. The pharmacokinetics of 1.5
888ce87	1.054131	6.0	discard	Scale token embedding initialization to match transformer weight initialization (std=s instead of 1.0) for better initial gradient flow	The aim of this study was to determine the effect of the addition of a new anti-inflammatory agent, a new anti-inflammatory agent, on the development of the rat model of acute myocardial infarction (AMI) in rats. The rats were divided into 3 groups: control group (n = 10) and control group (n = 10) group (n = 10) group (n = 10) group (n = 10) group (n = 10) group (
826ab2c	1.085145	6.0	discard	Add random token replacement data augmentation: randomly replace 1% of input tokens with random vocabulary IDs during training to improve regularization and robustness	The aim of this study was to determine the effect of the administration of the antihypertensive drugs on the development of the antihypertensive drugs of the treatment of the hypertension and the development of hypertension. The study was designed to determine the effect of the antihypertensive drugs on the development of hypertension and the development of hypertension. The study was designed to determine the effect of the antihypertensive drugs on the development of hypertension and hypertension. The study was designed to determine the effect of the antihypertensive
850d285	0.964960	2.9	discard	Switch to optimal narrow configuration: ASPECT_RATIO=32 (384 dims), 3x MLP expansion, and SS window pattern for maximum training throughput, allowing significantly more training steps within the 5-minute budget	The aim of this study was to investigate the effect of the combination of the combination of the combination of the combination of the combination of the combination of the combination of the combination of the combination of the combination of the combination of the combination of the combination of the combination of the combination of the combination of the combination of the combination of the combination of the combination of the combination of the combination of the combination of the combination of the combination of the combination of the combination of the combination of the combination of the combination
f3c6de2	1.081209	6.0	discard	Reduce z-loss regularization coefficient from 1e-4 to 5e-5 to halve the logit regularization penalty, allowing slightly sharper predictions while maintaining training stability	The aim of this study was to determine the effect of the administration of the anti-inflammatory drug (AN) on the expression of the anti-inflammatory cytokine interleukin (IL)-1beta (IL-1beta) and IL-1beta (IL-1beta) in the rat. The effect of AN on the expression of IL-1beta and IL-1beta in the rat was investigated. The effect of AN on the expression of IL-1beta and IL-1beta in
4953bef	0.000000	0.0	crash	Implement variable sequence length training by randomly truncating 50% of batches to lengths between 1024 and 2048, increasing training throughput (~25% faster attention) for more optimization steps within the 5-minute budget [^^^^^^^^^^^^^^^^^^^^^^^^^^^^^^^^^^^^^^^^^^^^^^
2da2309	1.090523	5.5	discard	Use parallel attention and MLP blocks (PaLM/GPT-J style) to reduce normalization operations and increase training throughput, allowing more optimization steps within the 5-minute budget	The aim of this study was to determine the effect of a new antidepressant, antidepressant, on the development of the antidepressant and antidepressant antidepressant, antidepressant, and antidepressant antidepressant. The antidepressant and antidepressant antidepressant antidepressant, antidepressant, antidepressant, antidepressant, antidepressant, antidepressant
cdd8761	1.083882	6.0	discard	Reduce token embedding weight decay from 0.001 to 0.0005 for less aggressive regularization on the wide model's embeddings during short training	The aim of this study was to determine the effect of the presence of a 2,3-dihydroxy-3,4-dihydroxy-3,4-dihydroxy-3,4-dihydroxy-3,4-dihydroxy-3,4-dihydroxy-3,4-dihydroxy-3,4-dihydroxy-3,4-dihydroxy-3,4-dihydroxy-3,4-dihydroxy-3,4-dihydroxy-
-------	0.000000	0.0	crash	FAILED TO APPLY: Apply layer-wise learning rate decay to Muon optimizer: use 0.9x learning rate for deeper transformer layers (second half of model) compared to early layers to stabilize training of higher-level representations	
