commit	val_bpb	memory_gb	status	description	sample_text
046ee47	0.972331	7.0	keep	Combine focal loss (gamma=2.5) with optimal residual initialization (resid_lambdas=0.8, x0_lambdas=0.2) and double learning rate for token embeddings (1.2) to maximize convergence speed	The aim of this study was to determine the effect of the use of a combination of a combination of a combination of a combination of a combination of a combination of a combination of a combination of a combination of a combination of a combination of a combination of a combination of a combination of a combination of a combination of a combination of a combination of a combination of a combination of a combination of a combination of a combination of a combination of a combination of a combination of a combination of a combination of a combination
a7307bb	0.979754	7.0	discard	Initialize value embedding gate weights to 1.0 instead of 0.0 for moderate initial gating strength (~1.46) between neutral (1.0) and the previously tested 2.0 (~1.76)	The aim of this study was to determine the effect of the concentration of the 2-ethoxy-2,3,4,5-trimethyl-2,3,4,5-trimethyl-2,3,4,5-trimethyl-2,3,4,5-trimethyl-2,3,4,5-trimethyl-2,3,4,5-trimethyl-2,3,4,5-trimethyl-2,3,4,5-trimethyl
9a00f60	1.063666	6.0	discard	Reduce WARMDOWN_RATIO from 0.5 to 0.25 to spend 75% of the training time at maximum learning rate instead of 50%, allowing more optimization steps at full LR before cooldown in the short 5-minute window.	The aim of this study was to evaluate the effect of the administration of the anti-inflammatory drug (ASA) and the anti-inflammatory drug (ASA) on the expression of the anti-inflammatory drug (ASA) and the anti-inflammatory drug (ASA) in the rat. ASA was administered to rats with ASA and ASA. ASA was administered to rats with ASA and ASA. ASA was administered to rats with ASA. ASA was administered to rats with A
f97edb3	1.087328	6.0	discard	Add a learnable bias term to the language modeling head (lm_head) and initialize it to zero, giving the model an adjustable per-token logit offset that can improve optimization flexibility.	The aim of this study was to determine the effect of the 2,3-dihydro-2,3-dihydro-2,3-dihydro-2,3-dihydro-2,3-dihydro-2,3-dihydro-2,3-dihydro-2,3-dihydro-2,3-dihydro-2,3-dihydro-2,3-dihydro-2,3-dihydro-2,3-dihydro-2,3-dihydro-2,3
0309540	1.082663	6.0	discard	Remove weight decay from residual path scalars (resid_lambdas) by setting weight_decay=0.0, allowing the residual weights to adapt freely without regularization pulling them toward zero	The aim of this study was to determine the effect of the 2,3-dihydroxy-2,3-dihydroxy-2,3-dihydroxy-2,3-dihydroxy-2,3-dihydroxy-2,3-dihydroxy-2,3-dihydroxy-2,3-dihydroxy-2,3-dihydroxy-2,3-dihydroxy-2,3-dihydroxy-2,3-dihydroxy-2,3
7d83625	0.968240	7.0	keep	Combine focal loss (gamma=2.5) with optimal residual initialization (resid_lambdas=0.8, x0_lambdas=0.2), double learning rate for token embeddings (1.2), and initialize VE gate weights to 1.0 for moderate initial gating strength	The aim of this study was to determine the effect of the 2nd weekly dose of 2, 3, 4, 5, 6, 8, and 12 weeks of age. The 2nd weekly dose of 2, 3, 4, 5, 6, 12, and 12 weeks of age was administered to 12 weeks of age. The 2nd weekly dose of 2, 3,
f00a247	0.970632	6.0	discard	Detach probability values (p_t) in focal loss to treat focal weights as constants during backprop, stabilizing gradients through the confidence weighting term	The aim of this study was to determine the effect of the combination of the combination of the combination of the combination of the combination of the combination of the combination of the combination of the combination of combination of the combination of combination of combination of combination of combination of combination of combination of combination of combination of combination of combination of combination of combination of combination of combination of combination of combination of combination of combination of combination of combination of combination of combination of combination of combination of combination of combination of combination of combination of combination
9362419	0.957437	6.0	keep	Implement focal loss (gamma=2.5) with temperature-scaled probabilities (T=0.8) for confidence weighting, combined with optimal residual initialization (resid_lambdas=0.8, x0_lambdas=0.2), doubled token embedding LR (1.2), and VE gate weight initialization of 1.0	The aim of this study was to determine the effect of the administration of the 5-HT2 receptor antagonist 5-HT2A receptor antagonist 5-HT2A receptor antagonist 5-HT2A receptor antagonist 5-HT2A receptor antagonist 5-HT2A receptor antagonist 5-HT2A receptor antagonist 5-HT2A receptor antagonist 5-HT2A receptor antagonist 5-HT2A receptor antagonist 5-HT2A receptor antagonist 5-HT2A receptor antagonist 5
bc8e27e	0.945984	8.0	keep	Remove torch.no_grad() from focal loss computation to allow gradients to flow through the focal weighting term (p_t), improving optimization signal	The aim of this study was to determine the effect of the 3,4,5-trimethyl-2,3,4,5-trimethyl-2,4,5-trimethyl-2,4,5-trimethyl-2,4,5-trimethyl-2,4,5-trimethyl-2,4,5-trimethyl-2,4,5-trimethyl-2,4,5-trimethyl-2,4,5-trimethyl-2,4,5
b19e454	0.000000	0.0	crash	Implement curriculum learning for sequence length: start with 512 tokens and linearly increase to MAX_SEQ_LEN over the first 50% of training time. This allows faster iterations early in training (more optimizer steps within the 5-minute budget) while still utilizing full context later for long-range dependency learning. [^^^^^^^^^^^^^^^^^^^^^^^^^^^^^^^^^^^^^^^^^^^^^^
2b308ed	1.099283	6.0	discard	Add 10% dropout to attention weights in scaled_dot_product_attention to regularize attention patterns during training	The aim of this study was to determine the effect of the 2,3-dihydroxy-3,4,4,5-dihydroxy-4,5-dihydroxy-1,3-dihydroxy-3,4-dihydroxy-4,5-dihydroxy-4,5-dihydroxy-4,5-dihydroxy-4,5-dihydroxy-1,4-dihydroxy-4,5-dihydroxy-4,5-dihydroxy
52cfc95	0.970378	7.0	discard	Implement focal loss with gamma=3.0 to sharpen focus on hard-to-predict tokens beyond the gamma=2.5 baseline, allowing gradients to flow through the focal weighting term (p_t) as in the best-performing configuration	The aim of this study was to determine the effect of the 2,3-diphenyl-1,3-diphenyl-1,3-diphenyl-1,3-diphenyl-1,3-diphenyl-1,3-diphenyl-1,3-diphenyl-1,3-diphenyl-1,3-diphenyl-1,3-diphenyl-1,3-diphenyl-1,3-diphenyl-1,3
d3f1f71	0.000000	0.0	crash	Implement focal loss with gamma=2.5, allowing gradients to flow through the focal weighting term (p_t) without detaching. This focuses training on hard examples while maintaining gradient flow through the probability calculation. [File "/home/pat/autoresearch/.venv/lib/python3.12/site-packages/torch/_subclasses/fake_tensor.py", l]	
edd01f6	0.965285	7.0	discard	Combine focal loss (gamma=2.5, no detach) with optimal deep residual initialization (resid_lambdas=0.8, x0_lambdas=0.2) and moderate VE gate initialization (1.0)	The aim of this study was to determine the effect of the 2,3,4,5-trisphosphate (PTP) on the expression of the 2,3,4,5-trisphosphate (PTP) in the rat liver. PTP was induced by the 2,3,4,5-trisphosphate (PTP) and 2,3,4,5-trisphosphate (PTP) in the liver. PTP was induced by PTP
72e6789	1.059736	6.0	discard	Apply gradient centralization by subtracting the mean from each parameter's gradient before the optimizer step, which improves training stability and convergence speed.	The aim of this study was to determine the effect of the 5-HT2A receptor antagonist, 5-HT2A receptor antagonist, on the effect of 5-HT2A receptor antagonist, on the effect of 5-HT2A receptor antagonist, on the effect of 5-HT2A receptor antagonist, on the effect of 5-HT2A receptor antagonist, on the effect of 5-HT2A receptor antagonist, on the effect of 5-HT2A receptor antagonist,
00b88e1	0.000000	0.0	crash	Use half sequence length (1024) to accelerate attention computation and fit more optimizer steps within the 5-minute budget [^^^^^^^^^^^^^^^^^^^^^^^^^^^^^^^^^^^^^^^^^^^^^^
385f862	1.089443	6.5	discard	Add 5% dropout to MLP intermediate activations (after ReLU^2) for regularization	The aim of this study was to determine the effect of the 2,3-dihydroxy-3,4-dihydroxy-3,4-dihydroxy-3,4-dihydroxy-3,4-dihydroxy-3,4-dihydroxy-3,4-dihydroxy-3,4-dihydroxy-3,4-dihydroxy-3,4-dihydroxy-3,4-dihydroxy-3,4-dihydroxy-3,4
