commit	val_bpb	memory_gb	status	description	sample_text
02680fa	1.107454	6.0	keep	baseline	The aim of this study was to determine the effect of the 2,3-dimethylthiopropylthiopropylthiopropylthiopropylthiopropylthiopropylthiopropylthiopropylthiopropylthiopropylthiopropylthiopropylthiopropylthiopropylthiopropylthiopropylthi
d5c4f6d	1.141824	6.0	discard	Increase WARMDOWN_RATIO from 0.5 to 0.75 for more aggressive LR cooldown	The aim of this study was to determine the effect of the 2nd and 3nd and 3nd and 3nd and 3nd and 3nd and 3nd and 3nd and 3nd and 3nd and 3 3 and 3 3 and 3 3 4 and 3 4 4 4 4 4 4 4 4 4 4 4 4 4 4
7131eb1	1.098741	6.0	keep	Replace linear LR warmdown with cosine decay schedule	The aim of this study was to determine the effect of the combination of the combination of the combination of the combination of the combination of the combination of the combination of the combination of the combination of the combination of the combination of the combination of the combination of the combination of the combination of the combination of the combination of the combination of the combination of the combination of the combination of the combination of the combination of the combination of the combination of the combination of the combination of the combination of the combination of the combination
cb24fcb	1.089212	6.0	keep	Increase weight decay on embeddings and value embeddings from 0.001 to 0.003	The aim of this study was to determine the effect of the 2,3-dimethylthiazol-2-ylidene (DTT) on the expression of the 2,3-dimethylthiazol-2-ylidene (DTT) in the presence of 2,3-dimethylthiazol-2-ylidene (DTT) in the presence of 2,3-dimethylthiazol-2-ylidene
acfed5e	1.359364	7.0	discard	Add label smoothing (0.1) to cross entropy loss to improve generalization and reduce overfitting	The aim of this study was to determine the effect of the 2,2-dimethyl-2,3,4,5,5,5,5,5,5,5,5,5,5,5,5,5,5,5,5,5,5,5,5,5,5,5,5,5,5,5,5,5,5,5,5,5,5,5,5,5,5
824d805	1.084458	6.0	keep	Increase logits softcap from 12 to 30 for higher dynamic range	The aim of this study was to evaluate the effect of the 5-fluorouracil (5-FU) on the expression of the 5-FU gene in the rat brain. The results showed that the 5-FU gene was expressed in the brain of the rat brain, and the 5-FU gene was expressed in the brain of the rat brain. The expression of 5-FU gene was detected in the brain of the rat brain, and the expression of 5
c0bdaa6	1.086579	6.0	discard	Increase weight decay on lm_head (unembedding) from 0.001 to 0.003 to match the embedding weight decay increase that previously improved val_bpb. The lm_head shares weights with embeddings but was excluded from the previous weight decay adjustment.	The aim of this study was to determine the effect of the 5-HT2 receptor antagonist (5-HT2R) on the expression of the 5-HT2 receptor (5-HT2R) and the 5-HT2 receptor (5-HT2R) in the rat brain. The 5-HT2R antagonist (5-HT2R) was administered to rats with 5-HT2R (5-HT2R) and 5-HT2R (5-HT2R) in
b71c4aa	1.083896	6.3	keep	Add 0.1 dropout to attention and MLP residual paths for regularization	The aim of this study was to determine the effect of the antihypertensive drug (ADD) on the pharmacokinetic properties of the drug, the pharmacokinetic parameters of the drug, and the pharmacokinetic parameters of the drug, and the pharmacokinetic parameters of the drug, pharmacokinetic parameters of the drug, and pharmacokinetic parameters of the drug, pharmacokinetic parameters of the drug, and pharmacokinetic parameters of the drug, pharmacokinetic parameters of the drug, and pharmacokinetic parameters of the drug,
9349449	1.101257	6.3	discard	Add 0.1 dropout to token embeddings for additional regularization, matching the existing residual dropout rate	The aim of this study was to determine the effect of the 3,4,4,4,4,4,4,4,4,4,4,4,4,4,4,4,4,4,4,4,4,4,4,4,4,4,4,4,4,4,4,4,4,4,4,4,4,4,4,4,4,4,4,4
492f85a	1.304000	6.0	discard	Increase z-loss coefficient from 1e-4 to 1e-3 to strengthen logit regularization and reduce overconfident predictions	The aim of this study was to investigate the effect of a 3D cubic cubic cubic cubic cubic cubic cubic cubic cubic cubic cubic cubic cubic cubic cubic cubic cubic cubic cubic cubic cubic cubic cubic cubic cubic cubic cubic cubic c
af7060d	1.404428	6.0	discard	Use full attention in all layers by changing window pattern to LLLL	The aim of this study was to investigate the effects of the effects of the on the effects of the on the effects of the on the effects of the on the effects of the on the effects of the on the effects of the on the effects of the on the effects of the on the effects of the on the effects of the on the effects of the on the effects of the on the effects of the on the effects of the on the effects of the on the effects of the on the effects of the
23c27b1	1.403946	6.0	discard	Increase logits softcap from 12 to 15 for improved dynamic range and gradient flow	The aim of this study was to investigate the effects of the effects of the on the effects of on the effects of on the effects of on the effects of on the effects of on the effects of on the effects of on the effects of on the effects of on the effects of on the effects of on the effects of on the effects of on the effects of on the effects of on the effects of on the effects of on the effects of on the effects on the effects of on the effects on the effects
d88ed1c	1.414775	6.0	discard	Increase weight decay on embedding, value embedding, and lm_head parameter groups from 0.001 to 0.003 to combine the improvements from previous experiments	The aim of this study was to investigate the effects of the effects of the effects of on the effects of on the effects of on the effects of on the effects of on the effects of on the effects of on the on the effects of on the effects of on the on the effects of on the on the effects of on the on the effects of on the on the effects of on the on the effects of on the on the effects of on the on the effects of on the on the effects of on
1abb933	1.383775	6.0	discard	Increase logits softcap to 50 for higher dynamic range	The aim of this study was to evaluate the effect of the effect of the on the effect of the on the effect of on the effect on the effect of on the effect on the effect on the effect on the effect on the effect on the effect on the effect on the effect on the effect on the effect on the effect on the effect on the effect on the effect on the effect on the effect on the effect on the effect on the effect on the effect on the effect on the effect on the effect
1e6b078	1.459145	6.0	discard	Initialize x0_lambdas to 0.0 instead of 0.1 to reduce initial skip-connection contribution from the input embedding, simplifying early training dynamics	The aim of this study was to investigate the effects of the effects of the effects of the effects of the effects of the effects of the effects of the effects of the effects of the effects of the effects of the effects of the effects of the effects of the effects of the effects of the effects of the effects of the effects of the effects of the effects of the effects of the effects of the effects of the effects of the effects of the effects of the effects of the effects of the effects of the effects
82ebe2c	1.368387	6.0	discard	Reduce Muon optimizer ns_steps from 5 to 3 to improve training throughput (more steps in 5 min)	The aim of this study was to investigate the effects of the effects of the on the effects of the on the effects of the on the effects of the on the effects of the on the effects of the on the effects of the on the effects of the on the effects of the on the effects of the on the effects of the on the effects of the on the effects of the on the on the effects of the on the on the effects of the on the on the effects of the on the on the
19f7099	1.326984	6.0	discard	Change RoPE base from 50000 to 10000 for standard frequency scaling	The aim of this study was to investigate the effects of a 1-year-old male with a 1-year-old woman with a history of a 1-year-old woman with a history of a 1-year-old woman with a history of a 1-year-old woman with a history of a history of a history of a history of a history of a history of a history of a history of a history of a history of a history of a history of a history of a history of a history of
e4231f2	1.341189	6.0	discard	Replace ReLU squared activation with GeLU in MLP for improved gradient flow	The aim of this study was to investigate the effects of the two different types of different types of different types of different types of different types of different types of different types of different types of different types of different types of different types of different types of different types. The study was conducted to determine the effects of different types of different types of different types of different types of different types of different types of different types of different types of different types. The different types of different types of different types of different types
43f48c3	1.201260	6.0	discard	Increase logits softcap from 12 to 20 for moderate dynamic range increase between baseline and successful softcap-30 experiment	The aim of this study was to evaluate the effect of a single-crystal injection of 1, 2, and 3, 4, 4, 4, 4, 4, 4, 4, 4, 4, 4, 4, 4, 4, 4, 4, 4, 4, 4, 4, 4, 4, 4, 4, 4
45a4057	1.214339	6.0	discard	Change window pattern from SSSL to SSSS to increase training throughput (more short-window layers = less compute per step, allowing more steps in 5min budget)	The aim of this study was to evaluate the effect of a new species of the genus of the genus of the genus of the genus of the genus of the species of the genus of the species of the species of the species of the species of the species of the species of the species of the species of the species of the species. The species of the species is species of the species of species of species of species of species of species. The species of species is species of species of species of species of
bf50b02	1.216811	6.0	discard	Increase z-loss coefficient from 1e-4 to 2e-4 for slightly stronger logit regularization	The aim of this study was to evaluate the effect of a new species of the genus of the genus of the genus of the species of the genus of the species of the species of the species of the species of the species of the species of the species of the species of the species of the species of the species of the species of species. The species of the species is species of species of species of species of species of species of species. The species of species is species of species of species of species
85cf859	1.225243	6.5	discard	Add 0.1 dropout to MLP activation output (after ReLU square, before projection) for additional regularization	The aim of this study was to evaluate the effect of a new method for the determination of the protein content of the protein in the liver and liver of the liver. The results were compared with the results of the study. The results showed that the protein content of the protein was significantly higher in the liver and liver than in the liver. The results showed that the protein content of protein was significantly higher in the liver and liver. The protein content of protein was higher in liver than in liver. The protein
697bb7c	1.217517	6.1	discard	Add 0.1 dropout to value embeddings (ve) before the gating mechanism to regularize the value residual stream	The aim of this study was to evaluate the effect of a new species of the genus of the genus of the genus of the species of the species of the species of the species of the species of the species of the species of the species of the species of the species of the species of the species of species. The species of species is species of species of species of species of species of species of species of species of species. The species of species is species of species of species of species species of species
d170fe0	1.232039	6.0	discard	Add 0.1 dropout to attention weights via dropout_p parameter in both SDPA and flash_attn_func to improve regularization	The aim of this study was to investigate the effects of the 2-3-3-3-3-3-3-3-3-3-3-3-3-3-3-3-3-3-3-3-3-3-3-3-3-3-3-3-3-3-3-3-3-3-3-3-3-3-3-3-3-3-3-3
6ff3c10	1.191913	6.1	discard	Add 0.1 dropout to the x0 residual connection (initial embedding skip) in each layer to regularize the deep residual pathway	The aim of this study was to investigate the effect of the anti-inflammatory drugs (ART) on the anti-inflammatory effects of the anti-inflammatory drugs (ART) on the anti-inflammatory effects of the anti-inflammatory drugs (ART) and the anti-inflammatory effects of the anti-inflammatory drugs (ART) in the anti-inflammatory effects of the anti-inflammatory drugs (ART) and the anti-inflammatory effects ofART and the anti-inflammatory drugs (ART) were investigated. The anti-inflammatory effects of
84d1848	1.235493	6.3	discard	Add 0.1 dropout to queries and keys after rotary embedding and normalization for regularization	The aim of this study was to investigate the effect of a single dose of 1.5 mg/kg body weight (1.2 mg/kg) on the basis of the effect of the 1.5 mg/kg body weight (1.2 mg/kg) on the basis of the effect of 1.2 mg/kg body weight (1.2 mg/kg) on the basis of the effect of 1.2 mg/kg body weight (1.2 mg/kg) on the basis
fee91fa	1.088688	6.0	discard	Increase weight decay on resid_lambdas from 0.001 to 0.003 for stronger regularization of per-layer residual scales	The aim of this study was to determine the effect of the 2,3-dihydroxy-4-oxo-1,3-dihydroxy-1,3-dihydroxy-1,3-dihydroxy-1,3-dihydroxy-1,3-dihydroxy-1,3-dihydroxy-1,3-dihydroxy-1,3-dihydroxy-1,3-dihydroxy-1,3-dihydroxy-1,3-dihydrox
702d295	1.087749	6.0	discard	Increase weight decay on x0_lambdas from 0.0 to 0.001 to regularize deep residual skip-connection scalars	The aim of this study was to determine the effect of the 2,3-dimethylthiazol-2-yl-2,3-dimethylthiazol-2-yl-2,3-dimethylthiazol-2-yl-2,3-dimethylthiazol-2-yl-2,3-dimethylthiazol-2-yl-2,3-dimethylthiazol-2-yl-2,3-dimethylthiazol-
0d0cffd	1.096797	6.3	discard	Add 0.1 dropout to attention and MLP residual paths and remove weight decay on resid_lambdas to reduce regularization on per-layer residual scales	The aim of this study was to determine the effect of the 2,3-dihydroxy-2,3-dihydroxy-2,3-dihydroxy-2,3-dihydroxy-2,3-dihydroxy-2,3-dihydroxy-2,3-dihydroxy-2,3-dihydroxy-2,3-dihydroxy-2,3-dihydroxy-2,3-dihydroxy-2,3-dihydroxy-2,3
3407950	1.090536	6.0	discard	Reduce z-loss coefficient from 1e-4 to 5e-5 to decrease regularization on logit magnitudes, potentially allowing better convergence with the existing dropout regularization.	The purpose of this study was to determine the effect of the use of a combination of a combination of a combination of a combination of a combination of a combination of a combination of a combination of a combination of a combination of a combination of a combination of a combination of a combination of a combination of a combination of a combination of a combination of a combination of a combination of a combination of a combination of a combination of a combination of a combination of a combination of a combination of a combination of a combination
0b1ddd3	1.095389	6.3	discard	Add 0.1 dropout to attention and MLP residual paths and increase logits softcap from 12 to 30	The aim of this study was to determine the effect of the combination of the combination of the combination of the combination of the combination of the combination of the combination of the combination of the combination of the combination of the combination of the combination of the combination of the combination of the combination of the combination of the combination of the combination of the combination of the combination of the combination of the combination of the combination of the combination of the combination of the combination of the combination of the combination of the combination of the combination
9276d54	1.068464	6.0	keep	Add DropPath (stochastic depth) regularization with 0.1 drop probability to residual connections in transformer blocks	The aim of this study was to determine the effect of a 2-week period of 2 weeks of age on the incidence of acute myocardial infarction (AMI) in patients with acute myocardial infarction (AMI) and in patients with AMI. The incidence of AMI was 1.5% (95% CI 1.5-1.5) and 2.5% (95% CI 1.5-1.5) in patients with AMI. The
99afa5c	1.086137	6.0	discard	Use layer-wise linearly increasing DropPath probability (stochastic depth) from 0.05 in shallow layers to 0.15 in deep layers instead of uniform 0.1	The aim of this study was to determine the effect of the 2- and 3- and 4- and 5- and 5- and 5- and 5- and 5- and 5- and 5- and 5- and 5- and 5- and 5- and 5- and 5- and 5- and 5- and 5- and 5- and 5- and 5- and
f852c8b	1.125928	6.0	discard	Apply stochastic depth (DropPath) regularization with 0.1 drop probability only to the MLP residual connection, leaving the attention residual path unchanged to isolate regularization on the MLP sub-block	The purpose of this study was to determine the effect of the 2,4,4,4,4,4,4,4,4,4,4,4,4,4,4,4,4,4,4,4,4,4,4,4,4,4,4,4,4,4,4,4,4,4,4,4,4,4,4,4,4,4,4,4
1d59783	1.081444	6.0	discard	Add 0.1 dropout to the final hidden state (output of the last layer norm) before the language modeling head to regularize the representation used for next-token prediction	The aim of this study was to determine the effect of the 5-HT2 receptor antagonist 5-HT2 receptor antagonist 5-HT2R antagonist 5-HT2R antagonist 5-HT2R antagonist 5-HT2R antagonist 5-HT2R antagonist 5-HT2R antagonist 5-HT2R antagonist 5-HT2R antagonist 5-HT2R antagonist 5-HT2R antagonist 5-HT2R antagonist 5-HT2R antagonist 5-HT2
992827a	2.934664	6.2	discard	Maintain exponential moving average (EMA) of model parameters with decay 0.9999 and use the EMA weights for final validation evaluation. This provides a more stable model for inference by averaging parameters over training.	The purposeariectomizedastic leukemiaregnRH-aorticosteroidsumerancesrespectiveue-Dawleynegativeentericsed Doppler echocardiographytal defect tract infectionsoreticallyidentifiedstancesrespectiveue-Dawleynegativeentericsed Doppler echocardiographytal defect tract infectionsoreticallyidentifiedstancesrespectiveue-Dawleynegativeentericsed Doppler echocardiographytal defect tract infectionsoreticallyidentifiedstancesrespectiveue-Dawleynegativeent
b4e3725	1.404114	6.0	discard	Add a 10% linear LR warmup at the start of training to stabilize early updates	The aim of this study was to investigate the effects of the on the effects of the on the effects of the on the effects of the on the effects of the on the effects of the on the effects of the on the effects of the on the effects of the on the effects of the on the effects of the on the effects of the on the effects of the on the effects of the on the effects of the on the effects of the on the effects of the on the effects of the on the effects
3149fa9	0.000000	0.0	crash	Implement scheduled DropPath (stochastic depth) with linear warmup from 0.0 to 0.2 drop probability over the training budget, applied to both attention and MLP residual connections. This extends the successful constant 0.1 DropPath experiment by gradually increasing regularization strength as training progresses. [timeout (900s wall clock)]	
78ee992	1.344365	5.7	discard	Use grouped query attention (GQA) by halving n_kv_head from 6 to 3 to reduce memory bandwidth and compute in attention, allowing more training steps within the 5-minute budget	The aim of this study was to investigate the effects of the effects of the effects of the effects of the effects of the on the effects of the on the effects of the on the effects of the on the effects of the on the effects of the on the effects of the on the effects of the on the effects of the on the effects of the on the effect of the on the effect of the on the effect of the on the effect of the on the effect of the on the effect of the on
7e62a87	1.332528	6.5	discard	Apply DropPath (stochastic depth) regularization with 0.1 drop probability only to the attention residual connection, leaving the MLP residual path unchanged. This applies Bernoulli dropout to the attention output (scaled by 1/0.9 during training) before adding to the residual stream, while keeping the MLP residual connection intact.	The aim of this study was to investigate the effects of a 1-year-old male patient with a 1-year-old woman with a history of the patient with a history of the patient. The patient was admitted to the hospital with a history of the patient. The patient was the most common complaint of the patient was diagnosed with a history of the patient. The patient was the patient with a history of the patient. The patient was the most common complaint. The patient was the patient
cdac070	1.344965	6.0	discard	Combine stochastic depth (DropPath) with 0.1 probability on residual connections and light dropout (0.05) on the final hidden state before the language modeling head to improve generalization	The aim of this study was to investigate the effect of the effect of the effect of the on the effect of the on the effect of the on the effect of the on the effect of the on the effect of the on the effect of the on the effect of the on the effect of the on the effect of the on the effect of the on the effect of the on the effect of the on the effect of the on the effect of the on the effect of the on the effect of the on the
39a061c	1.955869	6.0	discard	Untie input/output embeddings (wte and lm_head) to fix duplicate parameter in optimizer groups and initialize lm_head separately	....................................................................................................
