commit	val_bpb	memory_gb	status	description	sample_text
24985f7	1.081880	6.0	discard	Remove weight decay cosine decay schedule to keep weight decay constant at 0.2 throughout training instead of decaying to 0.02, maintaining stronger regularization for the full 5-minute window	The aim of this study was to determine the effect of the use of a combination of a combination of a combination of a combination of a combination of a combination of a combination of a combination of a combination of a combination of a combination of a combination of a combination of a combination of a combination of a combination of a combination of a combination of a combination of a combination of a combination of a combination of a combination of a combination of a combination of a combination of a combination of a combination of a combination
1680263	1.040822	6.0	keep	Combine best residual initialization (resid_lambdas=0.8, x0_lambdas=0.2) with temperature scaling of 0.8 on logits before softcap to sharpen predictions while maintaining strong deep skip connections	The aim of this study was to determine the effect of the 5-HT1A receptor antagonist, 5-HT1A receptor antagonist, on the expression of the receptor tyrosine kinase (TK) and the receptor tyrosine kinase (TK) in the rat. The rat was injected with 5-HT1A receptor antagonist, 5-HT1A receptor antagonist, 5-HT1A receptor antagonist, 5-HT1A receptor antagonist, 5-HT1A receptor antagonist, 5
415bc71	1.188055	6.1	discard	Replace MLP activation with SwiGLU (SiLU-gated linear unit) using 8/3*d_model hidden dim to maintain params, improve gradient flow	The aim of this study was to determine the effect of the anti-oxidant anti-oxidant anti-oxidant anti-oxidant anti-oxidant anti-oxidant anti-oxidant anti- anti-oxidant anti- anti-oxidant anti- anti- anti- anti- anti- anti- anti- anti- anti- anti- anti- anti- anti- anti- anti- anti- anti- anti- anti- anti- anti- anti- anti- anti-
44793f5	1.039719	6.0	keep	Combine best residual initialization (resid_lambdas=0.8, x0_lambdas=0.2) with logits temperature scaling (T=0.8) and small final LR fraction (0.01) to allow micro-updates at training end	The aim of this study was to determine the effect of the 3-4-week treatment with 3-4-week treatment with 3-4-week treatment with 3-4-week treatment with 3-4-week treatment with 3-4-week treatment with 3-week treatment with 3-week treatment with 3-week treatment with 3-week treatment with 3-week treatment with 3-week treatment with 3-week treatment with 3-week treatment with 3-week treatment with
c2f5c21	1.033731	6.0	keep	Double the learning rate for value embeddings to accelerate their adaptation in the limited 5-minute training window, as they are high-dimensional sparse parameters that may benefit from faster updates.	The aim of this study was to determine the effect of the combination of the combination of the combination of the combination of the combination of the combination of the combination of the combination of the combination of the combination of the combination of the combination of the combination of the combination of the combination of the combination of the combination of the combination of the combination of the combination of the combination of the combination of the combination of the combination of the combination of the combination of the combination of the combination of the combination of the combination
-------	0.000000	0.0	crash	FAILED TO APPLY: Apply cosine decay to AdamW weight decay (embeddings, lm_head, value_embeds, scalars) proportionally to Muon decay, reducing regularization on sparse high-dim parameters over time for finer late-training convergence	
28311f7	1.089414	6.0	discard	Initialize attention and MLP output projections (c_proj) with uniform random values instead of zeros to provide non-zero initial signal through residual paths, potentially accelerating early training dynamics	The aim of this study was to determine the effect of the treatment of the human immunodeficiency virus (HIV) infection in patients with HIV infection.To determine the effect of the treatment of the acute phase of the treatment of acute lymphoblastic leukemia (ALL) in patients with acute lymphoblastic leukemia (ALL) and to determine the effect of the treatment of acute lymphoblastic leukemia (ALL) on the outcome of ALL.To determine the effect of the treatment
5bc0e3d	1.071116	6.0	discard	Combine the winning double learning rate for value embeddings with temperature scaling of 0.8 on logits before softcap to sharpen the output distribution while accelerating value embedding adaptation	The aim of this study was to determine the effect of the use of a combination of a combination of a combination of a combination of a combination of a combination of a combination of a combination of a combination of a combination of a combination of a combination of a combination of a combination of a combination of a combination of a combination of a combination of a combination of a combination of a combination of a combination of a combination of a combination of a combination of a combination of a combination of a combination of a combination
818e958	1.080524	6.0	discard	Initialize VE gate weights to -2.0 instead of 0.0 to start value residual contributions at ~24% (sigmoid(-2)*2) and allow gradual ramp-up during training, potentially stabilizing early optimization of high-dimensional value embeddings	The aim of this study was to determine the effect of the 2,3-dihydropyridine (2,3-dihydropyridine) on the activity of the 2,3-dihydropyridine (2,3-dihydropyridine) and 2,3-dihydropyridine (2,3-dihydropyridine) in the presence of 2,3-dihydropyridine (2,3-dihydropyridine) and 2,3-dihydropyridine (
575f7c2	1.098812	6.0	discard	Reduce Muon orthogonalization steps from 5 to 4 to decrease per-step compute cost, allowing more training steps within the fixed 5-minute time budget.	The aim of this study was to determine the effect of the use of a new antipsychotic drugs on the incidence of acute respiratory syndrome (SARS) in patients with chronic respiratory syndrome (SARS) and to determine the effect of the use of antipsychotic drugs on the incidence of SSARS in patients with SSARS.The aim of this study was to determine the effect of the use of a new antipsychotic drugs on the incidence of SSARS in
609f29a	1.404646	6.2	discard	Apply exponential moving average (EMA) to model weights with decay 0.99 during training and use EMA weights for final evaluation to improve generalization.	The aim of the study was to investigate the effects of the effects of the effects of the effects of the effects of the effects of the effects of the effects of the effects of the effects of the effects of the effects of the effects of the effects of the effects of the effects of the effects of the effects of the effects of the effects of the effects of the effects of the effects of the effects of the effects of the effects of the effects of the effects of the effects of the effects of the effects
23aa188	1.055422	6.0	discard	Combine double learning rate for value embeddings with residual initialization (resid_lambdas=0.8, x0_lambdas=0.2) to accelerate value embedding adaptation while maintaining strong deep skip connections	The aim of this study was to determine the effect of the use of a single dose of 0.5 mg/kg of 0.5 mg/kg of 0.5 mg/kg of 0.5 mg/kg of 0.5 mg/kg of 0.5 mg/kg of 0.5 mg/kg of 0.5 mg/kg of 0.5 mg/kg of 0.5 mg/kg of 0.5 mg/kg of 0.5 mg
b701b9a	1.082037	6.0	discard	Remove weight decay specifically from value embeddings (set to 0.0) while keeping weight decay for other embeddings, reducing regularization on high-dimensional sparse value residual parameters	The aim of this study was to determine the effect of the 2,3-dihydroxy-3,4-dihydroxy-3,4-dihydroxy-3,4-dihydroxy-3,4-dihydroxy-3,4-dihydroxy-3,4-dihydroxy-3,4-dihydroxy-3,4-dihydroxy-3,4-dihydroxy-3,4-dihydroxy-3,4-dihydroxy-3,4
f2fc580	1.092605	6.0	discard	Keep residual connection scalars (resid_lambdas and x0_lambdas) at constant learning rate throughout training by skipping LR decay for their parameter groups, allowing continuous adaptation of deep skip connection weights	The aim of this study was to determine the effect of the use of a combination of a combination of a combination of a combination of a combination of a combination of a combination of a combination of a combination of a combination of a combination of a combination of a combination of a combination of a combination of a combination of a combination of a combination of a combination of a combination of a combination of a combination of a combination of a combination of a combination of a combination of a combination of a combination of a combination
99886d6	1.081998	6.0	discard	Reduce sliding window size from half to quarter context (//4 instead of //2) to increase training throughput for more steps in the 5-minute budget	The aim of this study was to determine the effect of the 2,3-dihydroxy-3,4-dihydroxy-3,4-dihydroxy-3,4-dihydroxy-3,4-dihydroxy-3,4-dihydroxy-3,4-dihydroxy-3,4-dihydroxy-3,4-dihydroxy-3,4-dihydroxy-3,4-dihydroxy-3,4-dihydroxy-3,4
ddec2b0	1.080288	6.0	discard	Reduce gradient clipping aggressiveness by raising minimum clip norm from 0.3 to 0.7 to allow larger updates late in training	The aim of this study was to evaluate the effect of a 2,3-dihydroxy-3,4-dihydroxy-4,5-dihydroxy-4,5-dihydroxy-4,5-dihydroxy-4,5-dihydroxy-4,5-dihydroxy-4,5-dihydroxy-4,5-dihydroxy-4,5-dihydroxy-4,5-dihydroxy-4,5-dihydroxy-4,5
00845b9	1.084883	6.0	discard	Increase ve_gate_channels from 32 to full embedding dimension (config.n_embd) to give value residual gate access to complete input information for better value embedding utilization	The aim of this study was to determine the effect of the administration of 1,1,2,3,4,5,5,5,5,5,5,5,5,5,5,5,5,5,5,5,5,5,5,5,5,5,5,5,5,5,5,5,5,5,5,5,5,5,5,5,5,5,5
58e203a	1.085850	6.0	discard	Set final LR fraction to 0.01 to allow micro-updates at training end instead of decaying to exactly zero	The aim of this study was to determine the effect of the 2,3-dihydroxyvitamin D3 (2,3-dihydroxyvitamin D3) on the growth of the human liver. The study was performed on the effects of 2,3-dihydroxyvitamin D3 on the growth of the liver. The results showed that the 2,3-dihydroxyvitamin D3 was significantly higher than that of the 2,3-dihydroxyv
3a5daa5	1.075256	6.0	discard	Combine double learning rate for value embeddings with zero weight decay on value embeddings to reduce regularization on high-dimensional sparse parameters while accelerating their adaptation	The aim of this study was to determine the effect of the 2nd 2nd 2nd 2nd 2nd 2nd 2nd 2nd 2nd 2nd 2nd 2nd 2nd 2nd 2nd 2nd 2nd 2nd 2nd 2nd 2nd 2nd 2nd 2nd 2nd 2nd 2nd 2nd 2nd
87c6632	1.133953	6.0	discard	Apply gradient clipping only to Muon (matrix) parameters, allowing AdamW parameters (embeddings, scalars) to use unclipped gradients for potentially faster adaptation of high-dimensional sparse parameters	The aim of this study was to determine the effect of the 2,3,3,3,3,3,3,3,3,3,3,3,3,3,3,3,3,3,3,3,3,3,3,3,3,3,3,3,3,3,3,3,3,3,3,3,3,3,3,3,3,3,3,3
19e29d2	1.083311	5.8	discard	Cast all model parameters to bfloat16 after initialization to reduce memory bandwidth pressure and increase training throughput, allowing more optimization steps within the fixed 5-minute time budget	The aim of this study was to determine the effect of the combination of the combination of the combination of the combination of the combination of the combination of the combination of the combination of the combination of the combination of the combination of the combination of the combination of the combination of the combination of the combination of the combination of the combination of the combination of the combination of the combination of the combination of the combination of the combination of the combination of the combination of the combination of the combination of the combination of the combination
101c1e1	1.115361	6.0	discard	Combine double learning rate for value embeddings with 33% higher LR for x0 residual scalars (4.0x vs 3.0x) to accelerate adaptation of both value residuals and deep skip connections	The aim of this study was to determine the effect of the 3-4-4-4-4-4-4-4-4-4-4-4-4-4-4-4-4-4-4-4-4-4-4-4-4-4-4-4-4-4-4-4-4-4-4-4-4-4-4-4-4-4-4-4
ae43d31	1.067226	6.0	discard	Combine double learning rate for value embeddings with increased Muon weight decay (0.3) for stronger regularization on matrix parameters	The aim of this study was to determine the effect of the administration of the anti-hypertensive drugs on the incidence of acute myocardial infarction (AMI) in patients with acute myocardial infarction (AMI) and to determine the effect of antihypertensive drugs on the incidence of AMI in patients with AMI.The aim of this study was to determine the effect of the antihypertensive drugs on the incidence of acute myocardial infarction (AMI) in patients with AMI.The aim
15e5d0b	1.107870	6.0	discard	Increase learning rate for residual path scalars (resid_lambdas) from 0.025 to 0.1 to accelerate adaptation of main residual weights toward optimal values during the short training window	The aim of this study was to determine the effect of the 3-hydroxy-3-hydroxy-3H-3H-3H3 on the growth of the human breast cancer cell line (HEC) and the effect of the 3H3-3H3-3H3-3H3-3H3-3H3-3H3-3H3-3H3-3H3-3H3-3H3-3H3-
f79afad	1.075462	6.0	discard	Keep AdamW parameters (embeddings, value embeddings, lm_head, and scalars) at constant full learning rate without warmdown, while allowing Muon matrix parameters to follow the cosine learning rate schedule. This ensures high-dimensional sparse embedding parameters continue adapting at maximum rate throughout the entire 5-minute training window.	The aim of this study was to evaluate the effects of a single dose of 200 mg/kg of body weight (BW) on the development of the body's body's body's body's body's body's body's body's body's body's body's body's body's body's body's body's body's body's body's body's body's body's body's body's body's body's body's body's body's body's body's body's body's body's
4265292	1.082544	6.0	discard	Reduce minimum gradient clipping norm from 0.3 to 0.1 to allow larger parameter updates late in training	The aim of this study was to determine the effect of the 2,3,4,5,5,5,5,5,5,5,5,5,5,5,5,5,5,5,5,5,5,5,5,5,5,5,5,5,5,5,5,5,5,5,5,5,5,5,5,5,5,5,5,5
63811b3	0.000000	0.0	crash	Remove input-dependent gating in value residual connections, directly add value embeddings to reduce compute and simplify gradient flow [Traceback (most recent call last):
bb4601f	1.087103	6.1	discard	Add 0.1 dropout to value embeddings after lookup to regularize high-dimensional sparse value residual updates	The aim of this study was to determine the effect of the 2,3-dihydroxy-3,4-dihydroxy-3,4-dihydroxy-3,4-dihydroxy-3,4-dihydroxy-3,4-dihydroxy-3,4-dihydroxy-3,4-dihydroxy-3,4-dihydroxy-3,4-dihydroxy-3,4-dihydroxy-3,4-dihydroxy-3,4
6337e34	1.131570	6.1	discard	Add activation regularization (L2 penalty on final hidden states) with coefficient 1e-5 to stabilize representations and prevent collapse during the short training window	The aim of this study was to determine the effect of a single dose of 0.5 mg/kg of a single dose of 0.5 mg/kg of 0.5 mg/kg of 0.5 mg/kg of 0.5 mg/kg/kg of 0.5 mg/kg/kg of 0.5 mg/kg/kg of 0.5 mg/kg/kg of 0.5 mg/kg/kg of 0.5 mg/kg/kg/kg of 0.5
08fef28	1.004371	7.0	keep	Replace standard cross-entropy with focal loss (gamma=2.0) to focus training on hard-to-predict tokens, which may improve learning efficiency in the short 5-minute window by down-weighting easy examples.	The aim of this study was to determine the effect of the presence of a single dose of 100 mg/kg of a single dose of 100 mg/kg of a single dose of 100 mg/kg of a dose of 100 mg/kg of a dose of 100 mg/kg of a dose of 100 mg/kg of a dose of 100 mg/kg of a dose of 100 mg/kg of a dose of 100 mg/kg of a dose
c6f138e	1.012927	7.0	discard	Double the learning rate for all token embeddings (wte, value_embeds) from 0.6 to 1.2 to accelerate adaptation of high-dimensional sparse representations, building on the success of doubling value-embedding LR alone while maintaining the focal loss objective.	The aim of this study was to investigate the effects of a novel 3-kinase inhibitor (3-kinase inhibitor) on the expression of the 3-kinase 3 (3-kinase 3) and 3-kinase 3 (3-kinase 3) in the rat. The expression of 3-kinase 3 (3-kinase 3) and 3-kinase 3 (3-kinase 3)
175b997	0.991978	7.0	keep	Implement focal loss (gamma=2.0) for hard example mining and combine with optimal deep residual initialization (resid_lambdas=0.8, x0_lambdas=0.2) to accelerate convergence	The aim of the present study was to investigate the effect of the 3rd 3rd 3rd 3rd 3rd 3rd 3rd 3rd 3rd 3rd 3rd 3rd 3rd 3rd 3rd 3rd 3rd 3rd 3rd 3rd 3rd 3r
7cea32f	1.005079	7.0	discard	Initialize VE gate weights to 2.0 instead of 0.0 to increase initial value residual gating strength from ~1.0 (sigmoid(0)*2) to ~1.76 (sigmoid(2)*2), allowing stronger value embedding flow at the start of training	The aim of this study was to investigate the effect of the 3D printing of the 3D printing enzyme (3DE) on the activity of the 3D printing enzyme (3DE) in the presence of the 3D printing enzyme (3DE) enzyme. The enzyme was purified from the 3DE enzyme by the enzyme-linked immunosorbent assay. The enzyme was purified from the enzyme-linked immunosorbent assay
21c963a	1.004126	7.0	discard	Combine focal loss gamma=2.0 with optimized residual initialization (resid_lambdas=0.8, x0_lambdas=0.2) and increased VE gate initial value (2.0) to maximize learning signal from value residuals and hard examples	The aim of this study was to investigate the effect of the anti-inflammatory and anti-inflammatory properties of the anti-inflammatory and anti-inflammatory properties of the anti-inflammatory and anti-inflammatory properties of the anti-inflammatory and anti-inflammatory properties of the anti-inflammatory and anti-inflammatory properties of anti-inflammatory and anti-inflammatory properties. The anti-inflammatory properties of anti-inflammatory and anti-inflammatory properties of anti-inflammatory and anti-inflammatory properties were evaluated. The anti-inflammatory properties of anti-inflammatory and anti-inflammatory properties of anti-inflammatory and anti-inflammatory properties were evaluated.
2ff4e7c	1.037560	7.0	discard	Replace standard cross-entropy with focal loss using gamma=1.5 (less aggressive than gamma=2.0) to focus moderately on hard examples while maintaining stable gradient magnitude on easy examples	The aim of this study was to evaluate the effect of the 2,3-dimethyl-2,3-dimethyl-2,3-dimethyl-2,3-dimethyl-2,3-dimethyl-2,3-dimethyl-2,3-dimethyl-2,3-dimethyl-2,3-dimethyl-2,3-dimethyl-2,3-dimethyl-2,3-dimethyl-2,3-dimethyl-2,3-dimethyl-2,3
b3a16b6	0.993292	7.0	discard	Implement focal loss (gamma=2.0) combined with optimal residual initialization (resid_lambdas=0.8, x0_lambdas=0.2) to replicate the best experimental configuration	The aim of the present study was to investigate the effects of the 3D printing of the 3D printing of the 3D printing of the 3D printing of the 3D printing of the 3D printing of 3D printing of 3D printing of 3D printing of 3D printing of 3D printing of 3D prin
6949f84	1.089555	6.3	discard	Keep value embeddings in float32 precision instead of casting to bfloat16 to maintain higher numerical precision for the residual path updates	The aim of this study was to determine the effect of the use of a combination of a combination of a combination of a combination of a combination of a combination of a combination of a combination of a combination of a combination of a combination of a combination of a combination of a combination of a combination of a combination of a combination of a combination of a combination of a combination of a combination of a combination of a combination of a combination of a combination of a combination of a combination of a combination of a combination
c2c92f1	0.000000	0.0	crash	Add bias term to value embedding gate with initialization to 2.0 for stronger initial value residual flow, building on the near-miss VE gate initialization experiment [Traceback (most recent call last):
1e00c82	1.086745	6.0	discard	Add Gaussian noise (std=0.01) to token embeddings during training for regularization	The aim of this study was to determine the effect of the 2,3-dimethoxy-2,3-dimethoxy-2,3-dimethoxy-2,3-dimethoxy-2,3-dimethoxy-2,3-dimethoxy-2,3-dimethoxy-2,3-dimethoxy-2,3-dimethoxy-2,3-dimethoxy-2,3-dimethoxy
1d76821	0.977059	7.0	keep	Focal loss with gamma=2.5 and optimal residual initialization (resid_lambdas=0.8, x0_lambdas=0.2) to sharpen focus on hard examples while maintaining strong deep skip connections	The aim of the present study was to investigate the effect of the anti-inflammatory effect of the anti-inflammatory effect of the anti-inflammatory effect of the anti-inflammatory effect of the anti-inflammatory effect on the inflammatory response of the rat. The anti-inflammatory effect of anti-inflammatory effect was investigated in the rat model of the anti-inflammatory effect of anti-inflammatory effect of anti-inflammatory drugs. The anti-inflammatory effect of anti-inflammatory effect was evaluated in the rat model of the anti-inflammatory effect of anti-inflammatory drugs. The anti-inflammatory effect
5a949d0	0.000000	0.0	crash	Implement scheduled focal loss gamma that anneals linearly from 2.0 to 3.0 during training to gradually increase focus on hard examples while maintaining stable early optimization [Traceback (most recent call last):
