commit	val_bpb	memory_gb	status	description	sample_text
a43ace6	1.376565	6.0	discard	Add Gaussian noise (std=0.01) to input embeddings during training for regularization	The aim of this study was to investigate the effects of a 2-year-old male with a 2-year-old male with a 2-year-old male with a 2-year-old male with a 2-year-old male with a 2-year-old male with a 2-year-old male with a 2-year-old male with a 2-year-old male with a 2-year-old male with a 2-year-old woman with a history of a 2-year-old woman with a history
be84495	1.310360	6.0	discard	Replace cross-entropy loss with focal loss (gamma=1.0) to focus training on hard-to-predict tokens and down-weight easy examples, which may improve generalization on the long-tail token distribution.	The aim of this study was to investigate the effects of a 1-3-3-3-3-3-3-3-3-3-3-3-3-3-3-3-3-3-3-3-3-3-3-3-3-3-3-3-3-3-3-3-3-3-3-3-3-3-3-3-3-3-3-3
11de2d7	1.324013	6.0	discard	Add DropPath (stochastic depth) regularization with 0.05 drop probability to residual connections in transformer blocks. This tests a lower dropout rate than the previous best of 0.1 to check if less regularization improves generalization.	The aim of this study was to investigate the effects of 1, 1, 1, 1, 1, 1, 1, 1, 1, 1, 1, 1, 1, 1, 1, 1, 1, 1, 1, 1, 1, 1, 1, 1, 1, 1, 1, 1, 1, 1
ac09422	1.303677	6.0	discard	Use full attention in the last two transformer layers instead of just the final layer to increase receptive field for global context aggregation without significantly impacting training speed	The aim of this study was to investigate the effects of a 2-3-3-3-3-3-3-3-3-3-3-3-3-3-3-3-3-3-3-3-3-3-3-3-3-3-3-3-3-3-3-3-3-3-3-3-3-3-3-3-3-3-3-3
b62d1b2	1.355182	6.0	discard	Use layer-wise linearly decreasing DropPath probability (stochastic depth) from 0.15 in shallow layers to 0.05 in deep layers (inverse of previous increasing schedule) to test if regularizing early layers more heavily improves generalization	The aim of this study was to investigate the effects of the 2010, 2010, and 2010, 2010, 2010, 2010, 2010, 20, 20, 20, 20, 20, 20, 20, 20, 20, 20, 20, 20, 20, 20, 20, 20, 20, 20, 20, 20
a60c701	1.141271	6.0	discard	Add DropPath (stochastic depth) with 0.1 probability to residual connections and apply 0.05 dropout to the final hidden state before the language modeling head to improve generalization	The aim of this study was to determine the effect of the 2-oxo-2-oxo-2-oxo-2-oxo-2-oxo-2-oxo-2-oxo-2-oxo-2-oxo-2-oxo-2-oxo-2-oxo-2-oxo-2-oxo-2-oxo-2-oxo-2-oxo-2-
dca0f91	1.076756	6.0	discard	Add DropPath (stochastic depth) regularization with 0.1 drop probability to residual connections in transformer blocks to improve generalization	The aim of this study was to determine the effect of a 2-week period of 2000 on the incidence of acute myocardial infarction (AMI) in patients with acute myocardial infarction (AMI) and in patients with AMI.The aim of this study was to determine the prevalence of acute myocardial infarction (AMI) in patients with AMI. The study was performed in 12 patients with AMI. The patients were divided into 1 groups: 1) AMI (
35cf001	1.102337	6.0	discard	Use a single shared x0_lambda scalar across all layers instead of per-layer parameters to reduce overfitting and improve generalization	The aim of this study was to determine the effect of a 2-week-old male Sprague-Dawley rats on the expression of the 2-week-old male Sprague-Dawley rats. The rats were randomly assigned to a 2-week-old male Wistar rats (n = 6) and 2-week-old rats (n = 6) and 2-week-old rats (n = 6) and 2-week-old rats (n = 6)
18ce7db	0.000000	0.0	crash	Add LayerScale (learnable residual scaling) with initialization 0.1 to attention and MLP outputs in each transformer block to stabilize training of deep residual networks [Traceback (most recent call last):
270d746	0.000000	0.0	crash	Add bias terms to MLP layers (c_fc and c_proj) to improve optimization capacity and training stability [Traceback (most recent call last):
7514ee3	1.096776	6.0	discard	Reduce torch.compile compilation overhead by setting fullgraph=False to allow graph breaks, enabling faster startup and more training steps within the 5-minute budget	The aim of this study was to determine the effect of the combination of the combination of the combination of the combination of the combination of the combination of the combination of the combination of the combination of the combination of the combination of the combination of the combination of the combination of the combination of the combination of the combination of the combination of the combination of the combination of the combination of the combination of the combination of the combination of the combination of the combination of the combination of the combination of the combination of the combination
9ef9b19	1.087262	6.0	discard	Fix MLP residual connection bug: remove internal residual from MLP class since Block already adds residual, preventing double residual addition	The aim of this study was to determine the effect of the 3rd and 3rd and 3rd on the expression of the 3rd and 3rd and 3rd and 3rd and 3rd and 3rd and 3rd and 3rd and 3rd and 3rd and 3rd and 3rd and 3rd and 3rd
c6b0c4f	1.121992	6.0	discard	Combine best regularization techniques: Add DropPath (stochastic depth) with 0.1 probability to residual connections AND add 0.1 dropout to final hidden state before lm_head	The aim of this study was to determine the effect of a 3-year-old woman with a history of a 3-year-old woman with a history of a 3-year-old woman with a history of a 3-year-old woman with a history of a history of a history of a history of a history of a history of a history of a history of a history of a history of a history of a history of a history of a history of a history of a history of a history of a
c86aa89	1.101355	6.0	discard	Change the attention window pattern from 'SSSL' to 'SLSS' to place the long-range attention layer earlier in the block cycle, potentially improving gradient flow through earlier long-range dependencies	The aim of this study was to determine the effect of the 2,3-dimethylthiopropylthiopropylthiopropylthiopropylthiopropylthiopropylthiopropylthiopropylthiopropylthiopropylthiopropylthiopropylthiopropylthiopropylthiopropylthiopropylthi
27f13ed	0.000000	0.0	crash	Disable value embeddings (ResFormer) to reduce computation and increase training throughput, allowing more gradient steps within the 5-minute budget [Traceback (most recent call last):
2fc4dc9	1.092224	6.0	discard	Add DropPath (stochastic depth) regularization with 0.1 drop probability to the value embedding residual connection (the addition of gated value embeddings to attention values) to regularize the ResFormer value residual pathway	The aim of this study was to determine the effect of the 2,3,4,5,5,5,5,5,5,5,5,5,5,5,5,5,5,5,5,5,5,5,5,5,5,5,5,5,5,5,5,5,5,5,5,5,5,5,5,5,5,5,5,5
426c88c	1.097632	6.1	discard	Add 0.1 dropout to MLP c_proj output (before internal residual addition) to regularize the MLP sub-block output	The aim of this study was to determine the effect of the 2- and 3- and 3- and 3- and 3- and 3- and 3- and 3- and 3- and 3- and 3- and 3- and 3- and 3- and 3- and 3- and 3- and 3- and 3- and 3- and 3- and 3- and
cf286cb	1.092845	6.0	discard	Enable cuDNN benchmarking to automatically select fastest algorithms for the fixed input shapes, improving training throughput and allowing more gradient steps within the 5-minute budget	The aim of this study was to determine the effect of the 2-position of 2-position of 2-position of 2-position of 2-position of 2-position of 2-position of 2-position of 2-position of 2-position of 2-position of 2-position of 2-position of 2-position of 2-position of 2-position of 2-position of 2-
2cf71e6	0.000000	0.0	crash	Add learnable bias to value embedding gate (ve_gate) and initialize to zero for improved gating flexibility [Traceback (most recent call last):
733c1cc	1.200062	6.1	discard	Replace MLP with SwiGLU activation (gated linear unit with SiLU) adjusting hidden dim to 8/3*n_embd to maintain similar parameter count while improving gradient flow and representational capacity	The aim of this study was to investigate the effects of a newer, a newer, and a newer, and to investigate the effects of a newer, a newer, and to the newer, and to the newer, and to theer, and to theer, and toer, and toer, and toer.The purpose of this study was to investigate the effect of a newer, and the effect of aer, on the effect of the
d7f56a6	1.111115	6.0	discard	Add DropPath (stochastic depth) regularization with 0.1 drop probability to transformer block residual connections. This randomly drops the residual branches during training (scaled by 1/(1-0.1)) to improve generalization, matching the best previous result.	The aim of this study was to determine the effect of the two different types of the two types of the two types of the two types of the two types of the two types of the two types of the two types of the two types of the two types of the two types of the two types of the two types of the two types of the two types of the two types of the two types of the two types of the two types of the two types of the two types of the two types of
86c3033	1.080772	6.1	discard	Add 0.05 dropout to MLP input after normalization for targeted regularization of the feedforward sub-block	The aim of this study was to determine the effect of the 2-mercaptopropyl-2-phenyl-2-phenyl-2-phenyl-2-phenyl-2-phenyl-2-phenyl-2-phenyl-2-phenyl-2-phenyl-2-phenyl-2-phenyl-2-phenyl-2-phenyl-2-phenyl-2-phenyl-2-phenyl-2-phenyl-2-phenyl-2-phenyl-2-p
a511bb2	1.096635	6.0	discard	Reduce sliding window size for 'S' layers from half to quarter sequence length (512 instead of 1024) to increase training throughput, allowing more gradient steps within the 5-minute budget while maintaining full attention in the final layer for long-range dependencies	The aim of this study was to determine the effect of the 2,3-dimethylthiopropylthiopropylthiopropylthiopropylthiopropylthiopropylthiopropylthiopropylthiopropylthiopropylthiopropylthiopropylthiopropylthiopropylthiopropylthiopropylthi
63d9d75	1.101119	5.9	discard	Reduce Value Embedding layers to last 2 only (from alternating 6 layers) to improve training throughput, allowing more gradient steps within the 5-minute budget	The aim of this study was to determine the effect of the 2,3,4,4,4,4,4,4,4,4,4,4,4,4,4,4,4,4,4,4,4,4,4,4,4,4,4,4,4,4,4,4,4,4,4,4,4,4,4,4,4,4,4,4
80d7c4d	1.088663	6.1	discard	Combine DropPath (stochastic depth) with 0.1 probability and 0.05 dropout on MLP input after normalization to improve generalization beyond the current best	The aim of this study was to determine the effect of the combination of the combination of the combination of the combination of the combination of the combination of the combination of the combination of the combination of the combination of the combination of the combination of the combination of the combination of the combination of the combination of the combination of the combination of the combination of the combination of the combination of the combination of the combination of the combination of the combination of the combination of the combination of the combination of the combination of the combination
bab9c51	1.105191	6.0	discard	Add DropPath (stochastic depth) regularization with 0.09 drop probability to residual connections in transformer blocks	The aim of this study was to determine the effect of a single dose of 1 mg/kg of 1 mg/kg of 1 mg/kg of 1 mg/kg of 1 mg/kg of 1 mg/kg of 1 mg/kg of 1 mg/kg of 1 mg/kg of 1 mg/kg of 1 mg/kg of 1 mg/kg of 1 mg/kg of 1 mg/kg of 1 mg/kg of 1 mg/kg of 1 mg/kg of
a182b2b	1.639483	5.5	discard	Use parallel attention and MLP (PaLM-style) with shared pre-normalization to improve throughput by reducing normalization operations from 2 to 1 per block and allowing parallel computation	The aim of the first time of the first time of the first time of the first time of the first time of the first time of the first time of the first time of the first time of the first time of the first time of the first time of the first time of the first time of the first time of the first time of the first time of the first time of the first time of the first time of the first time of the first time of the first time of the first time of the
c2361a1	1.656465	6.0	discard	Apply asymmetric DropPath (stochastic depth) with 0.05 drop probability to attention residual and 0.15 to MLP residual, based on the observation that MLP benefits from stronger regularization than attention in this architecture	The aim of the most common cause of the most common in the most common in the most common in the most common in the most common in the most common in the most common in the most common in the most common in the most common in the most common in the most common in the most common in the most common in the most common in the most common in the most common in the most common in the most common in the most common in the most common in the most common in the most common in
604797e	0.000000	0.0	crash	Combine DropPath (stochastic depth) with 0.1 drop probability on both attention and MLP residual connections, and add 0.05 dropout to the MLP input after normalization. This combines two complementary regularization techniques from near-miss experiments to improve generalization. [Traceback (most recent call last):
42aa9af	1.119994	6.0	discard	Add DropPath (stochastic depth) with 0.1 probability to the MLP internal residual connection, randomly dropping the MLP transformation output during training to regularize the feedforward sub-block	The aim of this study was to evaluate the effect of a single dose of 100 mg/kg of 100 mg/kg of 100 mg/kg of 100 mg/kg of 100 mg/kg of 100 mg/kg of 100 mg/kg of 100 mg/kg of 100 mg/kg of 100 mg/kg of 100 mg/kg of 100 mg/kg of 100 mg/kg of 100 mg/kg of
6b16b52	1.113275	6.0	discard	Initialize value embedding gate weights to -2.0 instead of 0.0 to start with weaker gating (sigmoid(-2)*2≈0.24) and let the model gradually learn to incorporate value embeddings rather than having them fully active from the start	The aim of this study was to investigate the effects of the 2,4-dimethyl-2,4-dimethyl-2,4-dimethyl-2,4-dimethyl-2,4-dimethyl-2,4-dimethyl-2,4-dimethyl-2,4-dimethyl-2,4-dimethyl-2,4-dimethyl-2,4-dimethyl-2,4-dimethyl-2,4-dimethyl-2,4-dimethyl-2,4
ad5f76a	1.133442	6.0	discard	Add DropPath (stochastic depth) regularization with 0.1 drop probability to residual connections in transformer blocks to improve generalization	The aim of this study was to investigate the effect of a single dose of 100 mg/kg of the 100 mg/kg of the 100 mg/kg of the 100 mg/kg of the 100 mg/kg of the 100 mg/kg of the 100 mg/kg of the 100 mg/kg of the 100 mg/kg of the 100 mg/kg of the 100 mg/kg of the 100 mg/kg of the
c0d3e62	1.152694	6.0	discard	Increase AdamW beta1 from 0.8 to 0.9 for embedding and head parameters to provide stronger momentum for sparse gradient updates	The aim of this study was to investigate the effect of a 2-year-old male with a history of a 2-year-old female with a history of a history of a history of a history of a history of a history of a history of a history of a history of a history of a history of a history of a history of a history of a history of a history of a history of a history of a history of a history of a history of a history of a history of a history of
e1ae477	1.094375	5.5	discard	Reduce MLP expansion ratio from 4x to 3x to decrease model size and increase training throughput, allowing more gradient steps within the 5-minute budget	The aim of this study was to determine the effect of the administration of a 5-methoxy-5-methoxy-5-methoxy-5-methoxy-5-methoxy-5-methoxy-5-methoxy-5-methoxy-5-methoxy-5-methoxy-5-methoxy-5-methoxy-5-methoxy-5-methoxy-5-methoxy-5-methoxy-5-methoxy
269ac24	1.116882	6.0	discard	Change attention window pattern from 'SSSL' to 'LSSS' to place long-range attention at the beginning of the block cycle, potentially improving early global context aggregation.	The aim of this study was to evaluate the effect of a 2-year-old male with a history of a history of a history of a history of a history of a history of a history of a history of a history of a history of a history of a history of a history of a history of a history of a history of a history of a history of a history of a history of a history of a history of a history of a history of a history of a history of a history of a
fa70ce3	1.148129	5.5	discard	Change MLP activation from ReLU squared to standard ReLU to reduce computational overhead and potentially improve gradient flow, allowing more training steps within the 5-minute budget	The aim of this study was to investigate the effect of a single dose of 0.5 mg/kg of 0.5 mg/kg of 0.5 mg/kg of 0.5 mg/kg of 0.5 mg/kg of 0.5 mg/kg of 0.5 mg/kg of 0.5 mg/kg of 0.5 mg/kg of 0.5 mg/kg of 0.5 mg/kg of 0.5 mg/kg of
71de463	1.097706	6.0	discard	Add input token corruption regularization: randomly replace 1% of input token IDs with random vocabulary tokens during training to prevent overfitting and improve generalization	The aim of this study was to determine the effect of the combination of the combination of the combination of the combination of the combination of the combination of the combination of the combination of the combination of the combination of the combination of the combination of the combination of the combination of the combination of the combination of the combination of the combination of the combination of the combination of the combination of the combination of the combination of the combination of the combination of the combination of the combination of the combination of the combination of the combination
afdceb8	1.100240	6.1	discard	Add 0.05 dropout to attention values (v) after the value embedding residual connection to regularize the attention value stream without affecting query/key normalization	The aim of this study was to determine the effect of the use of a combination of a combination of a combination of the combination of the combination of the combination of the combination of the combination of the combination of the combination of the combination of the combination of the combination of the combination of the combination of the combination of the combination of the combination of the combination of the combination of the combination of the combination of the combination of the combination of the combination of the combination of the combination of the combination of the combination
86a7a02	1.576116	13.3	discard	Apply DropPath (stochastic depth) with 0.1 drop probability starting only after 20% training progress (delayed regularization), allowing faster initial convergence before applying strong regularization	The aim of the study of the effects of the effects of the effects of the effects of the effects of the effects of the effects of the effects of the effects of the effects of the effects of the effects of the effects of the effects of the effects of the effects of the effects of the effects of the effects of the effects of the effects of the effects of the effects of the effects of the effects of the effects of the effects of the effects of the effects of the effects of the effects of the
58caea9	1.114964	6.0	discard	Add DropPath (stochastic depth) with 0.1 drop probability to residual connections in transformer blocks to improve generalization	The aim of this study was to investigate the effect of a single dose of 0.5 mg/kg of 0.5 mg/kg of 0.5 mg/kg of 0.5 mg/kg of 0.5 mg/kg of 0.5 mg/kg of 0.5 mg/kg of 0.5 mg/kg of 0.5 mg/kg of 0.5 mg/kg of 0.5 mg/kg of 0.5 mg/kg of
139a027	1.100920	6.0	discard	Initialize resid_lambdas to 0.9 instead of 1.0 to weaken initial residual connections, acting as a deterministic form of stochastic depth that encourages shallower feature reuse early in training	The aim of this study was to determine the effect of a 2-minute period of 1-2 weeks of age on the incidence of acute respiratory syndrome (ASA) in patients with acute respiratory syndrome (ASA).The aim of this study was to determine the prevalence of acute respiratory syndrome (ASA) in patients with ASA.The aim of this study was to determine the prevalence of acute respiratory syndrome (ASA) in patients with ASA.The aim
7c0d973	1.095621	6.0	discard	Reduce value embedding gate channels from 32 to 16 to decrease gating capacity and increase regularization	The aim of this study was to determine the effect of the use of a combination of a combination of a combination of a combination of a combination of a combination of a combination of a combination of a combination of a combination of a combination of a combination of a combination of a combination of a combination of a combination of a combination of a combination of a combination of a combination of a combination of a combination of a combination of a combination of a combination of a combination of a combination of a combination of a combination
6328247	1.116815	6.5	discard	Fix MLP double residual bug and add DropPath (stochastic depth) with 0.1 probability to residual connections	The aim of this study was to investigate the effects of a single dose of 0.5 mg/kg of 0.5 mg/kg of 0.5 mg/kg of 0.5 mg/kg of 0.5 mg/kg of 0.5 mg/kg of 0.5 mg/kg of 0.5 mg/kg of 0.5 mg/kg of 0.5 mg/kg of 0.5 mg/kg of 0.5 mg/kg of
