commit	val_bpb	memory_gb	status	description	sample_text
43f243f	0.946002	6.0	discard	Apply all proven best settings (TOTAL_BATCH_SIZE=2**17, MATRIX_LR=0.035, fixed clip 0.5, momentum warmup 300 steps, peak momentum 0.93) with WARMDOWN_RATIO=0.42 - continuing the trend that less warmdown (0.46 > 0.44 > 0.50) improves results, pushing further in that direction	The aim of this study was to investigate the effect of the addition of a combination of a combination of a combination of a combination of a combination of a combination of a combination of a combination of a combination of a combination of a combination of a combination of a combination of a combination of a combination of a combination of a combination of a combination of a combination of a combination of a combination of a combination of a combination of a combination of combination of a combination of combination of a combination of combination of combination of
2444a2b	0.944924	6.0	discard	Apply all proven best settings (TOTAL_BATCH_SIZE=2**17, MATRIX_LR=0.035, fixed clip 0.5, momentum warmup 300 steps, peak momentum 0.93, WARMDOWN_RATIO=0.46) plus UNEMBEDDING_LR=0.010 - combining the two best near-misses that haven't been tried together	The aim of this study was to investigate the effect of the presence of a single dose of 1,2,3-triazine (TTZ) on the expression of the genes involved in the development of the rat brain. The results showed that TTZ treatment significantly increased the expression of the genes involved in the development of the rat brain. The expression of the genes involved in the development of the rat brain was significantly increased in the presence of TTZ. The expression of the genes
30da520	0.946138	6.0	discard	Apply all proven best settings cleanly: TOTAL_BATCH_SIZE=2**17, MATRIX_LR=0.035, fixed clip 0.5, 300-step momentum warmup to 0.93, WARMDOWN_RATIO=0.46, UNEMBEDDING_LR=0.010, EMBEDDING_LR=0.65	The aim of this study was to investigate the effect of a combination of a combination of a combination of a combination of a combination of a combination of a combination of a combination of a combination of a combination of a combination of a combination of a combination of a combination of a combination of a combination of a combination of a combination of a combination of a combination of a combination of a combination of a combination of a combination of a combination of a combination of a combination of a combination of a combination of a combination
d3b5754	0.948372	6.0	discard	Apply all proven best settings: TOTAL_BATCH_SIZE=2**17, MATRIX_LR=0.035, fixed clip 0.5, 300-step momentum warmup to 0.93, WARMDOWN_RATIO=0.46, plus try Adam beta1=0.85 for embedding/lm_head groups for slightly more momentum stability	The aim of this study was to evaluate the effect of the combination of the combination of the two drugs on the growth of the human breast cancer cell line MCF-7. The results showed that the combination of the two drugs was effective in the treatment of MCF-7 cells. The combination of the two drugs was effective in the treatment of MCF-7 cells. The combination of the two drugs was effective in the treatment of MCF-7 cells. The combination of the two drugs was
fca0251	0.946670	6.0	discard	Apply all proven best settings (TOTAL_BATCH_SIZE=2**17, MATRIX_LR=0.035, fixed clip 0.5, 300-step momentum warmup to 0.93) plus use constant weight decay instead of cosine-decaying weight decay - the decay removes regularization too early in training	The aim of this study was to determine the effect of the presence of a single dose of 1,2-diphenyl-2-picrylhydrazyl (DPPH) on the pharmacokinetics of 1,2-diphenyl-2-picrylhydrazyl (DPPH) in rats. The rats were randomly divided into two groups: control group (n = 10) and DPPH group (n = 10) and DPPH
eac7a1f	0.946244	6.0	discard	Apply all proven best settings (TOTAL_BATCH_SIZE=2**17, MATRIX_LR=0.035, fixed clip 0.5, 300-step momentum warmup to 0.93) with WARMDOWN_RATIO=0.40 - continuing the trend that less warmdown improves results, trying 0.40 which hasn't been tested	The aim of this study was to investigate the effect of the presence of the 5-HT1A receptor antagonist, 5-HT1A receptor antagonist, on the expression of the 5-HT1A receptor in the rat hippocampus. The 5-HT1A receptor antagonist, 5-HT1A receptor antagonist, 5-HT1A receptor antagonist, 5-HT1A receptor antagonist, 5-HT1A receptor antagonist, 5-HT1A receptor antagonist, 5-HT1
46d098d	0.945095	6.0	discard	Apply all proven best settings to current train.py: TOTAL_BATCH_SIZE=2**17, MATRIX_LR=0.035, fixed gradient clip norm 0.5, Muon momentum warmup over 300 steps to peak 0.93, WARMDOWN_RATIO=0.46, plus try SCALAR_LR=0.3 which reduces noise in per-layer scalar updates - never tried before	The aim of this study was to investigate the effect of the use of a combination of a combination of a combination of a combination of a combination of a combination of a combination of a combination of a combination of a combination of a combination of a combination of a combination of a combination of a combination of a combination of a combination of a combination of a combination of a combination of a combination of a combination of a combination of a combination of a combination of a combination of a combination of a combination of a combination
da386d3	0.946535	6.0	discard	Apply all proven best settings (TOTAL_BATCH_SIZE=2**17, MATRIX_LR=0.035, fixed clip 0.5, 300-step momentum warmup to 0.93, WARMDOWN_RATIO=0.46) plus SCALAR_LR=0.3 and UNEMBEDDING_LR=0.010 - combining near-misses that haven't been tried together in this exact combination	The aim of this study was to investigate the effects of the anti-apoptotic Bcl-2 family member Bcl-2 on the apoptosis of human Bcl-2 family members. The Bcl-2 family member Bcl-2 family member Bcl-2 family member Bcl-2 family member Bcl-2 family member Bcl-2 family member Bcl-2 family member Bcl-2 family member Bcl-2 family member Bcl-2 family member
4f57e67	0.945981	6.0	discard	Apply all proven best settings cleanly to current train.py: TOTAL_BATCH_SIZE=2**17, MATRIX_LR=0.035, fixed clip norm 0.5, 300-step momentum warmup to peak 0.93, WARMDOWN_RATIO=0.46, EMBEDDING_LR=0.65, UNEMBEDDING_LR=0.010 - the exact combination of the two best near-misses (+0.0004 and +0.0005) applied cleanly	
2f63177	0.000000	0.0	crash	Apply all proven best settings (TOTAL_BATCH_SIZE=2**17, MATRIX_LR=0.035, fixed clip 0.5, 300-step momentum warmup to 0.93, WARMDOWN_RATIO=0.46) plus start Muon momentum warmup from 0.85 instead of 0.88 for a slightly wider warmup range - this specific combination hasn't been tried []	
892ec05	0.945890	6.0	discard	Apply all proven best settings: TOTAL_BATCH_SIZE=2**17, MATRIX_LR=0.035, fixed clip 0.5, 300-step momentum warmup to peak 0.93, WARMDOWN_RATIO=0.46, plus try SCALAR_LR=0.2 (lower than default 0.5) to reduce noise in per-layer scalar updates - never tried this specific value with proven best settings	The aim of this study was to investigate the effect of the use of a combination of a combination of a combination of a combination of a combination of a combination of a combination of a combination of a combination of a combination of a combination of a combination of a combination of a combination of a combination of a combination of a combination of a combination of a combination of a combination of a combination of a combination of a combination of a combination of a combination of a combination of a combination of a combination of a combination
1528964	0.944303	6.0	discard	Apply all proven best settings cleanly: TOTAL_BATCH_SIZE=2**17, MATRIX_LR=0.035, fixed clip norm 0.5, 300-step Muon momentum warmup to peak 0.93, WARMDOWN_RATIO=0.46 - the current train.py still has old defaults and this combination achieved the best result	The aim of this study was to evaluate the effect of the presence of a high-fat diet on the development of the liver and the liver of the rats. The rats were fed a high-fat diet (HFD) or a high-fat diet (HFD) for 4 weeks. The rats were fed a high-fat diet (HFD) or HFD for 4 weeks. The rats were fed a high-fat diet (HFD) or HFD for 4
756cf15	0.000000	0.0	crash	Apply all proven best settings (TOTAL_BATCH_SIZE=2**17, MATRIX_LR=0.035, fixed clip 0.5, 300-step momentum warmup to 0.93, WARMDOWN_RATIO=0.46) plus increase z-loss from 1e-4 to 3e-4 for stronger logit regularization - never tried with these settings [GPU: NVIDIA GeForce RTX 5070 Ti (16303MB VRAM)
Config: DEPTH=8, DEVICE_BATCH_SIZE=16, VRAM_LIMIT=158]	
