commit	val_bpb	memory_gb	status	description	sample_text
84a18ec	0.941914	6.0	keep	Restore proven best settings (TOTAL_BATCH_SIZE=2^17, WARMDOWN_RATIO=0.69, MATRIX_LR=0.035, fixed grad clip 0.4) and reduce z-loss from 5e-5 to 2e-5 to further reduce logit over-regularization	The aim of this study was to evaluate the effect of a combination of a combination of a combination of a combination of a combination of a combination of a combination of a combination of a combination of a combination of a combination of a combination of a combination of a combination of a combination of a combination of a combination of a combination of a combination of a combination of a combination of a combination of a combination of a combination of a combination of a combination of a combination of a combination of a combination of a combination
4fc1f8b	0.000000	0.0	crash	Reduce logit softcap from 12 to 10 for stronger implicit logit regularization, complementing the z-loss, with all proven best settings [GPU: NVIDIA GeForce RTX 5070 Ti (16303MB VRAM)
Config: DEPTH=8, DEVICE_BATCH_SIZE=16, VRAM_LIMIT=158]	
d9751c3	0.941778	6.0	keep	Apply all proven best settings together: TOTAL_BATCH_SIZE=2^17, WARMDOWN_RATIO=0.69, MATRIX_LR=0.035, z-loss=2e-5, fixed gradient clip=0.4	The aim of this study was to evaluate the effect of a combination of a combination of a combination of a combination of a combination of a combination of a combination of a combination of a combination of a combination of a combination of a combination of a combination of a combination of a combination of a combination of a combination of a combination of a combination of a combination of a combination of a combination of a combination of a combination of a combination of a combination of a combination of a combination of a combination of a combination
b7ad64d	0.944428	6.0	discard	Increase rotary embedding base frequency from 50000 to 500000 (similar to modern LLMs like Llama 3). Higher base frequency allows better extrapolation and may improve modeling of long-range dependencies within the 2048 context window.	The aim of this study was to evaluate the effect of a combination of a combination of a combination of a combination of a combination of a combination of a combination of a combination of a combination of a combination of a combination of a combination of a combination of a combination of a combination of a combination of a combination of a combination of a combination of a combination of a combination of a combination of a combination of a combination of a combination of a combination of a combination of a combination of a combination of a combination
e9e5fbc	0.952575	6.0	discard	Try TOTAL_BATCH_SIZE=2^16 for 8x more optimizer steps than baseline (vs current 2^17 which is 4x). More frequent weight updates may improve final convergence within the 5-minute budget.	The aim of this study was to investigate the effect of the presence of a high-fat diet on the expression of the genes involved in the development of the liver fibrosis model. The liver fibrosis model was established by the liver fibrosis model. The liver fibrosis model was established by the liver fibrosis model. The liver fibrosis model was established by the liver fibrosis model. The liver fibrosis model was established by the liver fibrosis model. The liver fibrosis model was established by the liver fibrosis model. The liver fibrosis model was
c7d97c6	0.946658	6.0	discard	Apply all proven best settings (TOTAL_BATCH_SIZE=2^17, WARMDOWN_RATIO=0.69, MATRIX_LR=0.035, z-loss=2e-5, fixed grad clip=0.4) and try increasing Muon momentum from 0.95 peak to 0.97 for stronger gradient smoothing with the higher step count	The aim of this study was to investigate the effect of the presence of a combination of a combination of a combination of a combination of a combination of a combination of a combination of a combination of a combination of a combination of a combination of a combination of a combination of a combination of a combination of a combination of a combination of a combination of a combination of a combination of a combination of a combination of a combination of a combination of a combination of a combination of a combination of a combination of a combination
-------	0.000000	0.0	crash	FAILED TO APPLY: Reduce Muon ns_steps from 5 to 4 for faster orthogonalization, allowing more optimizer steps within the 5-minute budget with proven best settings (TOTAL_BATCH_SIZE=2^17, WARMDOWN_RATIO=0.69, MATRIX_LR=0.035, z-loss=2e-5, fixed grad clip=0.4)	
4c59465	0.947239	6.0	discard	Apply all proven best settings: TOTAL_BATCH_SIZE=2^17, WARMDOWN_RATIO=0.69, MATRIX_LR=0.035, z-loss=2e-5, fixed gradient clip=0.4, and increase initial x0_lambdas from 0.1 to 0.05 to reduce the skip connection influence which may be over-smoothing representations	The aim of this study was to evaluate the effect of a combination of a combination of a combination of a combination of a combination of a combination of a combination of a combination of a combination of a combination of a combination of a combination of a combination of a combination of a combination of a combination of a combination of a combination of a combination of a combination of a combination of a combination of a combination of a combination of a combination of a combination of a combination of a combination of a combination of a combination
f20e58e	0.946055	6.0	discard	Restore all proven best settings (TOTAL_BATCH_SIZE=2^17, WARMDOWN_RATIO=0.69, MATRIX_LR=0.035, z-loss=2e-5, fixed grad clip=0.4) and increase SCALAR_LR from 0.5 to 1.0 for faster adaptation of per-layer scale parameters	The aim of this study was to investigate the effects of the administration of a single dose of 1.5 mg/kg of 1.5 mg/kg of 1.5 mg/kg of 1.5 mg/kg of 1.5 mg/kg of 1.5 mg/kg of 1.5 mg/kg of 1.5 mg/kg of 1.5 mg/kg of 1.5 mg/kg of 1.5 mg/kg of 1.5 mg
5876918	0.943371	6.0	discard	Apply all proven best settings (TOTAL_BATCH_SIZE=2^17, WARMDOWN_RATIO=0.69, MATRIX_LR=0.035, z-loss=2e-5, fixed grad clip=0.4) and reduce Muon WEIGHT_DECAY from 0.2 to 0.1 since with 4x more optimizer steps, the effective total weight decay is already doubled	The aim of this study was to investigate the effect of the presence of a single dose of 1,2,3-triazine on the growth of the rat brain. The rats were divided into three groups: control group, 1, 2, 3, 4, 5, 6, 7, 8, 10, 15, 20, 30, 60, 90, 120, 240, 480,
492c436	0.941953	6.0	discard	Try WARMDOWN_RATIO=0.71 with all proven best settings (TOTAL_BATCH_SIZE=2^17, MATRIX_LR=0.035, z-loss=2e-5, fixed grad clip=0.4). The optimal warmdown ratio may be slightly above 0.69 - exploring the other side of the 0.69 optimum.	The aim of this study was to investigate the effect of the presence of a single dose of 1.5 mg/kg of 1.5 mg/kg of 1.5 mg/kg of 1.5 mg/kg of 1.5 mg/kg of 1.5 mg/kg of 1.5 mg/kg of 1.5 mg/kg of 1.5 mg/kg of 1.5 mg/kg of 1.5 mg/kg of 1.5 mg
c127d12	0.000000	0.0	crash	Restore all proven best settings: TOTAL_BATCH_SIZE=2^17, WARMDOWN_RATIO=0.69, MATRIX_LR=0.035, z-loss=2e-5, fixed grad clip=0.4, and also try reducing MLP expansion from 4x to 3x to reduce per-step compute and enable more optimizer steps [step 00687 (97.5%) | loss: 2.871697 | lrm: 0.04 | dt: 390ms | tok/sec: 335,979 | mfu: 7.3% | epoch: ]	
1329f7f	0.000000	0.0	crash	Apply all proven best settings (TOTAL_BATCH_SIZE=2^17, WARMDOWN_RATIO=0.71, MATRIX_LR=0.035, fixed grad clip=0.4) and reduce z-loss from 2e-5 to 1e-5 to further reduce logit over-regularization [GPU: NVIDIA GeForce RTX 5070 Ti (16303MB VRAM)
Config: DEPTH=8, DEVICE_BATCH_SIZE=16, VRAM_LIMIT=158]	
1625a2f	0.942449	6.0	discard	Restore all proven best settings: TOTAL_BATCH_SIZE=2^17, WARMDOWN_RATIO=0.69, MATRIX_LR=0.035, z-loss=2e-5, fixed grad clip=0.4, and additionally try Muon weight_decay=0.15 (between 0.1 which gave +0.0016 and 0.2 baseline) as a new interpolation point	The aim of this study was to investigate the effect of the presence of the anti-inflammatory cytokine interleukin-1beta (IL-1beta) on the expression of IL-1beta in the rat brain. The results showed that IL-1beta was significantly increased in the brain of rats with chronic inflammatory pain (CIP), and IL-1beta was significantly increased in the brain of rats with chronic inflammatory pain (CIP). The expression of IL-1beta was significantly increased in the brain of
3f9f5da	0.000000	0.0	crash	Try z-loss=1e-5 (half of current 2e-5) combined with WARMDOWN_RATIO=0.70 and all other proven best settings. The 2e-5 z-loss may still be slightly over-regularizing, and 0.70 was the original best warmdown ratio. []	
2c30e2e	0.943618	6.0	discard	Try Muon weight_decay=0.12 as interpolation between 0.1 (+0.0016) and 0.15 (+0.0007), combined with all proven best settings: TOTAL_BATCH_SIZE=2^17, WARMDOWN_RATIO=0.69, MATRIX_LR=0.035, z-loss=2e-5, fixed grad clip=0.4	The aim of this study was to investigate the effect of the use of a combination of a combination of a combination of a combination of a combination of a combination of a combination of a combination of a combination of a combination of a combination of a combination of a combination of a combination of a combination of a combination of a combination of a combination of a combination of a combination of a combination of a combination of a combination of a combination of a combination of a combination of a combination of a combination of a combination
1253762	0.000000	0.0	crash	Combine two near-misses: WARMDOWN_RATIO=0.71 (+0.0002) with Muon weight_decay=0.15 (+0.0007), plus all proven best settings (TOTAL_BATCH_SIZE=2^17, MATRIX_LR=0.035, z-loss=2e-5, fixed grad clip=0.4) []	
44a8eca	0.942376	6.0	discard	Apply all proven best settings (TOTAL_BATCH_SIZE=2^17, WARMDOWN_RATIO=0.73, MATRIX_LR=0.035, z-loss=2e-5, fixed grad clip=0.4) - trying WARMDOWN_RATIO=0.73 as new interpolation point between 0.71 (+0.0002) and 0.75, which may find a better LR schedule sweet spot	
7b73657	0.000000	0.0	crash	Restore all proven best settings: TOTAL_BATCH_SIZE=2^17, WARMDOWN_RATIO=0.69, MATRIX_LR=0.035, z-loss=2e-5, fixed gradient clip=0.4, and try Muon momentum peak of 0.96 (between current 0.95 and 0.97 which gave +0.0049) [step 00621 (97.3%) | loss: 2.836363 | lrm: 0.04 | dt: 431ms | tok/sec: 303,919 | mfu: 7.3% | epoch: ]	
6d232df	0.000000	0.0	crash	Combine two near-misses: WARMDOWN_RATIO=0.71 (+0.0002) with Muon weight_decay=0.15 (+0.0007), plus all proven best settings (TOTAL_BATCH_SIZE=2^17, MATRIX_LR=0.035, z-loss=2e-5, fixed grad clip=0.4) [step 00620 (97.1%) | loss: 2.827123 | lrm: 0.04 | dt: 432ms | tok/sec: 303,398 | mfu: 7.3% | epoch: ]	
50e2e23	0.942662	6.0	discard	Try WARMDOWN_RATIO=0.75 combined with all proven best settings (TOTAL_BATCH_SIZE=2^17, MATRIX_LR=0.035, z-loss=2e-5, fixed grad clip=0.4). Previous 0.75 experiments used different/worse settings. The 0.71 near-miss (+0.0002) suggests optimum may be above 0.69, and 0.75 was the original best standalone result.	The aim of this study was to determine the effect of a combination of a combination of a combination of a combination of a combination of a combination of a combination of a combination of a combination of a combination of a combination of a combination of a combination of a combination of a combination of a combination of a combination of a combination of a combination of a combination of a combination of a combination of a combination of a combination of a combination of a combination of a combination of a combination of a combination of a combination
409ecc7	0.944398	6.0	discard	Apply all proven best settings (TOTAL_BATCH_SIZE=2^17, WARMDOWN_RATIO=0.69, MATRIX_LR=0.035, z-loss=2e-5, fixed grad clip=0.4) and try lower initial Muon momentum warmup start of 0.85 instead of 0.88 for smoother early optimization with the higher step count	The aim of this study was to evaluate the effect of the use of a combination of a combination of a combination of a combination of a combination of a combination of a combination of a combination of a combination of a combination of a combination of a combination of a combination of a combination of a combination of a combination of a combination of a combination of a combination of a combination of a combination of a combination of a combination of a combination of a combination of a combination of a combination of a combination of a combination
b2621b7	0.945107	6.0	discard	Apply all proven best settings (TOTAL_BATCH_SIZE=2^17, WARMDOWN_RATIO=0.69, MATRIX_LR=0.035, z-loss=2e-5, fixed grad clip=0.4) and use constant weight decay instead of cosine decay schedule - the cosine decay may be reducing regularization too aggressively in later training	The aim of this study was to investigate the effect of the presence of a single dose of 1.5 mg/kg of 1.5 mg/kg of 1.5 mg/kg of 1.5 mg/kg of 1.5 mg/kg of 1.5 mg/kg of 1.5 mg/kg of 1.5 mg/kg of 1.5 mg/kg of 1.5 mg/kg of 1.5 mg/kg of 1.5 mg
6772736	0.000000	0.0	crash	Replace ReLU^2 activation with SiLU^2 (squared SiLU) in MLP - smoother activation with non-zero gradients for negative inputs, keeping same proven best settings [GPU: NVIDIA GeForce RTX 5070 Ti (16303MB VRAM)
Config: DEPTH=8, DEVICE_BATCH_SIZE=16, VRAM_LIMIT=158]	
9ab6efd	0.942445	6.0	discard	Restore all proven best settings to current script: TOTAL_BATCH_SIZE=2^17, WARMDOWN_RATIO=0.69, MATRIX_LR=0.035, z-loss=2e-5, fixed grad clip=0.4, plus try Adam beta2=0.98 for matrix params (between 0.95 baseline and 0.999) as new interpolation	The aim of this study was to investigate the effect of the presence of a specific antigen on the expression of the human leukocyte antigen (HLA) and the expression of the HLA-DRB1 and HLA-DRB1 genes in the sera of patients with acute lymphoblastic leukemia (ALL). The results showed that the presence of the antigen was associated with the expression of the HLA-DRB1 and HLA-DRB1 genes. The expression of the HLA-DRB1
43332f0	0.941412	6.0	keep	Restore all proven best settings (TOTAL_BATCH_SIZE=2^17, WARMDOWN_RATIO=0.69, MATRIX_LR=0.035, z-loss=2e-5, fixed grad clip=0.4) and try SCALAR_LR=0.3 (lower than baseline 0.5) since per-layer scalars may be updating too aggressively with 4x more steps	The aim of this study was to evaluate the effect of a combination of a combination of a combination of a combination of a combination of a combination of a combination of a combination of a combination of a combination of a combination of a combination of a combination of a combination of a combination of a combination of a combination of a combination of a combination of a combination of a combination of a combination of a combination of a combination of a combination of a combination of a combination of a combination of a combination of a combination
62a6602	0.952791	6.0	discard	Change HEAD_DIM from 128 to 64, doubling the number of attention heads (from 6 to 12) while keeping model_dim=768. More attention heads allows more diverse attention patterns and may improve model quality.	The aim of this study was to determine the effect of the use of a combination of a combination of a combination of a combination of a combination of a combination of a combination of a combination of a combination of a combination of a combination of a combination of a combination of a combination of a combination of a combination of a combination of a combination of a combination of a combination of a combination of a combination of a combination of a combination of a combination of a combination of a combination of a combination of a combination
1cf2973	0.000000	0.0	crash	Apply all proven best settings (TOTAL_BATCH_SIZE=2^17, WARMDOWN_RATIO=0.69, MATRIX_LR=0.035, z-loss=2e-5, fixed grad clip=0.4) plus SCALAR_LR=0.3 which previously matched baseline exactly - combining with better base settings may yield improvement [GPU: NVIDIA GeForce RTX 5070 Ti (16303MB VRAM)
Config: DEPTH=8, DEVICE_BATCH_SIZE=16, VRAM_LIMIT=158]	
f0807c0	0.940924	6.0	keep	Combine WARMDOWN_RATIO=0.71 (near-miss +0.0005) with Muon weight_decay=0.15 (near-miss +0.0007) plus all other proven best settings: TOTAL_BATCH_SIZE=2^17, MATRIX_LR=0.035, z-loss=2e-5, fixed grad clip=0.4, SCALAR_LR=0.3	The aim of this study was to investigate the effect of the use of a combination of a combination of a combination of a combination of a combination of a combination of a combination of a combination of a combination of a combination of a combination of a combination of a combination of a combination of a combination of a combination of a combination of a combination of a combination of a combination of a combination of a combination of a combination of a combination of a combination of a combination of a combination of a combination of a combination
b211914	0.941071	6.0	discard	Try WARMDOWN_RATIO=0.69 combined with current proven settings (WEIGHT_DECAY=0.15, SCALAR_LR=0.3, MATRIX_LR=0.035, z-loss=2e-5, fixed grad clip=0.4). The 0.69 was best standalone warmdown ratio but hasn't been combined with WEIGHT_DECAY=0.15 and SCALAR_LR=0.3	The aim of this study was to evaluate the effect of a 2-week treatment with 2% 5% 5% 5% 5% 5% 5% 5% 5% 5% 5% 5% 5% 5% 5% 5% 5% 5% 5% 5% 5% 5% 5% 5% 5% 5% 5% 5
3f252cb	0.941298	6.0	discard	Combine WARMDOWN_RATIO=0.69 with weight_decay=0.15 and SCALAR_LR=0.3 - the 0.69 ratio gave best standalone result (+0.0001 gap) but hasn't been combined with weight_decay=0.15 (near-miss) and SCALAR_LR=0.3 (proven improvement)	The aim of this study was to determine the effect of a combination of a combination of a combination of a combination of a combination of a combination of a combination of a combination of a combination of a combination of a combination of a combination of a combination of a combination of a combination of a combination of a combination of a combination of a combination of a combination of a combination of a combination of a combination of combination of a combination of combination of a combination of combination of a combination of combination of combination of combination
738be80	1.073245	6.0	discard	Try WARMDOWN_RATIO=0.67 as new interpolation between 0.65 and 0.69, combined with all proven best settings (WEIGHT_DECAY=0.15, SCALAR_LR=0.3, MATRIX_LR=0.035, WARMDOWN_RATIO=0.71, z-loss=2e-5, fixed grad clip=0.4)	The aim of this study was to determine the effect of the use of a new, selective, and selective inhibitor of the 3'-deoxyuridine (3'-deoxyuridine (3'-deoxyuridine) in the treatment of acute acute acute acute acute acute acute acute acute acute acute acute acute acute acute acute acute acute acute acute acute acute acute acute acute acute acute acute acute acute acute acute acute acute acute acute acute acute acute acute acute acute acute acute acute acute acute acute acute acute
745b1ba	0.941743	6.0	discard	Use fixed gradient clip of 0.35 (between proven 0.4 and cosine minimum 0.3) with all proven best settings: WARMDOWN_RATIO=0.71, WEIGHT_DECAY=0.15, SCALAR_LR=0.3, MATRIX_LR=0.035, z-loss=2e-5	
a9b5a20	0.000000	0.0	crash	Try z-loss=1.5e-5 (between current 2e-5 and untried 1e-5) with all proven best settings: TOTAL_BATCH_SIZE=2^17, WARMDOWN_RATIO=0.71, WEIGHT_DECAY=0.15, SCALAR_LR=0.3, MATRIX_LR=0.035, fixed grad clip=0.4 [from .decomposition import select_decomp_table
File "/home/pat/autoresearch/.venv/lib/python3.12/sit]	
fbcf1ef	0.941667	6.0	discard	Apply all proven best settings cleanly: TOTAL_BATCH_SIZE=2^17, WARMDOWN_RATIO=0.71, WEIGHT_DECAY=0.15, SCALAR_LR=0.3, MATRIX_LR=0.035, z-loss=2e-5, fixed grad clip=0.4, and try Adam beta2=0.999 for scalar/x0 params for better second moment estimation of these infrequently-updated scalars	The aim of this study was to investigate the effect of the use of a combination of a combination of a combination of a combination of a combination of a combination of a combination of a combination of a combination of a combination of a combination of a combination of a combination of a combination of a combination of a combination of a combination of a combination of a combination of a combination of a combination of a combination of a combination of a combination of a combination of a combination of a combination of a combination of a combination
a7946f8	0.000000	0.0	crash	Add small LR warmup (WARMUP_RATIO=0.01) combined with all current proven best settings: WARMDOWN_RATIO=0.71, WEIGHT_DECAY=0.15, SCALAR_LR=0.3, MATRIX_LR=0.035, z-loss=2e-5, fixed grad clip=0.4. Previous warmup attempt used different/worse base settings. [GPU: NVIDIA GeForce RTX 5070 Ti (16303MB VRAM)
Config: DEPTH=8, DEVICE_BATCH_SIZE=16, VRAM_LIMIT=158]	
b69f156	0.943014	6.0	discard	Apply all proven best settings: TOTAL_BATCH_SIZE=2^17, WARMDOWN_RATIO=0.71, WEIGHT_DECAY=0.15, SCALAR_LR=0.3, MATRIX_LR=0.035, z-loss=2e-5, fixed grad clip=0.4, plus try Adam beta1=0.85 for embedding/lm_head params to improve gradient smoothing	The aim of this study was to evaluate the effect of a 2-week treatment with 2-weeksecretin (2.5 mg/kg) on the expression of the anti-apoptotic protein Bcl-2 in human breast cancer cells. The results showed that 2.5 mg/kg 2.5 mg/kg 2.5 mg/kg 2.5 mg/kg 2.5 mg/kg 2.5 mg/kg 2.5 mg/kg 2
6509c03	0.000000	0.0	crash	Try z-loss=3e-5 (between proven 2e-5 best and 5e-5) with all current best settings: WARMDOWN_RATIO=0.71, WEIGHT_DECAY=0.15, SCALAR_LR=0.3, MATRIX_LR=0.035, fixed grad clip=0.4 [GPU: NVIDIA GeForce RTX 5070 Ti (16303MB VRAM)
Config: DEPTH=8, DEVICE_BATCH_SIZE=16, VRAM_LIMIT=158]	
4587e34	0.000000	0.0	crash	Try WARMDOWN_RATIO=0.73 combined with WEIGHT_DECAY=0.15 and SCALAR_LR=0.3 - the 0.73 ratio was tried without these proven improvements, and combining all three may find a better optimum []	
