commit	val_bpb	memory_gb	status	description	sample_text
253a27a	0.943817	6.0	discard	Try EMBEDDING_LR=0.4 with all proven best settings (WARMDOWN_RATIO=0.71, WEIGHT_DECAY=0.15, SCALAR_LR=0.3, MATRIX_LR=0.035, z-loss=2e-5, fixed grad clip=0.4). Previous EMBEDDING_LR=0.4 attempt was without these proven improvements.	The aim of this study was to investigate the effect of the use of a combination of a combination of a combination of a combination of a combination of a combination of a combination of a combination of a combination of a combination of a combination of a combination of a combination of a combination of a combination of a combination of a combination of a combination of a combination of a combination of a combination of a combination of a combination of a combination of a combination of a combination of a combination of a combination of a combination
1e432f1	0.941058	6.0	discard	Apply all proven best settings with WARMDOWN_RATIO=0.72 (between best 0.71 and 0.69), WEIGHT_DECAY=0.15, SCALAR_LR=0.3, MATRIX_LR=0.035, z-loss=2e-5, fixed grad clip=0.4 - this exact combination hasn't been tried	The aim of this study was to investigate the effect of the combination of the combination of the combination of the combination of the combination of the combination of the combination of the combination of the combination of the combination of the combination of the combination of the combination of the combination of the combination of the combination of the combination of the combination of the combination of the combination of the combination of the combination of the combination of the combination of the combination of the combination of the combination of the combination of the combination of the combination
8d4750d	0.000000	0.0	crash	Fix MLP double-residual bug with all current best settings: WARMDOWN_RATIO=0.71, WEIGHT_DECAY=0.15, SCALAR_LR=0.3, MATRIX_LR=0.035, z-loss=2e-5, fixed grad clip=0.4. The MLP adds internal residual to norm(x) but Block also adds residual, creating x + norm(x) + mlp_output instead of x + mlp_output [GPU: NVIDIA GeForce RTX 5070 Ti (16303MB VRAM)
Config: DEPTH=8, DEVICE_BATCH_SIZE=16, VRAM_LIMIT=158]	
3c7d7e5	0.940933	6.0	discard	Restore all proven best settings: TOTAL_BATCH_SIZE=2^17, WARMDOWN_RATIO=0.71, WEIGHT_DECAY=0.15, SCALAR_LR=0.3, MATRIX_LR=0.035, z-loss=2e-5, fixed grad clip=0.4. Current script has reverted to worse defaults (TOTAL_BATCH_SIZE=2^19, WARMDOWN_RATIO=0.5, etc.)	
4faade9	0.940711	6.0	keep	Try WARMDOWN_RATIO=0.74 as new interpolation between 0.71 (near-miss +0.0001) and 0.75, combined with all proven best settings: TOTAL_BATCH_SIZE=2^17, WEIGHT_DECAY=0.15, SCALAR_LR=0.3, MATRIX_LR=0.035, z-loss=2e-5, fixed grad clip=0.4	
159418d	0.000000	0.0	crash	Try WARMDOWN_RATIO=0.76 as the next step beyond 0.74 (which matched baseline) - with all current proven best settings the optimal may be slightly above 0.74 [guard.create(builder)
File "/home/pat/autoresearch/.venv/lib/python3.12/site-packages/torch/_guards.]	
edb6359	0.941121	6.0	discard	Try WARMDOWN_RATIO=0.74 combined with all proven best settings (WEIGHT_DECAY=0.15, SCALAR_LR=0.3, MATRIX_LR=0.035, z-loss=2e-5, fixed grad clip=0.4) - the 0.74 previously matched baseline exactly but without WEIGHT_DECAY=0.15 and SCALAR_LR=0.3	The aim of this study was to evaluate the effect of a combination of a combination of a combination of a combination of a combination of a combination of a combination of a combination of a combination of a combination of a combination of a combination of a combination of a combination of a combination of a combination of a combination of a combination of a combination of a combination of a combination of a combination of a combination of a combination of a combination of a combination of a combination of a combination of a combination of a combination
e46a600	0.940816	6.0	discard	Apply all proven best settings (TOTAL_BATCH_SIZE=2^17, WARMDOWN_RATIO=0.74, WEIGHT_DECAY=0.15, SCALAR_LR=0.3, MATRIX_LR=0.035, fixed grad clip=0.4) and try z-loss=0 to test if removing z-loss entirely improves over current best since the optimal z-loss hasn't been tested at 0	The aim of this study was to investigate the effect of the use of a 2.5% sodium dodecyl sulfate (SDS) on the growth of the rat brain. The effect of SDS on the growth of the rat brain was studied. The results showed that the SDS treatment significantly increased the growth of the rat brain. The growth of the rat brain was significantly reduced by the use of a 2.5% sodium dodecyl sulfate (SDS) and
55f4c29	0.940576	6.0	keep	Initialize x0_lambdas to 0.2 instead of 0.1 to strengthen the input highway connection, providing better gradient flow from embeddings to all layers	The aim of this study was to determine the effect of a 1.5% 1.5% 1.5% 1.5% 1.5% 1.5% 1.5% 1.5% 1.5% 1.5% 1.5% 1.5% 1.5% 1.5% 1.5% 1.5% 1.5% 1.
53bc968	0.000000	0.0	crash	Replace z-loss on logsumexp with a mean-squared logit penalty (MSE toward zero) which directly penalizes large logit magnitudes without the exp computation, potentially providing better regularization [GPU: NVIDIA GeForce RTX 5070 Ti (16303MB VRAM)
Config: DEPTH=8, DEVICE_BATCH_SIZE=16, VRAM_LIMIT=158]	
7455080	0.000000	0.0	crash	Remove MLP internal residual (double-residual bug fix) combined with all proven best settings: TOTAL_BATCH_SIZE=2^17, WARMDOWN_RATIO=0.71, WEIGHT_DECAY=0.15, SCALAR_LR=0.3, MATRIX_LR=0.035, z-loss=2e-5, fixed grad clip=0.4 [GPU: NVIDIA GeForce RTX 5070 Ti (16303MB VRAM)
Config: DEPTH=8, DEVICE_BATCH_SIZE=16, VRAM_LIMIT=158]	
9527fde	0.941297	6.0	discard	Apply all proven best settings (TOTAL_BATCH_SIZE=2^17, WARMDOWN_RATIO=0.74, WEIGHT_DECAY=0.15, SCALAR_LR=0.3, MATRIX_LR=0.035, z-loss=2e-5, fixed grad clip=0.4) with FINAL_LR_FRAC=0.01 to prevent LR from hitting zero - small residual LR prevents wasted final steps	The aim of this study was to investigate the effect of a 2-week treatment with 2,3-dihydro-2,3-dihydro-2,3-dihydro-2,3-dihydro-2,3-dihydro-2,3-dihydro-2,3-dihydro-2,3-dihydro-2,3-dihydro-2,3-dihydro-2,3-dihydro-2,3-dihydro-2,3-dihydro-2,3-di
d192fde	0.000000	0.0	crash	Apply all proven best settings (TOTAL_BATCH_SIZE=2^17, WARMDOWN_RATIO=0.74, WEIGHT_DECAY=0.15, SCALAR_LR=0.3, MATRIX_LR=0.035, fixed grad clip=0.4) with reduced z-loss=1e-5 to test if lower z-loss combined with these settings beats current best [GPU: NVIDIA GeForce RTX 5070 Ti (16303MB VRAM)
Config: DEPTH=8, DEVICE_BATCH_SIZE=16, VRAM_LIMIT=158]	
8508d83	0.943579	6.0	discard	Apply all proven best settings: TOTAL_BATCH_SIZE=2^17, WARMDOWN_RATIO=0.74, WEIGHT_DECAY=0.15, SCALAR_LR=0.3, MATRIX_LR=0.035, z-loss=2e-5, fixed grad clip=0.4, and initialize resid_lambdas to 0.9 instead of 1.0 to slightly reduce residual scaling and potentially improve gradient flow	The aim of this study was to investigate the effect of the use of a combination of a combination of a combination of a combination of a combination of a combination of a combination of a combination of a combination of a combination of a combination of a combination of a combination of a combination of a combination of a combination of a combination of a combination of a combination of a combination of a combination of a combination of a combination of a combination of a combination of a combination of a combination of a combination of a combination
f404961	0.939983	6.0	keep	Apply all proven best settings (TOTAL_BATCH_SIZE=2^17, WARMDOWN_RATIO=0.74, WEIGHT_DECAY=0.15, SCALAR_LR=0.3, MATRIX_LR=0.035, z-loss=2e-5, fixed grad clip=0.4) with x0_lambdas initialized to 0.2 - the x0=0.2 experiment matched baseline but used worse base settings	The aim of this study was to investigate the effect of a combination of a combination of a combination of a combination of a combination of a combination of a combination of a combination of a combination of a combination of a combination of a combination of a combination of a combination of a combination of a combination of a combination of a combination of a combination of a combination of a combination of a combination of a combination of a combination of a combination of a combination of a combination of a combination of a combination of a combination
baf1c86	0.000000	0.0	crash	Remove MLP internal residual - MLP should be a pure transformation (no internal skip connection) since Block already handles the residual stream. Currently MLP returns x + residual where x is norm(input), creating an unintended double residual in Block. [GPU: NVIDIA GeForce RTX 5070 Ti (16303MB VRAM)
Config: DEPTH=8, DEVICE_BATCH_SIZE=16, VRAM_LIMIT=158]	
102fac2	0.944398	6.0	discard	Apply all proven best settings (TOTAL_BATCH_SIZE=2^17, WARMDOWN_RATIO=0.74, WEIGHT_DECAY=0.15, SCALAR_LR=0.3, MATRIX_LR=0.035, z-loss=2e-5, fixed grad clip=0.4, x0_lambdas=0.2) and use Adam beta1=0.9 for embedding/lm_head params (currently 0.8) for smoother gradient estimates on sparse embedding updates	The aim of this study was to investigate the effect of the use of a combination of the combination of the combination of the combination of the combination of the combination of the combination of the combination of the combination of the combination of the combination of the combination of the combination of the combination of the combination of the combination of the combination of the combination of the combination of the combination of the combination of the combination of the combination of the combination of the combination of the combination of the combination of the combination of the combination
de905bf	0.000000	0.0	crash	Replace ReLU² activation with GELU in MLP - GELU is smoother with non-zero gradients for small negative inputs and is widely used in modern LLMs [GPU: NVIDIA GeForce RTX 5070 Ti (16303MB VRAM)
Config: DEPTH=8, DEVICE_BATCH_SIZE=16, VRAM_LIMIT=158]	
b96395f	0.941843	6.0	discard	Apply all proven best settings (TOTAL_BATCH_SIZE=2^17, WARMDOWN_RATIO=0.74, WEIGHT_DECAY=0.15, SCALAR_LR=0.3, MATRIX_LR=0.035, z-loss=2e-5, fixed grad clip=0.4) with EMBEDDING_LR=0.5 as interpolation between 0.4 and 0.6 - not yet tried with current best settings	The aim of this study was to investigate the effect of the combination of a combination of a combination of a combination of a combination of a combination of a combination of a combination of a combination of a combination of a combination of a combination of a combination of a combination of a combination of a combination of a combination of a combination of a combination of a combination of a combination of a combination of a combination of a combination of a combination of a combination of a combination of a combination of a combination of a combination
