commit	val_bpb	memory_gb	status	description	sample_text
1f1aac1	0.947785	6.0	keep	Combine EMBEDDING_LR=0.55 and UNEMBEDDING_LR=0.010 with current best TOTAL_BATCH_SIZE=2**17 and MATRIX_LR=0.035 - both individually nearly matched baseline and the unembedding LR of 0.010 showed +0.0002 improvement, combining all three near-miss improvements simultaneously	The aim of this study was to investigate the effects of a single dose of 5 mg/kg of 5-fluorouracil (5-FU) on the expression of the genes involved in the development of the rat brain. The results showed that 5-FU treatment significantly reduced the expression of the genes involved in the development of the rat brain. The expression of the genes involved in the development of the rat brain was significantly reduced in the 5-FU-treated rats compared with the control
dd91f38	0.950090	6.0	discard	Set Adam beta2=0.999 for embedding and lm_head parameter groups (currently using 0.95) for more stable second moment estimates with these high-LR parameters, while keeping value_embeds and matrix params unchanged	The aim of this study was to investigate the effect of the use of a combination of a combination of a combination of a combination of a combination of a combination of a combination of a combination of a combination of a combination of a combination of a combination of a combination of a combination of a combination of a combination of a combination of a combination of a combination of a combination of a combination of a combination of a combination of a combination of a combination of a combination of a combination of a combination of a combination
c989c37	0.950393	6.0	discard	Set FINAL_LR_FRAC=0.05 with current best TOTAL_BATCH_SIZE=2**17 and MATRIX_LR=0.035 - a non-zero final LR prevents the model from stalling at the end of warmdown, and this hasn't been tried with the 2**17 batch size that gives the current best result	The aim of this study was to determine the effect of the presence of a single dose of 1.5 mg of 1.5 mg of 1.5 mg of 1.5 mg of 1.5 mg of 1.5 mg of 1.5 mg of 1.5 mg of 1.5 mg of 1.5 mg of 1.5 mg of 1.5 mg of 1.5 mg of 1.5
-------	0.000000	0.0	crash	FAILED TO APPLY: Reduce Muon ns_steps from 5 to 4 to speed up each optimizer step, allowing more gradient updates within the 5-minute budget with current best TOTAL_BATCH_SIZE=2**17 and MATRIX_LR=0.035 settings	
4392e11	0.947098	6.0	keep	Speed up Muon momentum warmup from 500 to 300 steps so full momentum is reached earlier, giving more training steps at optimal momentum with the small batch size TOTAL_BATCH_SIZE=2**17	The aim of this study was to investigate the effects of the combination of the two drugs on the expression of the genes involved in the development of the development of the development of the development of the development of the development of the development of the development of the development of the development of the development of the development of the development of the development of the development of the development of the development of the development of the development of the development of the development of the development of the development of the development of the development of
9a412c2	0.949990	6.0	discard	Reduce WARMDOWN_RATIO to 0.45 to spend more training time at peak LR, giving the model more steps at full learning rate before cooling down	The aim of this study was to investigate the effect of the use of a combination of a combination of a combination of a combination of a combination of a combination of a combination of a combination of a combination of a combination of a combination of a combination of a combination of a combination of a combination of a combination of a combination of a combination of a combination of a combination of a combination of a combination of a combination of a combination of a combination of a combination of a combination of a combination of a combination
622a81a	1.121438	6.0	discard	Use separate lower LR for value embeddings (0.3x embedding LR) since they receive different gradient signals than token embeddings and may benefit from more conservative updates	The aim of this study was to evaluate the effect of the 2-oxo-2-oxo-2-oxo-2-oxo-2-oxo-2-oxo-2-oxo-2-oxo-2-oxo-2-oxo-2-oxo-2-oxo-2-oxo-2-oxo-2-oxo-2-oxo-2-oxo-2-
61df0e0	0.954406	6.0	discard	Change x0_lambdas Adam beta1 from 0.8 to 0.9 for smoother skip connection parameter updates, and increase x0_lambdas LR multiplier from 3.0 to 4.0 for faster adaptation of the embedding skip connections with TOTAL_BATCH_SIZE=2**17	The aim of this study was to investigate the effect of the presence of a single dose of 1.5 mg/kg of the drug on the growth of the human prostate cancer cell line MCF-7. The effect of the drug on the growth of the prostate cancer cell line MCF-7 was investigated. The results showed that the drug was able to inhibit the growth of the prostate cancer cell line MCF-7. The effect of the drug on the growth of the prostate cancer cell line
351008e	0.945450	6.0	keep	Use fixed gradient clip norm of 0.5 instead of adaptive cosine schedule from 1.0 to 0.3 - with TOTAL_BATCH_SIZE=2**17 and many more steps, the adaptive clip may be suboptimal and a moderate fixed value could work better	The aim of this study was to investigate the effect of the combination of the combination of the combination of the combination of the combination of the combination of the combination of the combination of the combination of the combination of the combination of the combination of the combination of the combination of the combination of the combination of the combination of the combination of the combination of the combination of the combination of the combination of the combination of the combination of the combination of the combination of the combination of the combination of the combination of the combination
4311311	0.947663	6.0	discard	Speed up Muon momentum warmup from 300 to 200 steps so full momentum is reached even earlier, giving more training steps at optimal 0.95 momentum with the small batch size TOTAL_BATCH_SIZE=2**17	The aim of this study was to investigate the effect of the combination of the combination of the combination of the combination of the combination of the combination of the combination of the combination of the combination of the combination of the combination of the combination of the combination of the combination of the combination of the combination of the combination of the combination of the combination of the combination of the combination of the combination of the combination of the combination of the combination of the combination of the combination of the combination of the combination of the combination
e3594fa	0.950069	6.0	discard	Speed up Muon momentum warmup from 500 to 100 steps - reach full 0.95 momentum very quickly, maximizing the number of steps at optimal momentum with TOTAL_BATCH_SIZE=2**17	The aim of this study was to investigate the effect of the presence of a high-fat diet on the expression of the genes involved in the development of the liver and the liver. The expression of the genes involved in the liver development was examined in the liver of rats fed a high-fat diet. The expression of the genes involved in the liver development was examined in the liver of rats fed a high-fat diet. The expression of the genes involved in the liver development was examined in the liver of
1db1c2b	0.946355	6.0	discard	Combine fixed gradient clip norm of 0.5, TOTAL_BATCH_SIZE=2**17, MATRIX_LR=0.035, and Muon momentum warmup at 300 steps - the current train.py still has adaptive clipping and 2**19 batch size, combining all proven improvements	The aim of this study was to evaluate the effect of a new type of cement on the bone mineral density (BMD) of the hip and knee. The study was performed in 10 patients with hip and knee osteoarthritis (OA) and 10 healthy controls. The patients were divided into 3 groups: 1) the control group (n = 10) and 2) the cement group (n = 10) and the cement group (n
1db1c2b	0.947393	6.0	discard	Set TOTAL_BATCH_SIZE=2**17, MATRIX_LR=0.035, fixed gradient clip norm of 0.5, and Muon momentum warmup over 300 steps - combining all proven improvements that gave the current best 0.9455	The aim of this study was to investigate the effects of the presence of a single dose of a single dose of a single dose of a single dose of a single dose of a single dose of a single dose of a single dose of a single dose of a single dose of a single dose of a single dose of a single dose of a single dose of a single dose of a single dose of a single dose of a single dose of a single dose of a single dose of a single dose of a single
c769a21	0.946151	6.0	discard	Set TOTAL_BATCH_SIZE=2**17 with MATRIX_LR=0.035, fixed gradient clip norm of 0.5, and Muon momentum warmup at 300 steps - implementing the best near-miss combination (+0.0009) which hasn't been cleanly applied to the current baseline	The aim of this study was to evaluate the effect of the use of a combination of a combination of a combination of a combination of a combination of a combination of a combination of a combination of a combination of a combination of a combination of a combination of a combination of a combination of a combination of a combination of a combination of a combination of a combination of a combination of a combination of a combination of a combination of a combination of a combination of a combination of a combination of a combination of a combination
ac57a06	0.947594	6.0	discard	Apply best known settings (TOTAL_BATCH_SIZE=2**17, MATRIX_LR=0.035, fixed clip norm 0.5, Muon momentum warmup 300 steps) plus increase value_embeds weight_decay from 0.001 to 0.005 for stronger regularization on value embeddings	The aim of this study was to evaluate the effect of the use of a combination of a combination of a combination of a combination of a combination of a combination of a combination of a combination of a combination of a combination of a combination of a combination of a combination of a combination of a combination of a combination of a combination of a combination of a combination of a combination of a combination of a combination of a combination of a combination of a combination of a combination of a combination of a combination of a combination
10ed7a0	0.946389	6.0	discard	Apply proven best settings: TOTAL_BATCH_SIZE=2**17, MATRIX_LR=0.035, fixed gradient clip norm 0.5, Muon momentum warmup over 300 steps, plus try WARMDOWN_RATIO=0.53 for slightly more cooldown	The aim of this study was to evaluate the effect of the use of a combination of a combination of a combination of a combination of a combination of a combination of a combination of a combination of a combination of a combination of a combination of a combination of a combination of a combination of a combination of a combination of a combination of a combination of a combination of a combination of a combination of a combination of a combination of a combination of a combination of a combination of a combination of a combination of a combination
766e023	0.000000	0.0	crash	Apply proven best settings: TOTAL_BATCH_SIZE=2**17, MATRIX_LR=0.035, fixed gradient clip norm 0.5, Muon momentum warmup over 300 steps, and WARMDOWN_RATIO=0.55 for slightly more cooldown time [^^^^^^^^^^^^^^^^^^^^^^^^^^^^^^^^^^^^^^^^^^
File "/home/pat/.local/share/uv/python/cpython-3.12.13-li]	
cc081b8	0.950362	6.0	discard	Apply proven best settings (TOTAL_BATCH_SIZE=2**17, MATRIX_LR=0.035, fixed clip norm 0.5, Muon momentum warmup 300 steps) plus cosine-shaped LR warmdown instead of linear for smoother convergence	
204544a	0.946455	6.0	discard	Apply proven best settings (TOTAL_BATCH_SIZE=2**17, MATRIX_LR=0.035, fixed clip norm 0.5, Muon momentum warmup 300 steps) plus FINAL_LR_FRAC=0.01 for a tiny non-zero final LR to prevent complete stalling at end of warmdown	
6b82b6f	0.946566	6.0	discard	Apply all proven best settings cleanly: TOTAL_BATCH_SIZE=2**17, MATRIX_LR=0.035, fixed gradient clip norm 0.5, Muon momentum warmup over 300 steps (not 500), and EMBEDDING_LR=0.55 which showed improvement	The aim of this study was to determine the effect of a combination of a combination of a combination of a combination of a combination of a combination of a combination of a combination of a combination of a combination of a combination of a combination of a combination of a combination of combination of a combination of combination of a combination of combination of combination of combination of combination of combination of combination of combination of combination of combination of combination of combination of combination of combination of combination of combination of combination of combination of combination of combination
0e683f6	0.000000	0.0	crash	Apply best known settings (TOTAL_BATCH_SIZE=2**17, MATRIX_LR=0.035, fixed clip norm 0.5, Muon momentum warmup 300 steps) plus reduce z-loss from 1e-4 to 5e-5 to reduce logit regularization overhead [GPU: NVIDIA GeForce RTX 5070 Ti (16303MB VRAM)
Config: DEPTH=8, DEVICE_BATCH_SIZE=16, VRAM_LIMIT=158]	
1edaa20	0.000000	0.0	crash	Apply the proven best settings (TOTAL_BATCH_SIZE=2**17, MATRIX_LR=0.035, fixed clip norm 0.5, Muon momentum warmup 300 steps) plus add label smoothing of 0.1 to cross-entropy loss for better regularization []	
c0a072e	0.000000	0.0	crash	Reduce MLP expansion ratio from 4x to 3x to speed up each forward/backward pass, allowing more optimizer steps within the 5-minute budget. Combined with proven best settings: TOTAL_BATCH_SIZE=2**17, MATRIX_LR=0.035, fixed clip norm 0.5, Muon momentum warmup 300 steps. [GPU: NVIDIA GeForce RTX 5070 Ti (16303MB VRAM)
Config: DEPTH=8, DEVICE_BATCH_SIZE=16, VRAM_LIMIT=158]	
feb71b3	0.943930	6.0	keep	Apply proven best settings (TOTAL_BATCH_SIZE=2**17, MATRIX_LR=0.035, fixed clip norm 0.5, Muon momentum warmup 300 steps) plus reduce peak Muon momentum from 0.95 to 0.93 - slightly less aggressive momentum may work better with the very small batch size	
f25dabb	0.954899	6.0	discard	Add gradient centralization for matrix parameters: subtract mean gradient across output dimensions before clipping. This is a simple technique that can improve optimization by reducing gradient variance, not tried in any previous experiment.	The aim of this study was to evaluate the effect of the presence of a single dose of a single dose of a single dose of a single dose of a single dose of a single dose of a single dose of a single dose of a single dose of a single dose of a single dose of a single dose of a single dose of a single dose of a single dose of a single dose of a single dose of a single dose of a single dose of a single dose of a single dose of a single
6d77aa1	0.000000	0.0	crash	Give all transformer layers value embeddings instead of only alternating ones - increases model capacity for value residual mixing. Change has_ve to always return True. [^^^^^^^^^^^^^^^^^^^^^^^^^^^^^^^^^^^^^^^^^^^^^^^^^
File "/home/pat/autoresearch/.venv/lib/python3.12/]	
f5c521c	0.000000	0.0	crash	Add stochastic depth (layer dropout) with drop rate 0.1 - randomly skip layer contributions during training while keeping residual connections, providing regularization that improves generalization [File "/home/pat/autoresearch/.venv/lib/python3.12/site-packages/torch/_inductor/compile_fx.py", line]	
31f0d23	0.944443	6.0	discard	Apply best settings (TOTAL_BATCH_SIZE=2**17, MATRIX_LR=0.035, fixed clip 0.5, Muon momentum warmup 300 steps, peak momentum 0.93) plus increase Muon beta2 from 0.95 to 0.99 for more stable variance estimates with small batch size	The aim of this study was to determine the effect of the presence of a single dose of 1,25-dihydroxyvitamin D3 (1,25(OH)2D3) on the expression of the genes encoding the vitamin D receptor (VDR) and the expression of the genes encoding the vitamin D receptor (VDR) and the vitamin D receptor (VDR) in the liver. The results showed that the presence of 1,25(OH)2D3
0b60b56	1.079947	6.0	discard	Change rotary embedding base frequency from 50000 to 10000 (standard RoPE value) - this affects position encoding and hasn't been tried. With sequence length 2048, the standard 10000 base may give better frequency coverage.	The aim of this study was to evaluate the effect of the use of a new antidepressant, a new antidepressant, on the efficacy of the antidepressant, and the antidepressant, in the treatment of chronic hepatitis C. The study was performed in 12 patients with chronic hepatitis C (CHC) and in 12 patients with chronic hepatitis C (CHC). The antidepressant, antidepressant, and antidepressant, anti
0db8e98	0.944413	6.0	discard	Apply all proven best settings (TOTAL_BATCH_SIZE=2**17, fixed clip 0.5, Muon momentum warmup 300 steps, peak momentum 0.93) with MATRIX_LR=0.033 - slightly lower than 0.035 to better match the reduced momentum of 0.93 which changes effective step size	The aim of this study was to determine the effect of a 2-week treatment with a 2-week treatment with a 2-week treatment with a 2-week treatment with a 2-week treatment with a 2-week treatment with a 2-week treatment with a 2-week treatment with a 2-week treatment with a 2-week treatment with a 2-week treatment with a 2-week treatment with a 2-week treatment with a 2-week treatment with a 2-week treatment
fe0fe9e	0.944979	6.0	discard	Apply all proven best settings to current train.py: TOTAL_BATCH_SIZE=2**17, MATRIX_LR=0.035, fixed gradient clip norm 0.5, Muon momentum warmup over 300 steps (not 500), peak momentum 0.93, and slightly increase EMBEDDING_LR to 0.65	
77cccae	0.944401	6.0	discard	Apply proven best settings (TOTAL_BATCH_SIZE=2**17, MATRIX_LR=0.035, fixed clip 0.5, Muon momentum warmup 300 steps, peak momentum 0.93) plus EMBEDDING_LR=0.65 and UNEMBEDDING_LR=0.010 - combining embedding LR improvements that individually showed gains	The aim of this study was to investigate the effect of the presence of a single dose of 1.5 mg/kg of a single dose of 1.5 mg/kg of a single dose of 1.5 mg/kg of a single dose of 1.5 mg/kg of a single dose of 1.5 mg/kg of a single dose of 1.5 mg/kg of a single dose of 1.5 mg/kg of a single dose of 1.5 mg
a8b06aa	0.000000	0.0	crash	Apply all proven best settings (TOTAL_BATCH_SIZE=2**17, MATRIX_LR=0.035, fixed clip 0.5, momentum warmup 300 steps, peak momentum 0.93) plus reduce Muon ns_steps from 5 to 3 to speed up each optimizer step and allow more gradient updates in the 5-minute budget [GPU: NVIDIA GeForce RTX 5070 Ti (16303MB VRAM)
Config: DEPTH=8, DEVICE_BATCH_SIZE=16, VRAM_LIMIT=158]	
8b68c5a	0.000000	0.0	crash	Apply all proven best settings (TOTAL_BATCH_SIZE=2**17, MATRIX_LR=0.035, fixed clip 0.5, momentum warmup 300 steps, peak momentum 0.93) plus increase logit softcap from 12 to 20 to allow larger logit magnitudes for more expressive output distribution [File "/home/pat/autoresearch/.venv/lib/python3.12/site-packages/torch/_inductor/compile_fx.py", line]	
6ba3673	0.948115	6.0	discard	Reverse weight decay schedule: start from 0 and ramp UP to WEIGHT_DECAY over training (instead of cosine decay from high to low). With small batch size and many steps, starting with low regularization allows faster early learning, then increasing WD provides regularization as model converges. Combined with proven best settings.	The aim of this study was to investigate the effect of the use of a combination of a combination of a combination of a combination of a combination of a combination of a combination of a combination of a combination of a combination of a combination of a combination of a combination of a combination of a combination of a combination of a combination of a combination of a combination of a combination of a combination of a combination of a combination of a combination of a combination of a combination of a combination of a combination of a combination
2e3d781	0.952315	6.0	discard	Remove the internal residual connection inside MLP - the Block already adds a residual so MLP having its own creates a double-residual that wastes capacity. This is a bug fix that should improve model expressiveness.	
a427409	0.000000	0.0	crash	Apply all proven best settings (TOTAL_BATCH_SIZE=2**17, MATRIX_LR=0.035, fixed clip 0.5, momentum warmup 300 steps, peak momentum 0.93) with WARMDOWN_RATIO=0.48 - slightly less warmdown than current 0.5 to spend more time at peak LR, a value not yet tried []	
d6403e9	0.000000	0.0	crash	Apply all proven best settings: TOTAL_BATCH_SIZE=2**17, MATRIX_LR=0.035, fixed clip norm 0.5, Muon momentum warmup 300 steps, peak momentum 0.93, plus try constant weight decay instead of cosine-decaying weight decay - the decay may be removing useful regularization too early []	
d0fac87	0.944311	6.0	discard	Apply all proven best settings (TOTAL_BATCH_SIZE=2**17, MATRIX_LR=0.035, fixed clip 0.5, momentum warmup 300 steps, peak momentum 0.93) plus set WARMDOWN_RATIO=0.46 to spend slightly more time at peak LR - this specific combination hasn't been tried	The aim of this study was to determine the effect of the presence of a single dose of 1.5 mg/kg of 1.5 mg/kg of 1.5 mg/kg of 1.5 mg/kg of 1.5 mg/kg of 1.5 mg/kg of 1.5 mg/kg of 1.5 mg/kg of 1.5 mg/kg of 1.5 mg/kg of 1.5 mg/kg of 1.5 mg
fd00d03	0.946009	6.0	discard	Apply all proven best settings (TOTAL_BATCH_SIZE=2**17, MATRIX_LR=0.035, fixed clip 0.5, momentum warmup 300 steps, peak momentum 0.93, EMBEDDING_LR=0.65, UNEMBEDDING_LR=0.010) plus WARMDOWN_RATIO=0.44 - slightly less warmdown than the +0.0004 near-miss of 0.46, spending even more time at peak LR	
